"review_id","title","body","pros","cons","rating","date","role","location","employmentStatus","_source"
"9662977","Summer Associate","Summer Associate","Growing quickly, brand momentum in the US and globally, top-notch leadership team.","Able to attract top-shelf talent at Managing Director level, though junior level talent needs improvement.","5.0","2016-02-22T16:10:05.337","Former employee - Summer Associate","New York, NY","","next_f"
"9522964","Mish Mash","Mish Mash","Good conservative bank, conservative culture, good group of people, very Canadian and respectful.","underpay most people, terrible technology, never fully integrate acquisitions so company as a whole is a mish mash of a bunch of other companies and teams, at least in the US.","4.0","2016-02-10T10:46:29.247","Former employee - Portfolio Manager","New York, NY","REGULAR","next_f"
"9508457","nice work culture","nice work culture","nice culture, flex hours, oportunities","not a major US player","5.0","2016-02-09T10:08:03.333","Current employee - Director","New York, NY","REGULAR","next_f"
"9402765","Internal Wealth Consultant","Internal Wealth Consultant","Conservative company that has always done right by the clients. Good work/life balance.","On the lower side of the pay scale.","4.0","2016-01-31T15:48:19.707","Current employee - Internal Wealth Consultant","Eden Prairie, MN","","next_f"
"9332278","RBC","RBC","Ability to achieve a work-life balance","many functional groups are in different locations from the internal clients","3.0","2016-01-25T18:04:17.533","Current employee","New York, NY","","next_f"
"9325564","Solid place to work","Solid place to work","Many international locations and opportunity for advancement","Many international locations and needs more internal communication","4.0","2016-01-25T10:11:17.300","Former employee","New York, NY","REGULAR","next_f"
"9259549","RBC- Capital Markets","RBC- Capital Markets","Great Benefits, great compensation, room for advancement","Their are no cons for this company.","4.0","2016-01-19T20:47:19.047","Former employee - Junior Relationship Officer","Lake Mary, FL","","next_f"
"9224441","Teller","Teller","Easy job that allows you to get know your customer.","No chance of promotion from Teller position.","2.0","2016-01-17T05:09:11.990","Current employee - Teller","Lake Mary, FL","","next_f"
"9221025","Overall nice people but upper mgmt in finance act as if they are mafia","Overall nice people but upper mgmt in finance act as if they are mafia","Good people and willing to collaborate with one another from different departments and compensation level is fair. Also, the size is smaller than most investment banks so you can see and learn more.","New CFO in NY about a decade ago has changed professional work environment to mafia house. Controller/Assistant controller and many good people all left and vacancies were filled with his favorites flatterer based on friendship rather than professional work skills. Current management is very political, conniving and lacks ethical value. Innocent becomes convicted and wrongdoers get praised as long as they whisper into management's ear. Always remember, good professional people surround a great leader, but political, flatterers surround a dictator.","3.0","2016-01-16T15:57:49.063","Current employee","New York, NY","REGULAR","next_f"
"9216125","Great place to work","Great place to work","Good culture. Good pay. Good management","Slow moving at times. Very conservative.","4.0","2016-01-16T05:27:51.963","Former employee","New York, NY","","next_f"
"9139232","Associate","Associate","Less bureaucratic than bulge bracket banks and more freedom to operate independently. RBC also ends its year earlier than other banks, allowing for earlier bonus payouts.","The expense policy and overall compensation is definitely lacking compared to larger peers. Further, your voice in a satellite office (non-NYC) is not heard or outright ignored. Finally,the ability to move up in the organization is very limited.","3.0","2016-01-10T09:46:57.987","Current employee","San Francisco, CA","REGULAR","next_f"
"9138086","RBC Capital","RBC Capital","Great Support - Family type of atmosphere for a brokerage house.","On the small side and Minneapolis is a little backwards","4.0","2016-01-10T06:57:32.023","Former employee - Financial Advisor","Beverly Hills, CA","","next_f"
"8956906","Desktop Support Engineer","Desktop Support Engineer","good place, Did Migration Support and Desktop support","RBC is a great Company Love working there, contract ended","5.0","2015-12-18T17:16:26.107","Former employee - Help Desk/Desktop Support Engineer","Brooklyn, NY","","next_f"
"8927639","Global Markets Analyst","Global Markets Analyst","Very friendly work environment with strong mentorship and a meritocracy based culture","RBC is a mid-sized bank and looks to be stuck in this position for the foreseeable future.","4.0","2015-12-15T15:37:41.437","Current employee - Global Market Analyst","New York, NY","","next_f"
"8904271","Great place","Great place","Great place to work and provides a great work life balance. Great people to work with and a great place if you're looking to climb the ladder","It's no longer RBC bank, PNC purchased them in 2012. Corporate office is no longer Atlanta, but the office is very nice.","5.0","2015-12-13T08:17:37.190","Former employee","Atlanta, GA","","next_f"
"8895442","Nowhere to go","Nowhere to go","Work/life balance, not much else","There are no growth opportunities. Many associates have been in the same role for 10+ years and are stagnant. The same doesn't work for other associates with ambition or higher career goals, but management expects that you should be happy to have a job. Technology is completely outdated.","3.0","2015-12-11T19:11:35.087","Current employee - Compliance","Dallas, TX","REGULAR","next_f"
"8882914","Bad Stay Away. they will fire you for younger employees","Bad Stay Away. they will fire you for younger employees","great facilities and corporate environment","will eventually move positions from NY to Toronto. They hire on the cheap there and get rid of experienced employees in NY","1.0","2015-12-10T12:00:34.567","Former employee - Associate","New York, NY","REGULAR","next_f"
"8866545","Senior Consultant - Operational Readiness","Senior Consultant - Operational Readiness","Everyone works collaboratively across the Enterprise and Capital Markets","Enterprise adaptation will present challenges","5.0","2015-12-09T07:44:08.003","Current employee - Principal/Senior Consultant","Holmdel, NJ","","next_f"
"8786460","Analyst","Analyst","Experienced leadership. Compensation is decent. Interesting niche clientele.","A small bank with the overhead of a large bank due to the relationship with the parent. Expect long hours and a what are you doing for me tomorrow attitude. Advancement is difficult as external candidates seem to be preferred to internal candidates. Little time for development opertunities due to the heavy regular work load. At no other company have I seen office politics as cut throat as RBC.","2.0","2015-12-01T03:59:47.507","Current employee","Raleigh, NC","REGULAR","next_f"
"8741208","Good place to work","Good place to work","* work-life balance, not too stressful * satisfactory compensation","* technology is not the best * slightly outdated policies","3.0","2015-11-24T15:29:33.797","Current employee","New York, NY","REGULAR","next_f"
"8717309","Cross Border Morgage Advisor","Cross Border Morgage Advisor","Good benefits. Unfortunately that's where it ends if you are in a sales role.","I have never seen an organization that hates the sales staff as is the case at RBC Bank. They constantly reduce the staff yearly while continue to increase the goals. While sales people constantly get reduced they will turn around and hire more audit, risk and anything else that is a cost to the company while the department (sales) that actually brings in revenue is constantly under the gun and no matter how well you do the CEO still treats you like trash.","2.0","2015-11-22T04:08:43.953","Former employee","Raleigh, NC","REGULAR","next_f"
"8712750","great place","great place","great place to work eh?","are none i know of","4.0","2015-11-21T08:57:35","Current employee","Norwalk, CT","REGULAR","next_f"
"8627440","Internship","Internship","I have a great group of coworkers","It's a pretty small office","5.0","2015-11-12T16:19:36.280","Current employee - Wealth Management Intern","Baltimore, MD","","next_f"
"8563323","Wealth Management","Wealth Management","Open to exploring all parts of the bank, not just the one I interned with. Very open and encouraging culture. Up and coming.","Poor brand recognition. Hard to bring in new clients.","4.0","2015-11-06T10:23:31.087","Former employee - Intern","New York, NY","","next_f"
"8413369","A Great Place to start your carrier or Retire with minimum skills set and efforts.","A Great Place to start your carrier or Retire with minimum skills set and efforts.","Great benefits and excellent work environment. (Laid Back Style). I have been in finance Industry over 35 years. Never seems such a great place. (To best describe I will say LA work style in NYC/NJ) Lots of time/opportunities for full time employees to learn and grow in the field if they are correctly connect with needed political string. Great culture and very nice people around. Work and life balance. Perfect place for interns and young college graduates to learn and be ready to enter into financial world without stress and knowing too much about IT. Perfect place for the people who want to be in finance industry but don't what to deal with high pressure rewarding positions. A perfect place for job security you can retire from one place with minimum skill set. For full time employees almost impossible to get fired unless you bring down the whole bank.","$7b","4.0","2015-10-23T21:34:06.910","Former employee - IT Solutions Architect","New York, NY","REGULAR","next_f"
"8380974","Associate Director","Associate Director","good company, good salary and benefits","promotion process not very good","4.0","2015-10-21T10:05:59.363","Current employee - Associate Director","New York, NY","REGULAR","next_f"
"8346664","No Direction","No Direction","It's an easy-going atmosphere and the office is quiet. The laid back culture can be both good and bad, as there are extended periods where you sit around waiting to be assigned something to do.","They have absolutely no concept of how to scope out a technical project. They let business analysts drive ""how"" instead of ""what"", and since they are inevitably incapable of doing that, there were hundreds of people sitting around for six months - putting in creatively-written weekly status reports explaining what had been ""accomplished"", when in fact, everybody was blocked on 100% of their assigned tasks for six months because of a complete and utter lack of leadership. I finally gave up (as I couldn't take going to work and having absolutely nothing to do for months on end) and left.","2.0","2015-10-18T20:14:49.883","Former employee - Software Developer","New York, NY","","next_f"
"8317221","OK","OK","Smart people. Franchise is growing. Clearly committed to expanding in the US. Has some real mandates. Leveraged finance platform growing.","Name still not as good as big bulge banks for analysts looking to follow 2+2 path. Some peculiarities working for a bank with head office in Canada versus US","4.0","2015-10-15T17:58:09.107","Former employee - Analyst","New York, NY","REGULAR","next_f"
"8195195","Rbccm is a middle market bank that has built a business model of being on the right (non-leading).","Rbccm is a middle market bank that has built a business model of being on the right (non-leading).","Work-life balance. Culture is relatively non-confrontational. Soft landing for senior bankers leaving bulge bracket banks or for junior bankers looking to stay in IB without having to work long hours.","Lacks strong M&A platform. Rarely leads deals. Very political - you're either liked or disliked by senior members of the leveraged finance group and your rise in the firm is affected accordingly. Deals are middle of the fairway - meaning you won't be working on anything complex or above the purview of RBC's credit committee. Not a place for talented individuals looking to spread their wings. Technology is an issue. Not a place to grow a career.","1.0","2015-10-06T07:27:33.867","Former employee - Vice President, Global Investment Banking","New York, NY","REGULAR","next_f"
"8190857","Mediocre management team","Mediocre management team","Work life balance is decent and the location is great.","Management is mediocre at best.","1.0","2015-10-05T19:40:23.470","Former employee - Analyst","New York, NY","REGULAR","next_f"
"8122476","senior program leader","senior program leader","Solid, firm with a great brand","Too concerned about cutting costs versus delivering quality","3.0","2015-09-29T15:51:40.493","Former employee","Scottsdale, AZ","","next_f"
"8057630","Project Manager","Project Manager","International company with some Canadian DNA","Highly political organization. Difficult to move up on merit alone.","2.0","2015-09-23T19:34:18.843","Former employee","Minneapolis, MN","REGULAR","next_f"
"8049979","IT Analyst","IT Analyst","Above average work life balance and some attempts made for training","Horrible middle and upper management. They had no strategy.","3.0","2015-09-23T09:20:47.373","Former employee - Incident Management","New York, NY","REGULAR","next_f"
"7994180","There's a lot of mediocrity being celebrated, and a lot of wonderful stuff being ignored or discouraged","There's a lot of mediocrity being celebrated, and a lot of wonderful stuff being ignored or discouraged","A few really great people Hours aren't terrible","$78","1.0","2015-09-18T07:05:21.603","Current employee","New York, NY","","next_f"
"7949812","Senior Registered Client Associate","Senior Registered Client Associate","Great company to grow your business, many resources offered.","No Opportunities for advancement outside of headquarters.","4.0","2015-09-14T19:10:33.747","Current employee - Senior Registered Client Associate","Philadelphia, PA","REGULAR","next_f"
"7850911","Corporate Banking Summer Analyst","Corporate Banking Summer Analyst","The bank is rapidly growing and has a laid back culture.","The group is not very well respected within the bank.","4.0","2015-09-05T10:57:28.560","Former employee - Institutional Client Management","New York, NY","","next_f"
"7706709","Executive Assistant","Executive Assistant","Room for growth. Many employees have been there for 10 plus years who can help mentor you. Many opportunities","Corporate office setting. A little hint of old boys club.","5.0","2015-08-24T17:00:24.017","Former employee - Executive Assistant","Minneapolis, MN","","next_f"
"7650156","Decent","Decent","- Lots of resources at the disposal of an Analyst - Decent hours","- Quality of deals are too simplistic for those seeking an intellectually stimulating experience - Balance sheet investment bank so proportion of M&A transactions to vanilla equity/investment grade offerings are 5:95","3.0","2015-08-19T17:09:40.067","Former employee - Investment Banking","New York, NY","","next_f"
"7610908","Good platform","Good platform","Good platform to work on, gaining market share, decent comp","Little transparency in terms of promotions. Sometimes, it feels like there is too much nepotism and not enough meritocracy","3.0","2015-08-17T08:33:09.267","Current employee - Vice President","New York, NY","","next_f"
"7531180","associate","associate","Great benefits and perks and lovely commute","relocated to Canada which caused rbc to lay off the operations team","4.0","2015-08-10T19:50:31.610","Former employee - Associate Dtc Settlements","New York, NY","","next_f"
"7521636","Culture for the win","Culture for the win","Plain and simple, they don't hire jerks. If you want to work on Wall Street, love markets, and get paid like you work on Wall Street, but work in a non-hostile environment, this is your place.","Brand name, people won't know where you work. People may even confuse you with RBS. Not many opportunities on the trading floor, only a few products to learn about.","5.0","2015-08-10T08:17:05.757","Current employee - Global Markets Analyst","New York, NY","","next_f"
"7484638","Great Canadian Bank","Great Canadian Bank","Great salary and offices make with the tip best place to work for its very nice an lots of growth potential","No organisation in the management they are pulling in different directions and its sometimes very unhealty","5.0","2015-08-06T13:44:13.143","Current employee - Financial Analyst","Montrose, VA","","next_f"
"7411179","Intern in IT","Intern in IT","Everyone I spoke to was nice and willing to help me succeed","There wasn't a lot of exciting technical work being done.","3.0","2015-07-30T21:21:39.420","Current employee","Washington, DC","","next_f"
"7336874","Great company !!!","Great company !!!","Benefits Flexible Family friendly location downtown","None in my experience there.","5.0","2015-07-24T07:16:26.137","Former employee - Supervisor","Minneapolis, MN","","next_f"
"7253325","Vice President","Vice President","Great company, good pay, growing","a little slow and conversative","5.0","2015-07-16T20:05:16.023","Former employee - Vice President","New York, NY","","next_f"
"7252387","Client service associate","Client service associate","Friendly work environment but can be very cliquey.","Management should recognize the support staff in more ways than just providing breakfast or lunch a few times a year. Compensation is below par, as are the bonuses. Management tends to play favorites with the support staff which leaves the rest of us feeling very undervalued. This is a tough balancing act type of position. The brokers are never wrong and management always sides with the brokers. This company is not one I would recommend, as I have worked for others, and the hierarchy was different. Currently looking for a CSA position elsewhere.","1.0","2015-07-16T18:11:27.513","Current employee - Senior Registered Client Service Associate","Florham Park, NJ","REGULAR","next_f"
"7220980","CSA","CSA","The office space is nice, the staff is friendly. The systems are semi-user friendly.","They undervalue support staff. Managers pick and choose favorites, and spend money on things rather than giving deserving employees compensation. Lots of red tape and gossiping.","2.0","2015-07-14T10:04:53.890","Former employee - Registered Client Service Associate","Seattle, WA","","next_f"
"7088513","Ehhh","Ehhh","Growing Generally pleasant people Well paid ok hours for the industry","Not the most sophisticated bank low brand recognition Some awful attitudes","3.0","2015-07-01T19:57:11.453","Current employee","New York, NY","","next_f"
"7009084","Solid, Growing Firm.... Not there yet","Solid, Growing Firm.... Not there yet","-Growing firm -Not looking over shoulder -Decent hours for Wall Street -Good energy","-Brand recognition not there yet -Hard to get out","3.0","2015-06-24T13:35:48.703","Current employee - Analyst","New York, NY","REGULAR","next_f"
"6960627","Okay","Okay","Greet staff Great team work Great customer service experience","Low Pay Blame customer service representatives for all mistakes Cheap","1.0","2015-06-19T13:22:29.510","Former employee","Brooklyn, NY","REGULAR","next_f"
"6889613","Account Manager","Account Manager","Great people to work with. Great information to provide to client with decent tools.","Work life balance not there. Expected to hit targets even if 60+hours were needed. For the pay the time put in was not worth it.","4.0","2015-06-12T16:42:35.920","Former employee - Account Manager","Ontario, CA","REGULAR","next_f"
"6845768","Canadian I-Bank","Canadian I-Bank","Many have worked at RBC for over 25 years. Small and trying to catchup to other I-Banks so pockets of entrepreneurialism still exist. Can make an imprint in areas and product groups that still need development.","I agree with the prior posts about senior management and promotions for multiple roles globally going to Canadians as well as the notable gender bias presented under the veneer of 'RBC nice'.","3.0","2015-06-09T06:24:09.353","Former employee - Managing Director","New York, NY","","next_f"
"6833614","good company","good company","best job ever - good company","moved to toronto canada recently","5.0","2015-06-08T06:47:05.017","Former employee - GPS/ICI/ADP SPECIALIST","Edison, NJ","","next_f"
"6809645","Great Company","Great Company","Great people. Respectful workplace and low turnover rate. Puts focus on clients first. Always strive to open communication and listen to employees feedback.","Not much room for career growth or slow progression. Stagnant salary improvement.","5.0","2015-06-05T03:41:42.237","Current employee","New York, NY","REGULAR","next_f"
"6657957","unix/storage administrator","unix/storage administrator","none - avoid this firm at all costs","poor pay, useless management who talk endlessly about hoe much they value their employees all the while figuring out how to screw them some more.","1.0","2015-05-20T13:18:59.203","Former employee","New York, NY","","next_f"
"6437812","Front Office Manager- Trade Support, Risk and Compliance","Front Office Manager- Trade Support, Risk and Compliance","Good management, Nice colleagues, Flexible work life balance, career growth opportunities","Biased Senior Management, Sexual violence at its peak, manipulation","5.0","2015-04-25T12:54:32.390","Current employee","New York, NY","REGULAR","next_f"
"6416323","Senior relationship advisor","Senior relationship advisor","Great people and a fast paced environment. You'll never get bored here.","Don't have much negative to say. Management definitely plays by the rules so expect to ""dot the i's and cross the r's"".","4.0","2015-04-22T23:22:24.440","Former employee - Senior Relationship Manager","San Francisco, CA","","next_f"
"6299740","Vice President","Vice President","general relaxed environment, working hours not bad","system infrastructures aren't centralized and well developed","2.0","2015-04-09T12:38:28.357","Current employee - Vice President","New York, NY","REGULAR","next_f"
"6222421","Good place to work, but I have a few caveats....","Good place to work, but I have a few caveats....","Plenty of resources to do your job. Benefits were good when I was there and there is plenty of quality individuals within the organization.","The compensations system for my area was a bit of a black box. I had a very hard time figuring out what I felt the correct compensation was based on my production.","4.0","2015-03-30T07:48:03.413","Former employee","New York, NY","","next_f"
"6189053","This is a company that compensates employees well with a good work/life balance.","This is a company that compensates employees well with a good work/life balance.","Work/life balance, competitive compensation, company values, high integrity within the financial services industry, opportunity for personal growth, accessible corporate structure","While pay is competitive, RBC is very slow to promote employees. There are not title promotions. Additionally, RBC is very slow to adapt to the changing market environment.","5.0","2015-03-25T05:59:46.867","Current employee - Research Analyst","New York, NY","REGULAR","next_f"
"6081622","Solid Firm, Working Toward Bulge Bracket but Not Quite There","Solid Firm, Working Toward Bulge Bracket but Not Quite There","Generally friendly culture, decent deal flow","Not much M&A in investment banking, mostly capital markets, not enough lead left underwriting. A lot of co-manager roles and non-lead left bookrunning. Very long hours given that it's not quite at the very top tier of investment banks.","3.0","2015-03-09T12:13:54.853","Former employee - Investment Banking Analyst","New York, NY","REGULAR","next_f"
"5919723","RBC is a very professional, well run company.","RBC is a very professional, well run company.","Laid back atmosphere, great location in downtown Manhattan.","Sometimes deadlines can be stressful.","5.0","2015-02-14T18:47:59.810","Current employee - Financial Analyst","New York, NY","","next_f"
"5860820","Exciting, promising, and very inclusive.","Exciting, promising, and very inclusive.","People are down-to-earth, smart, friendly, and exceptionally passionate about their work, their clients, and about RBC. The company does a lot to invest in the employees and makes you feel wanted, rewarded, and informed to the best of their ability.","I believe this is more of an industry con, but too many books are done, some of which are not even required in the first place. Specifically to RBC, it is probably the best time to take lead and move officially into bulge bracket.","5.0","2015-02-05T20:51:25.907","Current employee - Associate, Global Investment Banking","New York, NY","REGULAR","next_f"
"5858682","Chaotic Hell","Chaotic Hell","Higher pay than competitive companies.","Horrible training program. The first 1.5 months I literally had nothing to do. The department was too busy to train me in. Forget about lunch! You won't have time to take one. Management is hands down the worst I have ever seen in a company. In the 12 months I workes there my department had a 120% turnover rate in staff. That's not an exaggeration either.","2.0","2015-02-05T15:30:01.997","Former employee - Senior Associate, Treasury","Minneapolis, MN","","next_f"
"5808197","Good bank, moving up league tables","Good bank, moving up league tables","- Moving up league tables - Stable bank","- Mediocre bankers - Bonuses not as stable as they used to be","4.0","2015-01-29T12:52:32.530","Former employee - Associate","San Francisco, CA","REGULAR","next_f"
