"review_id","title","body","pros","cons","rating","date","role","location","employmentStatus","_source"
"102984919","Meh","Meh","- decent leadership and strong business","- terrible tech - Dont take lunches typically","3.0","2026-02-27T08:29:32.560","Current employee - Registered Client Associate","Walnut Creek, CA","REGULAR","next_f"
"102969338","Great company and great people","Great company and great people","They have a good pay, learning curve and benefits","Late nights and quarterly working Saturdays can be challenging","5.0","2026-02-26T07:13:58.463","Former employee - Financial Analyst","New York, NY","REGULAR","next_f"
"102943318","SALARY","SALARY","Good culture, good pay and easy commute","Back management, politics and bad internal movement","4.0","2026-02-24T13:29:21.147","Current employee - VP","New York, NY","REGULAR","next_f"
"102932785","Review","Review","Work with great people in NY","Comp can be better and align with the street","4.0","2026-02-23T22:42:25.927","Former employee - Associate","New York, NY","REGULAR","next_f"
"102861013","Great place to work and grow","Great place to work and grow","Lots of opportunity to move around as it is a global organization and you can build a great network.","can be very demanding if you are on the technology side and involved with audit and regulatory projects","5.0","2026-02-17T17:16:19.420","Current employee - Senior Director Technology","Jersey City, NJ","REGULAR","next_f"
"102848307","NA","NA","good culture, good people, high learning","too corporate, favorites, not as much runway","4.0","2026-02-16T19:18:28.803","Current employee - Analyst","New York, NY","REGULAR","next_f"
"102771618","Great spot!","Great spot!","Nice office, friendly people. RTO is in effect but its not strict.","More reasons to come in would be cool!","5.0","2026-02-10T07:14:49.237","Current employee - Manager","Raleigh, NC","REGULAR","next_f"
"102745779","Good place","Good place","Good to collaborate with others in the environment","No free food in kitchen","4.0","2026-02-08T23:48:28.670","Former employee - Data Entry Clerk","Toronto, OH","REGULAR","next_f"
"102681915","Intern look","Intern look","Great company to work at","Super cold in the winter","5.0","2026-02-04T18:39:51.983","Current employee - Intern","New York, NY","REGULAR","next_f"
"102564597","A good culture","A good culture","Full of people who are willing to help you learn. They don’t make you feel stupid for asking questions and generally want to see you succeed","Opportunities are sometimes limited. You have to really seek out ways to grow.","5.0","2026-01-29T18:28:34.317","Current employee - Associate","New York, NY","REGULAR","next_f"
"102518112","Greate company","Greate company","Lots of internal mobility and RBC has committed to expanding its US Wealth Management arm","Company is growing very quickly. Technology is lacking but they are making improvements and taking feedback.","5.0","2026-01-27T20:47:22.627","Current employee - Consultant","Chicago Heights, IL","REGULAR","next_f"
"102467619","Good company","Good company","Comparably chilled environment in a cut-throat industry","Not much to complain about","3.0","2026-01-25T12:11:17.810","Former employee - Associate","New York, NY","REGULAR","next_f"
"102255176","Depends on the team","Depends on the team","Very supported by management and higher level admin.","It all depends on the team where you are placed Wealth Management wise","4.0","2026-01-14T09:27:14.917","Current employee - Registered Client Associate","New York, NY","REGULAR","next_f"
"102239133","Analyst","Analyst","Great team environment with access to senior team members","pay is less than market average","5.0","2026-01-13T17:33:43.467","Current employee - Analyst","New York, NY","REGULAR","next_f"
"102122161","Friendly environment","Friendly environment","Friendly team members. Work was challenging and interesting. Ability to move internally.","401k does not vest immediately","4.0","2026-01-07T13:00:39.363","Former employee - Analyst","New York, NY","REGULAR","next_f"
"102092367","Solid place to work","Solid place to work","Professional culture with a transparent review process","Long working hours in particular groups","4.0","2026-01-06T07:05:59.170","Former employee - Associate","New York, NY","REGULAR","next_f"
"101874726","Good","Good","Good people, good culture, helpful","none, good entry level position","2.0","2025-12-17T17:04:36.987","Former employee - Business Analayst","Jersey City, NJ","REGULAR","next_f"
"101779172","It’s aight","It’s aight","Salary, growth opportunity, diversity inclusion","Poor technology, no work life balance","3.0","2025-12-11T15:43:23.813","Current employee - Investment Associate","Walnut Creek, CA","REGULAR","next_f"
"101673848","RBC Registered CA","RBC Registered CA","benefits, flexibility, learning opportunities, atmosphere","raises and bonuses do not keep up with basic cost of living","3.0","2025-12-05T14:29:15.063","Current employee - Registered Client Associate","Phoenix, AZ","REGULAR","next_f"
"101558765","Incredible people to work with","Incredible people to work with","Overall, and this is obviously dependent on luck within your department, everyone is very nice, agreeable and overextending.","Training is abysmal, service portal is useless and no one in the professional world uses Webex.","4.0","2025-11-29T23:43:13.353","Current employee - Paralegal","New York, NY","REGULAR","next_f"
"101484666","Good starting point","Good starting point","Great management and support systems","high turnover rates which leads to under staffing","5.0","2025-11-25T07:12:16.913","Current employee - Internal Auditor","Jersey City, NJ","REGULAR","next_f"
"101386406","OK but frustrating","OK but frustrating","Great benefits and stable bank culture. Ability to work from home 1 day per week.","Working for RBC Wealth Management is incredibly frustrating if you're a city person and like to get things done quickly. RBC employees often have a Midwestern slowness / lack of urgency that makes client service difficult if you live in the big city. Little to no instructions or training on the job. California managers have no idea what's going on.","3.0","2025-11-19T18:26:59.383","Current employee - Registered Client Associate","Los Angeles, CA","REGULAR","next_f"
"101265800","Work/Life Balance","Work/Life Balance","Work life balance depends on the group you are in, but was very positive for me","Culture and sometimes lack of MDs checking in","4.0","2025-11-13T12:19:13.063","Former employee - Investment Banking Associate","New York, NY","REGULAR","next_f"
"101215889","silo'd firm","silo'd firm","comp is competitive in most areas","technology is slow to update, heavily silo'd if you need to work in an enterprise role","3.0","2025-11-11T13:37:38.610","Current employee - Compliance Officer","Los Angeles, CA","REGULAR","next_f"
"101149975","Great opportunity to learn and grow your career","Great opportunity to learn and grow your career","- Strong M&amp;A and Advisory platform - Strong Corporate Banking platform","- Long hours (9am-12pm Mon to Fri)","3.0","2025-11-07T19:36:02.367","Current employee - Investment Banking Analyst","New York, NY","REGULAR","next_f"
"101097061","Good Experience","Good Experience","The people were friendly and sharp. Asked some tough questions but were fair","Long hours and lots of different work streams","5.0","2025-11-05T11:15:01.497","Former employee - Analyst","Houston, TX","REGULAR","next_f"
"100942682","Lack of true tech leadership","Lack of true tech leadership","The company means well, but there’s a huge lack of modern tech leadership","Hired internal dev team but still wants to outsource everything to FIS? Engineering team built a whole real estate lending platform, and, the support team took full credit for it in a company-wide meeting. The engineering manager was mostly MIA.","2.0","2025-10-28T19:15:42.427","Former employee - Api Developer","Raleigh, NC","REGULAR","next_f"
"100847638","RBC Tech Lead","RBC Tech Lead","Chilled out work, less pressure, AI forward","Not a lot a opportunities to grow, lower paid compared to competitors.","4.0","2025-10-23T20:10:18.447","Current employee - Lead Engineer","Jersey City, NJ","REGULAR","next_f"
"100793506","Project Coordinator salary","Project Coordinator salary","Global company and opportunities especially in Toronto office","Set in their ways when comes wfh. Prefers employees to be onsite","4.0","2025-10-21T16:40:29.280","Current employee - Project Coordinator","New York, NY","REGULAR","next_f"
"100786445","Great company to work for","Great company to work for","It's a great company with great culture.","Depends on the department. Understand this is a large bank - and the majority of the work is driven by regulatory requirements.","5.0","2025-10-21T11:02:39.657","Current employee - Director","Los Angeles, CA","REGULAR","next_f"
"100645055","Exceeded expectations","Exceeded expectations","Family oriented, flexibility, supportive of goals","Changing initiatives, must be agile","5.0","2025-10-14T09:18:36.693","Current employee - Development Consultant","Tacoma, WA","REGULAR","next_f"
"100622675","Good place to start your career","Good place to start your career","Generally people are nice, decent support network","Learning trajectory is really team dependent","4.0","2025-10-13T12:01:52.853","Current employee - Analyst","New York, NY","REGULAR","next_f"
"100581971","Decent Pay and Job Stability, Lots of Bureaucracy","Decent Pay and Job Stability, Lots of Bureaucracy","Decent job stability, but decreasing over time.","Massively bureaucratic with governance processes that slow down the entire organization. Everything runs through Toronto, which is where the self-proclaimed experts work. US employees quickly learn that incompetency at the ""top of the house"" will cause problems in the US.","4.0","2025-10-10T20:01:09.383","Former employee - Risk Manager","New York, NY","REGULAR","next_f"
"100556355","Good","Good","Good training and helpful with people that care.","You're in a big or so easy to fall behind.","5.0","2025-10-09T14:13:35.107","Former employee - Investment Banking Summer Analyst","New York, NY","REGULAR","next_f"
"100536574","Review","Review","PTO, bank holidays, hours, culture","Training, development, tech, career opportunity","3.0","2025-10-08T20:49:07.313","Former employee - Registered Client Associate","Chicago, IL","REGULAR","next_f"
"100506981","Canadian Bank","Canadian Bank","Stable, less stress, can stay until retirement.","No growth in salary, pay does not equate to inflation unless you get promoted, which is based who you know.","4.0","2025-10-07T17:45:52.660","Former employee - Senior Market Data Analyst","New York, NY","REGULAR","next_f"
"100463318","N/A","N/A","Great company, generous compensation package","No drawbacks, aside from location","5.0","2025-10-06T04:30:55.427","Former employee - Trader Analyst","New York, NY","REGULAR","next_f"
"100436537","Fine","Fine","Chill culture, people are usually great","Lack of direction from certain people","4.0","2025-10-04T03:39:30.440","Former employee - Analyst","New York, NY","REGULAR","next_f"
"100365090","Rbc","Rbc","People are amazing and easy to work there","Need to be paid a little more","5.0","2025-09-30T20:02:46.223","Current employee - Registered Client Service Associate","Chicago, IL","REGULAR","next_f"
"100329295","It’s ok","It’s ok","Easy to understand your day to day. Consistency.","A lot of people vying for better positions. Relationships are everything if you want to get ahead","4.0","2025-09-29T11:41:11.603","Former employee - Vice President","New York, NY","REGULAR","next_f"
"100328661","Positive","Positive","Great people, management actively investing in many parts of the business","Definitely a stressful role, but this is true across the entire industry","4.0","2025-09-29T11:15:17.620","Former employee - Trader","New York, NY","REGULAR","next_f"
"100327064","Comfortable Place to Work","Comfortable Place to Work","People are supportive and nice to work with","Pay not as competitive as other financial institutions","4.0","2025-09-29T10:15:16.090","Former employee - Technical Analyst","Jersey City, NJ","REGULAR","next_f"
"100178468","Good","Good","Was a great place to work","Sometimes was a lot of work","4.0","2025-09-22T15:23:48.790","Current employee - Analyst","New York, NY","REGULAR","next_f"
"100133933","Great Culture","Great Culture","Great culture at the bank — collaborative, inclusive and growth-oriented.","Like many financial companies, the path to the top is hierarchical and can take years","5.0","2025-09-19T22:24:32.983","Former employee - Business Analyst","Jersey City, NJ","REGULAR","next_f"
"100076907","Inclusive","Inclusive","Small but large enough to have proficient systems and support in back and front office. Very inclusive and benefits are incredible. 24 weeks maternity leave.","Some software setbacks in their CRM","5.0","2025-09-17T13:21:18.207","Current employee - Senior Investment Associate","Houston, TX","REGULAR","next_f"
"100009333","good firm","good firm","great firm, treat employees well","nothing i can currently think of","5.0","2025-09-15T05:29:03.710","Current employee - Equity Research Associate","New York, NY","REGULAR","next_f"
"99945414","Job review","Job review","Friendly employees, good culture, social events","Low salary compared other firms, hard to promote","4.0","2025-09-11T09:46:18.460","Current employee - Risk Manager","New York, NY","REGULAR","next_f"
"99738935","Na","Na","Great culture and work environment","Long hours and long days","5.0","2025-09-02T07:29:07.037","Current employee - Equity Research Associate","New York, NY","REGULAR","next_f"
"99626181","Great place to work","Great place to work","Good people, good environment, good managers","Pay is slightly lower, not much growth","4.0","2025-08-27T07:34:46.373","Current employee - Senior Business Analyst","New York, NY","REGULAR","next_f"
"99520934","Great","Great","Work from home Flexible Hours","I don’t have any to add","4.0","2025-08-21T19:39:40.037","Former employee - Intern","Canada Creek Ranch, MI","REGULAR","next_f"
"99464326","Good culture","Good culture","Like the culture, pto and benefits are decent. Management seems to care about work life balance.","Corporate mandated dont always make sense for each group within RBC. Slow to make changes. A lot of red tape.","4.0","2025-08-19T14:21:40.847","Current employee - Equity Manager","Denver, CO","REGULAR","next_f"
"99341633","FTE Review","FTE Review","People are easy to work with. It moves at bank pace -&gt; this is rather slow which can be a good thing, As a developer I work at my pace then, rather than being pushed time-wise in a stressful way.","Low pay Hybrid - currently 2 days/week but moving to 4 days per week in September","3.0","2025-08-13T09:44:09.327","Current employee - Senior Software Engineer","Minneapolis, MN","REGULAR","next_f"
"99330954","A General, Well-Rounded","A General, Well-Rounded","RBC is an exceptional employer that truly invests in its people and fosters a positive work environment. There is a strong emphasis on professional development, with abundant resources for training, upskilling, and internal mobility. The company actively encourages employees to explore different career paths within the organization.","a stressful, high-pressure environment focused on meeting sales targets","5.0","2025-08-13T01:03:07.740","Former employee - Senior Product Manager","New York, NY","REGULAR","next_f"
"99294407","Great experience at RBC","Great experience at RBC","Great experience working at RBC!","Big company but lots of upward mobility still","5.0","2025-08-11T13:42:55.307","Former employee - Associate","New York, NY","REGULAR","next_f"
"99173118","Stable job and Laid back environment..","Stable job and Laid back environment..","Health Benefits, great 401k and ok bonus","Pay not up to standard","3.0","2025-08-05T12:01:50.897","Current employee - Senior Network Security Analyst","Jersey City, NJ","REGULAR","next_f"
"99068466","Goood","Goood","fun, good and fun new","health benefits are ok bad","4.0","2025-07-31T06:17:41.763","Current employee - Financial Analyst","Los Angeles, CA","REGULAR","next_f"
"99026018","Good Start","Good Start","Get licensed, explore other opportunities.","Your at the mercy of whichever team you land on. Hit or miss.","3.0","2025-07-29T13:10:48.987","Former employee - Client Associate","Boston, MA","REGULAR","next_f"
"99013071","Salary","Salary","Nice people, work life balance","Too much office politics and fake togetherness","3.0","2025-07-29T04:47:44.780","Current employee - Market Risk Analyst","New York, NY","REGULAR","next_f"
"99003267","Mid experience","Mid experience","Job security. There’s a lot of work to be done","Slow career progression. You’re going to be here for a long haul","3.0","2025-07-28T17:44:36","Current employee - Associate Director","Jersey City, NJ","REGULAR","next_f"
"98938281","Overall decent comp structure","Overall decent comp structure","Meets base pay of bulge brackets at the junior level","Bonus might not meet other banks when more senior","4.0","2025-07-25T03:00:23.547","Current employee - Quantitative Analyst","New York, NY","REGULAR","next_f"
"98888491","Solid Environment","Solid Environment","Lot of exposure as a junior","Some nepotism that can block growth","4.0","2025-07-23T06:33:20.977","Current employee - Analyst","New York, NY","REGULAR","next_f"
"98625204","good company","good company","Excellent exposure to a wide range of tax clients, including partnerships, corporations, and high-net-worth individuals. You build a strong technical foundation in federal and state compliance. Supportive senior staff and managers who are willing to teach. Stable environment with clear expectations and structured busy seasons. A good place to start or grow your public accounting career if you want hands-on experience.","Long hours during tax season, as expected in public accounting. The technology stack could use modernization—still reliant on some legacy systems. Promotion pace can be slow and heavily dependent on years of service rather than performance alone. Less flexibility compared to newer, cloud-based or remote-friendly firms.","4.0","2025-07-11T06:54:25.360","Current employee - Tax Manager","Tampa, FL","REGULAR","next_f"
"98553025","Great place to work","Great place to work","There is a really good culture","You do a quite a bit of traveling","5.0","2025-07-08T13:26:47.080","Current employee - Trust Consultant","Denver, CO","REGULAR","next_f"
"98503440","great company!","great company!","the company culture and upper management","annual raise % needs to be higher.","5.0","2025-07-06T17:52:00.060","Current employee - Investment Associate","Boston, MA","REGULAR","next_f"
"98374483","Great place to work","Great place to work","- work life balance - friendly and easy access to upper level manegement","- pay lower than industry average(imo) - growth can be slow","4.0","2025-06-30T10:37:58.117","Current employee - Investment Associate","New York, NY","REGULAR","next_f"
"98356507","Former IB Associate","Former IB Associate","Great Place to work and friendly culture","Difficult lifestyle to manage with a family","5.0","2025-06-29T14:22:17.650","Former employee - Associate","Dallas-Fort Worth","REGULAR","next_f"
"98303080","All Good","All Good","I like working here; beautiful building in Minneapolis; realistic expectations; strong work life balance.","Team is striped across multiple cities and hybrid work environment could be better.","4.0","2025-06-26T09:06:08.797","Current employee - Financial Reporting Associate","Minneapolis, MN","REGULAR","next_f"
"98196898","Rbc pays ok","Rbc pays ok","Rbc is a good company to work fir","I wish they payed higher","2.0","2025-06-21T23:16:46.453","Current employee - Financr Manager","Los Angeles, CA","REGULAR","next_f"
"98179586","Like it here","Like it here","Good people,good leadership, work life balance","Lower pay than I see elsewhere","5.0","2025-06-20T12:35:17.490","Current employee - Audit Senior Manager","Jersey City, NJ","REGULAR","next_f"
"97716290","Great place to work","Great place to work","Great culture, encourages you to learn and advance your career.","Pay transparency. Big bank so things/changes move slowly","4.0","2025-05-30T11:33:08.700","Former employee - Analyst","Chicago, IL","REGULAR","next_f"
"97538791","Would not recommend","Would not recommend","There are none I can think of.","Would not recommend to anyone","1.0","2025-05-22T14:26:19.683","Former employee - Investment Associate","San Francisco, CA","REGULAR","next_f"
"97534367","Job Review","Job Review","Nice people, good management in office","Lack training/ structure for young advisors","3.0","2025-05-22T11:19:24.423","Current employee - Associate Financial Advisor","Dallas, TX","REGULAR","next_f"
"97515351","good pay","good pay","strong pay roll processing work","less staff available for work","5.0","2025-05-21T20:01:48.237","Current employee - Web Developer","Florida City, FL","REGULAR","next_f"
"97211059","Great place to work","Great place to work","Organization provides great access to key decision-makers.","No real complaints about RBC, honestly.","5.0","2025-05-08T09:22:48.193","Current employee - Advisor","Memphis, TN","REGULAR","next_f"
"97169115","Great","Great","Cool people work in their office","Slow days at work sometimes","5.0","2025-05-06T19:34:09.990","Former employee - Financial Solutions Specialist","Hunt Valley, MD","PART_TIME","next_f"
"97052856","Good People","Good People","The people and culture here are better than other banks","uninspiring job but I suppose that is common","4.0","2025-04-30T19:14:19.503","Current employee - Analyst","New York, NY","REGULAR","next_f"
"97025137",".",".","Growing bank with a good culture","Less of a risk taker","5.0","2025-04-29T17:24:45.527","Current employee - Credit Trading Analyst","New York, NY","REGULAR","next_f"
"96996184","Growing bank","Growing bank","More humane than hard-nosed New York banks. Friendly Canadian culture. Focused on growing its footprint in the US. Big, conservative balance sheet.","Lays people off every once in a while.","4.0","2025-04-28T16:04:20.060","Current employee - Associate Director","New York, NY","REGULAR","next_f"
"96970109","Fine","Fine","Good coworkers in the dc office","No flexible remote work policy","4.0","2025-04-27T15:10:43.067","Former employee - Registered Investment Advisor","Washington, DC","REGULAR","next_f"
"96845261","A good place to be","A good place to be","Friendly office, others help out","Waiting for office refresh, looks dated and not very functional","4.0","2025-04-22T04:39:47.407","Current employee - Sr Registered Client Associate","Tucson, AZ","REGULAR","next_f"
"96834227","Technology Infrastructure","Technology Infrastructure","Good work environment No contractors","Comparison with Canadian salary, US is always considered a high cost center. Canadian employees don't work hard.","4.0","2025-04-21T16:27:30.603","Former employee - Director","Jersey City, NJ","REGULAR","next_f"
"96740792","Good Culture","Good Culture","Friendly mentors and colleagues. It is a good place if you prefer working in a small team.","There is no head count for summer analysts.","5.0","2025-04-16T12:18:14.893","Former employee - Summer Analyst","New York, NY","REGULAR","next_f"
"96718906","balanced culture; can be short-sighted","balanced culture; can be short-sighted","flexibility and autonomy kind and supportive coworkers","can be bureaucratic advancement can be difficult","4.0","2025-04-15T19:49:12.117","Former employee - Fund Analyst","Minneapolis, MN","REGULAR","next_f"
"96687069","Amazing Company!","Amazing Company!","Great culture and people to work with!","None that I can think of.","5.0","2025-04-14T20:08:10.367","Former employee - Marketing Manager","Minneapolis, MN","REGULAR","next_f"
"96410747","You know it's not kind of place your're looking for","You know it's not kind of place your're looking for","good life and work balance","You need to deal with unintelligent manager. BTW, they have super unclear promotion mechanism","1.0","2025-04-03T18:20:44.497","Current employee - Investment Banking Analyst","New York, NY","REGULAR","next_f"
"96397066","Good work life","Good work life","Good salary and work life","Less upward mobility, opportunities for growth","5.0","2025-04-03T09:43:06.427","Current employee - Senior Associate","New York, NY","REGULAR","next_f"
"96112594","RBC","RBC","great inclusive culture and benefits.","Work in person in the office but often team members are not there on the same day","4.0","2025-03-24T15:52:11.663","Current employee - Accommodations Specialist","Minneapolis-Saint Paul","REGULAR","next_f"
"95875752","registered CSA","registered CSA","nothing except money and benefits","location, libs, mayor, governor, subway, Canadian bank","1.0","2025-03-16T14:28:46.047","Current employee - Registered Client Service Associate","New York, NY","REGULAR","next_f"
"95728867","Great culture and teams","Great culture and teams","- Great culture - Working with very smart people that are willing to teach - One of the top players in banking","- Can be long hours occasionally","5.0","2025-03-11T08:54:40.760","Former employee","New York, NY","REGULAR","next_f"
"95642949","Lack of Direction","Lack of Direction","Good Work Culture and Management Values the Employees","Lack of clear long term vision","4.0","2025-03-07T17:34:13.277","Current employee - Associate Director","New York, NY","REGULAR","next_f"
"95534666","Okay pay","Okay pay","Flexibild schedule, decent work life balance","Terrible culture, lack of professionalism","3.0","2025-03-04T11:48:52.740","Current employee - Vice President","New York, NY","REGULAR","next_f"
