"review_id","title","body","pros","cons","rating","date","role","location","employmentStatus","_source"
"81063811","Culture","Culture","Culture benefits, flexibility good wlb","Scope changes, team changing location","5.0","2023-10-18T13:51:05.737","Current employee - Associate","Jersey City, NJ","REGULAR","next_f"
"81010658","IB ASSOCIATE","IB ASSOCIATE","- - -- - --","Hours are really long, lack of work life balance","2.0","2023-10-17T06:39:50.697","Current employee - Investment Banking Associate II","New York, NY","REGULAR","next_f"
"80986863","Good","Good","Company culture Work life balance Pay","Advancement can seem a little long to get into","5.0","2023-10-16T12:50:34.990","Current employee - Operations Associate","Minneapolis, MN","REGULAR","next_f"
"80633019","OK place","OK place","You can learn decent things Some People are nice","The management is bad The technologie is not good The recruitment is dubious","3.0","2023-10-03T16:49:05.677","Former employee - Quantitative Research Analyst","New York, NY","REGULAR","next_f"
"80593245","Good","Good","Cool place to work and learn","Cool place awesome and not too mean","4.0","2023-10-02T13:03:37.753","Current employee - Software Engineer","Toronto, OH","REGULAR","next_f"
"80493284","STAY AWAY","STAY AWAY","None that I am aware of","the entire organization is dissapointing","1.0","2023-09-28T08:23:43.187","Current employee - Registered Client Associate","Washington, DC","REGULAR","next_f"
"80492005","Great company...","Great company...","Sense of community and ability to work on demanding projects","Always at risk for reduction in force","5.0","2023-09-28T07:43:57.483","Former employee - End User Engineering","Jersey City, NJ","REGULAR","next_f"
"80489402","Excellent","Excellent","Great community and support within the team","Some lack of communication from leadership","5.0","2023-09-28T06:25:40.173","Former employee - Marketing","Raleigh, NC","REGULAR","next_f"
"80332243","Equity Research Associate","Equity Research Associate","work with smart and diverse people","No roadmap for career development or how to move up in the organization","4.0","2023-09-22T15:10:36.507","Current employee - Senior Equity Research Associate","New York, NY","REGULAR","next_f"
"80293234","Great place to start a career, but work-life balance will be heavily impacted","Great place to start a career, but work-life balance will be heavily impacted","Smaller deal teams encourage direct collaboration with Senior team members","Smaller deal teams require outsized engagement from junior team members to push toward stringent deadlines. Work-life balance is almost non-existent.","4.0","2023-09-21T11:32:35.163","Current employee - Investment Banking Analyst","New York, NY","REGULAR","next_f"
"80169096","Okay","Okay","Alot of Employee resources groups","Big company and pay is little less than other companies","3.0","2023-09-18T08:00:55.493","Current employee - RBC Capital Markets Summer Analyst","New York, NY","REGULAR","next_f"
"80095601","OK with employees","OK with employees","Big bank and better mentality overall then US banks","Management not as strong as other Canadian banks","3.0","2023-09-15T04:36:11.523","Current employee - Director","New York, NY","REGULAR","next_f"
"79895249","Review","Review","Good benefits, vacation days, good pay","They expect alot of work for the salary","3.0","2023-09-08T16:05:11.407","Former employee - Analyst","Trinidad, WA","REGULAR","next_f"
"79834215","Good culture","Good culture","Culture, compensation, hours, and also people.","Location, upward mobility, and some people","3.0","2023-09-06T19:16:28.217","Current employee - Analyst","Dallas, TX","REGULAR","next_f"
"79752297","salaries","salaries","Good management and employer relationship","I have always enjoyed my work","5.0","2023-09-04T10:25:15.757","Current employee - Senior Accountant","Canada de los Alamos, NM","REGULAR","next_f"
"79673899","Overall positive experience","Overall positive experience","Excellent work culture and support.","Lower than average pay compared to industry.","4.0","2023-08-31T20:00:56.263","Current employee - Complex Operations Manager","Chicago, IL","REGULAR","next_f"
"79600019","Good place to work","Good place to work","Good management and strong team","There is not a strong training program","5.0","2023-08-29T17:30:12.743","Former employee - Finance Intern","Atlanta, GA","REGULAR","next_f"
"79550643","C++ Developer at RBC","C++ Developer at RBC","Competitive experienced team, using C++ 1998.","No team spirit, only the team leader is helpful.","4.0","2023-08-28T10:08:01.163","Former employee - C++ Developer","New York, NY","REGULAR","next_f"
"79389970","Great","Great","Great company, culture is great","Nothing bad to say about RBC","4.0","2023-08-22T20:10:07.250","Current employee - Analyst","New York, NY","REGULAR","next_f"
"79281791","Office politics","Office politics","Some co-workers are competent and nice.","Too many re-org; some managers are incompetent and rude.","3.0","2023-08-18T20:04:43.643","Former employee - Project Manager","New York, NY","REGULAR","next_f"
"79279961","Would not recommend","Would not recommend","I cannot think of any.","Perpetually understaffed. Office is run extremely lean. Each associate is assigned 3-5 advisors and associates back each other up so you could potentially cover 10 advisors if there is an absence. PTO is difficult to coordinate because of this. They have a difficult time hiring fully registered associate (S7+S66) and unregistered associates who do not pass exams after a few tries are asked to leave.","1.0","2023-08-18T17:21:39.110","Former employee - Senior Registered Client Associate","Oakbrook Terrace, IL","REGULAR","next_f"
"79213997","Good People, Good Place","Good People, Good Place","Good people that care about their employees, good benefits, room for growth","Technology could be improved, some CAs are hard to work with","5.0","2023-08-16T18:35:32.150","Current employee - Registered Client Associate","Dallas, TX","REGULAR","next_f"
"79015258","Retail firm trying unsuccessfully","Retail firm trying unsuccessfully","Everyone is very nice - this is a midwestern firm at its core.","The Dain Rauscher, Midwest small broker dealer is trying to be big time and just can’t cut it. All management is Minneapolis based and not quite ready for prime time.","3.0","2023-08-09T19:55:11.137","Current employee - Relationship Manager","New York, NY","REGULAR","next_f"
"78937118","Love it","Love it","Great boss, friendly culture, great wlb","slow pace, cannot learn more","5.0","2023-08-07T15:59:41.590","Current employee - Analyst","Jersey City, NJ","REGULAR","next_f"
"78892509","Pay review","Pay review","Good people’s culture and work is appreciated","Employees not compensated well enough for their work.","3.0","2023-08-05T22:56:25.780","Current employee - Business Risk and Control Analyst","Canada, KY","REGULAR","next_f"
"78462959","RBC Review","RBC Review","Better work/life balance than many other capital markets groups at other investment banks with comparable compensation.","Feels like there is more of a ceiling for the top 5% of traders than other banks.","5.0","2023-07-21T09:00:13.963","Current employee - Vice President","New York, NY","REGULAR","next_f"
"78316373","Great company to work for","Great company to work for","Great work environment of friendly professionals","Large corporation so things can move slowly at times.","5.0","2023-07-17T06:08:29.393","Current employee - IPM","Boston, MA","REGULAR","next_f"
"77931235","Good culture","Good culture","Good culture, lots of opportunities","hours can be long depends on team","4.0","2023-07-03T17:08:49.223","Current employee - Associate Director","Ontario, CA","REGULAR","next_f"
"77854939","solid intern program","solid intern program","structured well, decent pay but most of your money comes from commision","I didnt like how a lot of your money would come from commision","5.0","2023-06-30T06:14:46.390","Current employee - Wealth Management","New York, NY","PART_TIME","next_f"
"77852990","Analyst","Analyst","Great salary for a starting graduate Opportunity for promotion","No work life balance but maybe that’s just me","5.0","2023-06-30T04:47:16.890","Former employee - Analyst","Jersey City, NJ","REGULAR","next_f"
"77767674","It pays the bills","It pays the bills","pretty decent work life balance - for the most part","- the people in charge of making decisions (in Canada) do not care to listen to the thoughts and opinions of those in the states - workload isn’t evenly distributed - not everyone is held to the same standards - not many opportunities for advancement - a bit below national average for pay","2.0","2023-06-27T14:21:48.830","Current employee - Credit Origination Analyst","Durham, NC","REGULAR","next_f"
"77763138","RBC review","RBC review","opportunity to grow if you are in the right group with the right manager","depending on your group your job can be sent to Canada","3.0","2023-06-27T11:55:23.187","Former employee - Senior KYC Analyst","Jersey City, NJ","REGULAR","next_f"
"77678579","Nice People, Decent Benefits","Nice People, Decent Benefits","Extremely flexible work schedule and there still is a Hybrid work schedule. Any new person will feel very welcome at RBC","Takes too long to complete things that should be simple. There’s always a new process but it’s never communicated down to people who need to know. Additionally, some long time managers need mandatory training to bring their skill level up to speed. For every one great manager, there are five-seven bad ones. Technology is extremely bad. They are just now trying to bring things up to speed. Wages. The firm can do better. I know people who have gone 3-4 years without a pay raise. Ok, they were a bonus but people need a raise and the raise needs to be more than 2.5 or 3% Too many people who work in a silo and lastly, good luck to you if anyone responds to your emails. Many longtime RBC folks will only respond if you cc their manager and if necessary their manager’s manager.","3.0","2023-06-24T09:15:59.547","Current employee - Business Analyst","New York, NY","REGULAR","next_f"
"77670455","Stable","Stable","Stable bank with typical benefits.","Limited upside in certain departments.","4.0","2023-06-23T21:37:08.077","Former employee - Real Estate Analyst","Pittsburgh, PA","REGULAR","next_f"
"77599273","Great Company to work for!","Great Company to work for!","great culture and willing to pay for further education to advance in this financial career","antiquated computer systems and lack of consistency when you call back office for assistance.","5.0","2023-06-21T16:34:23.270","Former employee - Client Associate","Wall, NJ","REGULAR","next_f"
"77551275","Capital Markets Technology","Capital Markets Technology","Flexible Schedule Volunteer Opportunities Career Growth Opportunities Bonus","Promotion Process Compensation Increase Process","5.0","2023-06-20T10:48:27.983","Current employee - Associate Director","Jersey City, NJ","REGULAR","next_f"
"77492693","not great, not terrible","not great, not terrible","experience building, good learning resources","bad management, will only promote based on their personal relationships","3.0","2023-06-18T18:46:21.040","Former employee - Financial Advisor","Alberta, MI","REGULAR","next_f"
"77199033","Great place","Great place","Loved to work here. Too bad calling to work","none. Only i do not like to go to office.","3.0","2023-06-08T11:24:19.130","Former employee - Product Manager","New York, NY","REGULAR","next_f"
"77151893","RBC is good","RBC is good","the people, the building, the resources","Work life balance, long hours","5.0","2023-06-07T06:13:50.157","Current employee - Analyst","New York, NY","REGULAR","next_f"
"77138033","Nice Bank… but has limitations","Nice Bank… but has limitations","Friendly Canadian bank, more laid back culture vs American banks","Bush league vs. US bulge brackets (resources, leadership)","3.0","2023-06-06T19:30:40.330","Former employee - Debt Capital Markets Analyst","New York, NY","REGULAR","next_f"
"77095555","Overall great culture, low payers for industry","Overall great culture, low payers for industry","Overall culture is nice, people are nice and understanding","Compensation is not to market, certain groups are toxic","4.0","2023-06-05T16:32:37.400","Current employee - Human Resources Business Partner HRBP","Jersey City, NJ","REGULAR","next_f"
"77080872","Decent enough place to work","Decent enough place to work","401K match upto 6%, flexible environment","Extremely hard to break into the corporate culture","2.0","2023-06-05T08:29:43.293","Current employee - Business Project Manager","Minneapolis, MN","REGULAR","next_f"
"77021271","Time at RBC","Time at RBC","They had great coworkers and benefits","The hours could be very long","3.0","2023-06-02T10:23:23.063","Former employee - Software Engineer","New York, NY","REGULAR","next_f"
"76906808","Don't apply for IT in Minneapolis","Don't apply for IT in Minneapolis","RBC has great benefits. They have a full range of benefits to fit any individual or family. They have a culture that makes you feel valuable if you work in the business area of Wealth Management.","Working in IT in Minneapolis is not a great experience. HQ is in Toronto and there is a large presence in New Jersey. Minneapolis is not considered important enough to hire IT people. You feel like an island and unimportant.","4.0","2023-05-30T08:41:49.217","Former employee - Sr Service Delivery Manager","Minneapolis, MN","REGULAR","next_f"
"76734685","Culture not all it's sold as","Culture not all it's sold as","Good pay, solid benefits, some teams are great","Very manager dependent, disorganized, overloads employees","2.0","2023-05-24T05:21:57.020","Former employee - Technology Trainer","Minneapolis, MN","REGULAR","next_f"
"76701663","Great benefits and coworkers","Great benefits and coworkers","Benefits (401k matching, healthcare, PTO) are fantastic. 6% 401k matching, 3+ weeks of PTO plus banking holidays, health benefit cost is very low compared to competitors Loved my coworkers and the culture (sounds cliche but it’s true) RBC is a very well run company","I worked long hours but that was due to my position, plenty of coworkers in other departments had much better/normal hours. Pay is low compared to competitors but management won’t admit it","4.0","2023-05-23T08:25:41.280","Former employee - Portfolio Associate","Minneapolis, MN","REGULAR","next_f"
"76434342","Salary Transparency Gone Wrong","Salary Transparency Gone Wrong","Not a lot to share","As you may know, a pay transparency law went into effect in NYC in 2022. Recently, an entry-level position opened up in my immediate team, and, upon looking at the salary range, the bottom of the range was higher than I make! I discussed this with HR, and they told me that my market rate is lower than a new grad because of my ""graduation year"". HR refused to adjust my salary at all. I have been at RBC for 2 years with over 3 years of post-graduate experience.","1.0","2023-05-15T06:48:37.897","Current employee","New York, NY","REGULAR","next_f"
"76412083","Not bad","Not bad","Learn a lot about banking","Pretty boring job for what it's worth, hard to advance","3.0","2023-05-14T08:56:38.687","Former employee - Administrative Assistant","Houston, TX","REGULAR","next_f"
"75997284","Investment Banking Associate","Investment Banking Associate","Smart co-workers, driven folks all around.","Terrible work/life balance. Company tries too hard to be Goldman Sachs or other similar legacy investment banks.","3.0","2023-05-01T07:58:12.497","Former employee - Investment Banking Associate","San Francisco, CA","REGULAR","next_f"
"75819502","RBC Bank US","RBC Bank US","This big financial institution feels like a small community. Directors know their employees and send words of encouragement and appreciation. Coworkers are so helpful and nice.","I have no cons for RBC.","5.0","2023-04-25T08:45:02.343","Current employee","Raleigh, NC","REGULAR","next_f"
"75813786","Pretty Solid","Pretty Solid","I guess the people are nicer than at other places??","People can be a little lazy and toxic.","5.0","2023-04-25T06:20:35.250","Current employee - Financial Analyst","Miami, FL","REGULAR","next_f"
"75719164","Decent workplace; outdated bonus structure","Decent workplace; outdated bonus structure","Strong junior team culture Strong dealflow across groups","Terrible juniors-to-seniors culture Bad pay scaling on the bonus structure","4.0","2023-04-21T13:33:47.373","Former employee - Investment Banking Analyst","San Francisco, CA","REGULAR","next_f"
"75617016","No matter how much you work, it will never be enough","No matter how much you work, it will never be enough","Benefits are the best PTO and work from home arrangement is nice","No matter how much you work, they will always ask more from you. There is no on the job training, you will be required to figure it out as you go. The managers are so busy they have no time left to actually pay attention to their employees. You are given no goals, no direction and no feedback. You cannot say no to questions that are asked of you, you are expected to do jobs well outside of your scope. If you do need help the managers will question your commitment. Managers work 60+ hours 7 days a week and most people on the team feel pressured to do the same. The technology they roll out is terrible and you are expected to stand behind the technology that does not work at all. You spend most of your day fielding complaints that you cannot take action on. They will roll out technology they know doesn't work and just hope for the best.","1.0","2023-04-18T14:36:58.743","Current employee - Technology Trainer","Minneapolis, MN","REGULAR","next_f"
"75536363","Best bank of the Street","Best bank of the Street","Commitment to innovation and technology Firm procedures followed by all levels Competitive compensation","As with any FBO, there is always a danger that domestic policy clashes with head office","5.0","2023-04-16T06:31:28.413","Current employee - Senior Regulatory Affairs Specialist","Jersey City, NJ","REGULAR","next_f"
"75512940","Typical bank but could be worse","Typical bank but could be worse","Relatively solid junior class Some groups are pretty collegial, have social events and get along well Banking hours but nothing absolutely insane Management little bit later to push on streetwide mandates (return to office, vaccines, etc.) than other banks Willingness to promote Compensation more heavily in cash than some other firms with large stock component","Pretty high turnover Lower quality talent, getting frustrated from working with not the smartest people Comp always feels average at best with respect to Street Typical hierarchal issues of an investment bank Leaner teams and less staffing than bigger banks","4.0","2023-04-14T20:46:19.277","Former employee - Investment Banking Analyst","New York, NY","REGULAR","next_f"
"75503497","Great Job!","Great Job!","They were flexible and paid well.","It was slow and boring.","5.0","2023-04-14T12:08:05.033","Former employee - Client Services Associate","Florham Park, NJ","PART_TIME","next_f"
"75462359","No WFH flexibility","No WFH flexibility","If you’re on a decent team or have competent management the worst.","Little to no WFH flexibility, branch staff can only WFH 2 days a month. Management will send you to HR and HR will send you back to management and it’s somehow nobody’s responsibility to assist. As is the same in most companies in finance, management sucks up to the high producers and let them make the rules instead of acting like management.","3.0","2023-04-13T08:53:53.640","Current employee - Registered Client Associate","Phila, PA","REGULAR","next_f"
"75453295","Review","Review","Supportive management and co workers","Stressful environment day in and out","4.0","2023-04-13T04:12:26.930","Current employee - Banking Advisor","Ontario, CA","REGULAR","next_f"
"75431025","Nothing Special","Nothing Special","strong balance sheet, leading presence in Canada","Muddling along culture with little ambition to lead industry","3.0","2023-04-12T12:04:45.397","Former employee - Managing Director","San Francisco, CA","REGULAR","next_f"
"75253216","Good Experience","Good Experience","nice to work with great people","hard to move around internally","4.0","2023-04-06T07:25:23.277","Current employee - Director","New York, NY","REGULAR","next_f"
"75194716","Great Program","Great Program","Strong team with wide breadth of deal experience / opportunities","Long-hours, but better vs. comparable groups across the street","5.0","2023-04-04T15:33:55.323","Former employee - Analyst","Houston, TX","REGULAR","next_f"
"75163418","Good Experience, Learned a lot","Good Experience, Learned a lot","Good culture, many people looking to help with your experience and was close and involved with financial advisors. Was able to learn a lot about investing and managing clients","N/A was a great experience","5.0","2023-04-03T20:37:57.733","Former employee - PCG Intern","Lake Forest, IL","PART_TIME","next_f"
"75145025","Salary","Salary","Good work environment and fun place to work","This position requires you to wear too many hats at time","4.0","2023-04-03T09:37:10.500","Former employee - Cross Border","Raleigh, NC","REGULAR","next_f"
"74880356","It’s ok","It’s ok","Pay isn’t that bad. Good benefits","Really really bad computer programs. Very old school.","2.0","2023-03-25T19:10:12.450","Current employee - Client Associate","Peterborough, NH","REGULAR","next_f"
"74626882","Turnover Ratio was High","Turnover Ratio was High","Not much to talk about","Promised Contract to hire, never got hired. Staffing agency they worked with screwed you over with pay. Always one of the top ones and became a lead.","1.0","2023-03-17T13:57:57.647","Former employee - Support Center Analyst","Minneapolis, MN","REGULAR","next_f"
"74544263","Good","Good","Good overall, good culture and not a bad process","The Hour way too long.","5.0","2023-03-15T09:49:10.297","Former employee - Investment Banking Analyst","Houston, TX","REGULAR","next_f"
"74527731","Its good","Its good","Work life balance, learning, technology","Pay, management and visibility is less .","5.0","2023-03-14T23:45:50.057","Current employee - Software Developer","Jersey City, NJ","REGULAR","next_f"
"74443301","Good job","Good job","Attentive management Many ways to achieve growth within Salary is ok, I have only done one role so far!","Can be a lot mentally","5.0","2023-03-12T18:43:50.317","Current employee - Client Advisor","Montreal, WI","REGULAR","next_f"
"74421839","Nice people but very painful work","Nice people but very painful work","Really great people but not much as else","Unsupportive management, bad pay, no upward mobility, ignored a lot, expense process is soooo painful - worst one out of all of the companies I have been at,","3.0","2023-03-11T14:32:25.663","Current employee - Administrative Assistant","San Francisco, CA","REGULAR","next_f"
"74174849","Great Job","Great Job","access to great advisors and mentors, a lot of opportunities to transition to new roles","Stressful work environment and long hours","5.0","2023-03-03T16:59:18.113","Former employee - Registered Client Associate","Hartford, CT","REGULAR","next_f"
"73980966","Pros outweigh the cons","Pros outweigh the cons","Good benefits Two gender neutral bathrooms at every floor at RBC Gateway Pay for operations is well above average Transparent management Dedication to work/life balance Lots of room for movement within operations and outside of it","The tech is Bad Operations is becoming more metric driven, and the metrics don't always match the actual goals and work of the team Teams tend to run lean","5.0","2023-02-25T18:40:37.753","Current employee - Team Lead","Minneapolis, MN","REGULAR","next_f"
"73961186","Great Culture","Great Culture","- Great culture - Nice people - Good experience","- Not a bulge bracket but approaching bulge","5.0","2023-02-24T18:06:12.657","Current employee - Analyst","New York, NY","REGULAR","next_f"
"73943513","Avid seeker","Avid seeker","There are many pros Culture, people, values,","There are no cons at this time ...I just need to be fully remote","5.0","2023-02-24T06:48:59.183","Current employee - Senior Team Lead","Oakland, CA","REGULAR","next_f"
"73904471","Good culture","Good culture","Very friendly people to work with","Base comp slightly lower than BB","4.0","2023-02-23T05:54:45.843","Current employee - Trader","New York, NY","REGULAR","next_f"
"73889397","Goog company","Goog company","Salary and benefits are good","Insurance are not yhat good","4.0","2023-02-22T18:34:39.713","Former employee - Business Analyst","New York, NY","REGULAR","next_f"
"73796416","Registered Client Associate","Registered Client Associate","good strong culture supportive environment","no upward advancement potential training lacking","4.0","2023-02-20T08:51:08.057","Current employee - Registered Client Associate","Green Bay, WI","REGULAR","next_f"
"73556226","Job","Job","Environment good, good people to work with","Part time is not good enough","5.0","2023-02-12T13:07:44.803","Current employee - Administration","Richmond, IN","PART_TIME","next_f"
"73515001","Great Company","Great Company","Nice company and nice team","Good company but with unfair compensation","5.0","2023-02-10T11:01:25.190","Current employee - Data Engineer","New York, NY","REGULAR","next_f"
"73454932","Good","Good","Good work life balance .","Nothing as such for now","4.0","2023-02-08T18:40:41.407","Current employee - Full Stack Developer","Jersey City, NJ","REGULAR","next_f"
