"review_id","title","body","pros","cons","rating","date","role","location","employmentStatus","_source"
"45086316","dont care about employees","dont care about employees","some good people at the company","only pay high level employees","1.0","2021-04-06T07:47:34.897","Current employee - Client Associate","New York, NY","REGULAR","next_f"
"44959689","Terrible management","Terrible management","Diversity in employees and promotes inclusion.","Management doesn’t promote a friendly environment.","1.0","2021-04-02T21:42:00.407","Former employee - Operational Client Associate","Portland, OR","REGULAR","next_f"
"44860557","Typical Bank","Typical Bank","Lots of resources if you can find them","Lots of red tape and painfully conservative management","3.0","2021-03-31T16:40:51.707","Current employee - Vice President","New York, NY","REGULAR","next_f"
"44850532","Excellent","Excellent","The best People to work with","Salary is below market and health benefits are sub-par","5.0","2021-03-31T12:48:20.447","Current employee - Associate Director","New York, NY","REGULAR","next_f"
"44751682","Good company","Good company","Work life balance and PTO","Pay could be better for long term","4.0","2021-03-29T20:52:31.187","Current employee - Client Services Manager","Minneapolis, MN","REGULAR","next_f"
"44732498","Great place for junior bankers","Great place for junior bankers","Flat Structure Great Junior Development Solid deal flow","Long hours (but that's everywhere on the street)","5.0","2021-03-29T12:41:13.840","Current employee - Investment Banking Analyst","New York, NY","REGULAR","next_f"
"44670615","Opportunity for Growth","Opportunity for Growth","Good leadership in my business line","Large company - Technology initiatives can be slow","4.0","2021-03-28T02:13:27.483","Current employee - Senior IT Risk Analyst","Minneapolis, MN","REGULAR","next_f"
"44609679","ah yes","ah yes","culture health hardworking togetherness, shush, oaks,","hours, covid, long hours, shugana, haha,","4.0","2021-03-26T07:56:27.377","Current employee - Sales Associate","San Diego, CA","PART_TIME","next_f"
"44443235","Great company but pay is a bit low","Great company but pay is a bit low","Benefits are better than any other company I have worked for. The company tries to foster a healthy work environment and I genuinely believe RBC cares about their employees (at the company level, not so much at the branch level.)","Pay is lower than what I’ve been paid at other companies. (I joined RBC because of the benefits and the office is close to home. )","4.0","2021-03-23T11:50:20.047","Current employee - Senior Investment Associate","San Jose, CA","REGULAR","next_f"
"44339430","Good org","Good org","Smart people, good culture, great pay","Hours long, some office politics","5.0","2021-03-21T16:04:31.797","Former employee - Investment Banking Associate","New York, NY","REGULAR","next_f"
"44268083","RBC Operations","RBC Operations","Culture is great and good benefits","Pay could definitely be more","4.0","2021-03-19T11:41:38.547","Current employee - Mutual Fund Ops Associate","Minneapolis, MN","REGULAR","next_f"
"44251701","Some good, some bad","Some good, some bad","Stable work environment. Some job security","Compensation of back office employees not on par with market rates. A lot of oversight from Canadian leaders, at times do not have ability to innovate as necessary. Culture is OK, some groups have better, not consistent, depends on business line. Lean teams, no support to add headcount when workloads are high.","3.0","2021-03-19T05:43:39.173","Current employee - Vice President","New York, NY","REGULAR","next_f"
"44229840","Great Job","Great Job","Best partnerships within the branch","Full commission could be volatile","5.0","2021-03-18T17:52:58.927","Current employee - IRP","Calgary Woods, TX","REGULAR","next_f"
"44207099","RBC is good place to work starting your career","RBC is good place to work starting your career","RBC has a good work culture","Depends on the group you work in.","4.0","2021-03-18T09:59:53.857","Former employee - Staff Accountant","Jersey City, NJ","REGULAR","next_f"
"44200108","Rbc","Rbc","Great culture, good deal flow","Long hours, although more manageable that other groups","4.0","2021-03-18T07:59:25.603","Current employee - Leveraged Finance Associate","New York, NY","REGULAR","next_f"
"44128836","Basic Info","Basic Info","Great culture in most business lines","Best talent generally in front office positions","4.0","2021-03-17T04:43:29.703","Former employee - Associate Director","Jersey City, NJ","REGULAR","next_f"
"44019564","Great place to work","Great place to work","Good culture, great team, room for growth","No cons to report at this time","5.0","2021-03-15T10:17:55.600","Current employee - Asset Management Analyst","Denver, CO","REGULAR","next_f"
"43953365","Good experience","Good experience","good culture, good people, good pay","not much to cons with the company","5.0","2021-03-13T16:56:15.260","Current employee - Associate","New York, NY","REGULAR","next_f"
"43917127","Stable bank that continues to grow.","Stable bank that continues to grow.","Large lending book offers inside track to exciting deals.","More likely to work on an anonymous asset sale than a front-page deal.","4.0","2021-03-12T14:09:09.123","Former employee - Vice President","Houston, TX","REGULAR","next_f"
"43900441","Solid company","Solid company","Good people, strong culture, supportive","Pays less than comparable firms","4.0","2021-03-12T07:58:24.037","Current employee - Senior Associate","New York, NY","REGULAR","next_f"
"43861170","Good","Good","Great benefits. Health Insurance, 401k, very stable job.","Job is redundant. Large corporation, so sometimes can feel like a number.","4.0","2021-03-11T13:01:32.327","Current employee - Registered Associate","Hartford, CT","REGULAR","next_f"
"43799773","Conservative","Conservative","Relatively stable than other US banks","Not much career growing room for US employees","3.0","2021-03-10T12:54:05.740","Current employee - Director","New York, NY","REGULAR","next_f"
"43798121","RBC Review","RBC Review","- lean deal teams allow for a great amount of experience at the junior level","- Culture in some groups does not value the opinions of lower-level employees","3.0","2021-03-10T12:22:50.713","Current employee - Investment Banking Analyst","New York, NY","REGULAR","next_f"
"43752284","Great company","Great company","Pay, easy going, great people","No cons with company except medical","5.0","2021-03-09T19:18:54.713","Former employee - Quality Assurance","Seneca, SC","REGULAR","next_f"
"43729789","Great Culture","Great Culture","Culture, Collaborative, Great managers who care about you","It is a very steep learning curve","5.0","2021-03-09T11:24:26.857","Current employee - Investment Analyst","Charlotte, NC","REGULAR","next_f"
"43708846","Great work environment, no job mobility","Great work environment, no job mobility","Work from home tolerant environment and relatively predictable schedule with mostly realistic expectations.","No growth or promotion opportunities Team leaders are poor managers with one extremely inexperienced and the other incompetent","4.0","2021-03-09T05:40:42.817","Current employee - Senior Credit Risk Review Officer","Jersey City, NJ","REGULAR","next_f"
"43608980","analyst","analyst","nice team, want to see you grow","pay below street, don't like city","3.0","2021-03-07T09:41:34.853","Current employee - Municipal Analyst","Atlanta, GA","REGULAR","next_f"
"43593831","Operations Associate","Operations Associate","Laid back depending on department","Management in some groups is not good","4.0","2021-03-06T21:45:31.237","Current employee - Associate","Minneapolis, MN","REGULAR","next_f"
"43588370","..","..","Biggest bank in canada so far","Not efficient, senior management very poor","2.0","2021-03-06T17:02:57.347","Former employee - Trader","New York, NY","REGULAR","next_f"
"43505660","N/A","N/A","Nice people to work with.","Not typically a first mover or innovator.","5.0","2021-03-04T20:17:01.847","Current employee - Director","New York, NY","REGULAR","next_f"
"43278879","RBC Wealth Management","RBC Wealth Management","Plenty of opportunities if you show any ambition","COVID prompted work from home, but before that it was limited","5.0","2021-03-01T10:47:55.900","Current employee - Ops Analyst","Minneapolis, MN","REGULAR","next_f"
"43145951","Great Company","Great Company","Good, smart, talented workers who are always willing to help","Old antiquated systems with lack of direction from senior management","4.0","2021-02-26T06:57:10.180","Former employee - Analyst","Ontario, CA","REGULAR","next_f"
"43088657","Satisfied","Satisfied","Good culture and people. Good work life balance","Large in Canada but smaller scale in the U.S.","5.0","2021-02-25T08:01:24.427","Current employee - Associate","New York, NY","REGULAR","next_f"
"43088083","Good","Good","Good Company and solid direction for the future","very competitive, not a ton of advancement opportunities","4.0","2021-02-25T07:51:36.847","Former employee - Senior Associate","Minneapolis, MN","REGULAR","next_f"
"43058619","Trader","Trader","People, money, environment, hire from within","Location, technology, favoritism, lack of change","4.0","2021-02-24T18:57:25.707","Former employee - Trader","Minneapolis, MN","REGULAR","next_f"
"43037931","Good place to work, very lean staffing","Good place to work, very lean staffing","Good overall culture Smart People Strong D&amp;I Focus","Very lean, so big risk of being overworked, particularly if there is turnover","5.0","2021-02-24T11:45:49.377","Current employee - Managing Director","New York, NY","REGULAR","next_f"
"42988588","Mortgage Advisor","Mortgage Advisor","Nice people, decent pay, and good work environment","Long hours, high demands from management","4.0","2021-02-23T18:01:29.537","Current employee - CBMA","Raleigh, NC","REGULAR","next_f"
"42633509","good company to work for","good company to work for","diversity, fair to junior employees, not very good for senior employees, good employee training and community work","compensation and cost cutting, Canada centric","4.0","2021-02-17T08:06:27.997","Former employee - Senior Business Analyst","New York, NY","REGULAR","next_f"
"42599296","Work with business to determine market data needs and validate license for real time .","Work with business to determine market data needs and validate license for real time .","Managers listen, work family balance, vacation, benefits, matching 6% with 401k.","Career growth for some business units.","4.0","2021-02-16T17:45:21.773","Current employee - Senior Compliance Analyst","New York, NY","REGULAR","next_f"
"42561056","CFP, RBC","CFP, RBC","flex schedule is good for family","boring, losts on layers of management","3.0","2021-02-16T05:51:18.180","Former employee - Financial Advisor CFP","Indianapolis, IN","REGULAR","next_f"
"42522490","Only good if you're in a front office role","Only good if you're in a front office role","Employee resource groups are prominent and make a difference","Operations &amp; client onboarding: dated, hierarchical management style, menial tasks, no visibility, boss was insecure &amp; barely wrote in English, promotions come based on how long you have been in your seat instead of on talent or personal drive. If you ask for opportunities &amp; visibility, you'll be accused of being 'aggressive', especially if you're a female. It was so bad I quit without even having a back-up job &amp; never looked back.","2.0","2021-02-15T12:01:26.617","Former employee - Client Onboarding Specialist","New York, NY","REGULAR","next_f"
"42480360","Review","Review","Not too large a firm","Older systems in the process of updating","2.0","2021-02-14T14:47:57.987","Current employee - Senior Registered Client Service Associate","Philadelphia, PA","REGULAR","next_f"
"42474403","Good place","Good place","Nice people work at RBC","Very busy office, needs more staff.","4.0","2021-02-14T10:22:25.580","Current employee - Trust Officer","Wilmington, DE","REGULAR","next_f"
"42414207","Good company","Good company","Good place to work nice co workers","None- hours can be long but what else can you expect","5.0","2021-02-12T12:58:13.250","Current employee - IB Analyst","New York, NY","REGULAR","next_f"
"42237543","Great place to work (team dependent)","Great place to work (team dependent)","people, growth opportunities, culture, learning environment/fast paced","work life balance (but that is industry standard)","5.0","2021-02-09T20:56:34.083","Former employee - Investment Banking Analyst","New York, NY","REGULAR","next_f"
"42168860","Good","Good","Flat org and good people","A number of complimentary businesses based out of region","5.0","2021-02-08T19:59:30.380","Current employee - Managing Director","New York, NY","REGULAR","next_f"
"42126085","Good Company","Good Company","Good company to work for and grow in","some groups are not as upwardly mobile","4.0","2021-02-08T06:11:08.400","Current employee - Associate Director","New York, NY","REGULAR","next_f"
"42087576","Amazing Company to work for!","Amazing Company to work for!","RBC has a great work life balance, executives treat all employees with the utmost respect.","Room for growth can be slow.","5.0","2021-02-07T07:20:35.277","Former employee - Risk Analyst","Wilmington, DE","REGULAR","next_f"
"41962779","Great Company, good support","Great Company, good support","Flat organization, lots of support for staff and FAs","Old school stock broker environment; not very diverse","4.0","2021-02-04T11:05:10.947","Current employee - Registered Client Service Associate","Walnut Creek, CA","REGULAR","next_f"
"41901589","Okay","Okay","Benefits are great, coworkers were awesome","Expectations can sometimes be overwhelming","4.0","2021-02-03T12:42:36.570","Former employee - Human Resources Specialist (HR Specialist)","Minneapolis, MN","REGULAR","next_f"
"41880756","Great team work","Great team work","Culture is strong and diverse","Hours are very long and strenous","4.0","2021-02-03T07:14:45.987","Current employee - Investment Banking Analyst","New York, NY","PART_TIME","next_f"
"41652477","Fair","Fair","Good remuneration vs previous employers Dynamic and changing work Balanced work life","Not very flexible Very hierarchical Not very open to changing processes","4.0","2021-01-29T18:53:26.593","Current employee - Risk Analyst","New York, NY","REGULAR","next_f"
"41600927","good","good","good atmosphere, everyone happy to share","very traditional sell side culture","4.0","2021-01-28T20:57:35.507","Former employee - Data Scientist","New York, NY","REGULAR","next_f"
"41589002","Good company culture, decent upward mobility","Good company culture, decent upward mobility","Environment and people are nice, good company culture compensation is average good work/life balance","In technology, emphasis is on the customer/user and not really on improving the technology","3.0","2021-01-28T15:36:55.177","Current employee - Technical Support Analyst","Minneapolis, MN","REGULAR","next_f"
"41466826","Analyst","Analyst","Good culture and great people","Lower comp than the street","4.0","2021-01-26T20:22:46.323","Current employee - Analyst","New York, NY","REGULAR","next_f"
"41419415","Great experience","Great experience","Working for RBC provided great experience working in the financial industry.","No overtime pay, no bonuses written in contract but never paid.","5.0","2021-01-26T04:05:19.090","Current employee - Wealth Management Associate","Hollywood, FL","REGULAR","next_f"
"41187065","nice","nice","Received strong support from management","Can have long hours at times","5.0","2021-01-21T12:17:49.017","Current employee - Research Associate","New York, NY","REGULAR","next_f"
"41022841","Great Company","Great Company","Have been here 2 years great company","None at the moment, thanks","5.0","2021-01-19T12:19:58.233","Current employee - Trading Assistant","New York, NY","REGULAR","next_f"
"40841752","Great position - Fantastic company","Great position - Fantastic company","-the growth opportunities are tremendous -the company culture is great, everyone is super nice -the work is challenging and rewarding and a great first step for a career in finance","-work life balance, but to be expected at any investment bank","5.0","2021-01-16T14:01:04.357","Current employee - Operations Analyst","New York, NY","REGULAR","next_f"
"40807357","Stellar","Stellar","Global Perspective Progressive Market Advantages","Limited US scope Mid Management Challenges","5.0","2021-01-15T18:41:15.957","Former employee - Banking","Winter Park, FL","REGULAR","next_f"
"40747221","What’s in the kool aid?","What’s in the kool aid?","Fantastic communication from the top to bottom. Diverse, philanthropic and solid foundation with lofty yet doable strategic priorities. Management doesn’t ignore current environment and how it impacts its people and businesses.","Silos, territoriality, need to be more agile","5.0","2021-01-14T21:43:19.057","Current employee","Raleigh, NC","REGULAR","next_f"
"40731662","NA","NA","Good place to work, location.","Nothing I can think of.","5.0","2021-01-14T15:56:31.057","Current employee - IB Analyst","Houston, TX","REGULAR","next_f"
"40544622","Great place to work","Great place to work","Great benefits and nice people","typically have to work from the office with little flexibility","5.0","2021-01-12T11:11:14.060","Current employee - Internal Credit Consultant","Minneapolis, MN","REGULAR","next_f"
"40464297","Quantitative Strategies Group Analyst","Quantitative Strategies Group Analyst","Great first job out of school...work is very quantitative and get good exposure with understanding buy-side investment strategies","None it is a great place to work","5.0","2021-01-11T12:46:41.553","Former employee - Quantitative Strategies Group","New York, NY","REGULAR","next_f"
"40425295","Current Employee","Current Employee","Great Culture. Smart and hardworking colleagues","Moving up can be difficult","4.0","2021-01-11T04:08:04.730","Current employee - Vice President","New York, NY","REGULAR","next_f"
"40303171","Good job","Good job","Goid life work balance at rbc","Sales pressure can be too high","5.0","2021-01-08T15:15:57.233","Former employee - Customer Service Representative","Winnipeg, MO","REGULAR","next_f"
"40207395","Nice People Low Compensation if Promoted Internally","Nice People Low Compensation if Promoted Internally","WFH Privileges and Nice People","Low opportunities for advancement outside of Canada","3.0","2021-01-06T21:28:17.277","Current employee - IT Audit Manager","Jersey City, NJ","REGULAR","next_f"
"40121501","Good Place to Work","Good Place to Work","Depending on Group, hard work is rewarded","larger company, so if not in main office can feel left behind","4.0","2021-01-05T08:18:23.047","Current employee - Vice President","Houston, TX","REGULAR","next_f"
"40086394","Nice place to be","Nice place to be","Good work/life balance, reasonable salary","No big cons really, it's Canada's biggest bank.","4.0","2021-01-04T15:12:48.377","Current employee - Quantitative Researcher","San Francisco, CA","REGULAR","next_f"
"39909796","Great company with opportunities for growth","Great company with opportunities for growth","RBC is a good company with opportunities for growth. They encourage shared learning and collaboration across groups. I have found a number a good learning experiences working on the asset management side of the business. My boss is generally hands-off and I’m self-motivated, so this works well for me.","RBC is a large bank and headquartered in Canada. The US offices are relatively small and the effort to grow those offices depends on the annual strategic plan.","5.0","2020-12-29T13:41:20.920","Current employee - Senior Equity Analyst","Boston, MA","REGULAR","next_f"
"39870988","It is an okay company","It is an okay company","There is a good work life balance.","The system are downright terrible","3.0","2020-12-28T13:46:00.280","Current employee - Registered Senior Client Associate","San Francisco, CA","REGULAR","next_f"
"39439570","Great","Great","Love it it is great","honestly not too much to say","4.0","2020-12-13T17:14:14.203","Current employee - Investment Banking Analyst","Chicago, IL","REGULAR","next_f"
"39272229","Good Place","Good Place","Nice and helpful co workers in workplace","Bad management in my area","3.0","2020-12-09T06:57:20.600","Former employee - Auditor","Atlanta, GA","REGULAR","next_f"
"39242926","Good place to work","Good place to work","A lot of opportunity to develop and grow ideas to execution","Small team, limited growth oppys","4.0","2020-12-08T15:26:10.367","Former employee - Learning Specialist","New York, NY","REGULAR","next_f"
"39161561","Run by clowns","Run by clowns","Its run by clowns, so all decisions are incompetent and thus entertaining","Run by clowns, read the news headlines, GBP 400.00 per day to lick envelopes???","1.0","2020-12-07T04:21:09.063","Current employee","Earth, TX","REGULAR","next_f"
"38526061","Quantitative strategies group","Quantitative strategies group","you gain some experience If you work for the right team.","the trading is very manual and we can't compete with systematic trading firms. We don't have right infrastructure in place and we need to up our game If we want to stay alive","2.0","2020-11-19T10:24:54.023","Current employee - Junior Trader","New York, NY","REGULAR","next_f"
"38500997","I like my work","I like my work","People are very nice, clear career path","not much challenge, but it have good work life balance","5.0","2020-11-18T20:23:27.813","Current employee - Risk Analyst","Jersey City, NJ","REGULAR","next_f"
"38448531","Great work environment","Great work environment","great team and room for growth","nothing that could be noted as negative","5.0","2020-11-17T15:21:54.067","Former employee - Analyst","Edison, NJ","REGULAR","next_f"
"38280318","typical wall street bank","typical wall street bank","stable, routine work, and don't need to worry about losing your job","not enough challenges for junior developers","3.0","2020-11-12T07:02:45.987","Current employee - Software Developer","New York, NY","REGULAR","next_f"
"38086076","Na","Na","Co-workers and management are very helpful.","I can’t think of any at this moment.","4.0","2020-11-06T21:08:02.350","Current employee","Raleigh, NC","REGULAR","next_f"
"38040154","Good company to work with","Good company to work with","Decent TC in a Buy Side investment bank Tech Stack","Lot of Lobbying &amp; Politics","4.0","2020-11-05T12:47:34.247","Current employee - Technical Java Lead Developer","New York, NY","REGULAR","next_f"
"38005415","Great!","Great!","Gives opportunities for younger employees","Sometimes not as respected as bigger banks","5.0","2020-11-04T17:16:38.427","Current employee - Trader","New York, NY","REGULAR","next_f"
"37856096","N/a","N/a","Great culture and great people","No negative comments at the moment","5.0","2020-10-31T19:32:55.713","Current employee - Investment Banking Associate","Los Angeles, CA","REGULAR","next_f"
"37847299","okay","okay","they pay well for performance","work load is alot of work","2.0","2020-10-31T09:15:25.123","Current employee - Business Analyst","Bridgeport, CT","REGULAR","next_f"
"37792442","Review","Review","Good place to work and grow","Less notoriety than some US banks","5.0","2020-10-29T17:13:13.467","Current employee - Associate","New York, NY","REGULAR","next_f"
"37632316","Good Place","Good Place","Friendly Workplace and vey nice people","Hours can be crazy at times","4.0","2020-10-26T12:47:23.867","Current employee - Senior IT Auditor","New York, NY","REGULAR","next_f"
"37406641","Excellent company culture","Excellent company culture","Care for employees and flat org structure","Nothing really. Has been great","5.0","2020-10-20T18:11:33.887","Current employee - Equity Research Associate","New York, NY","REGULAR","next_f"
"37380353","RBC analyst","RBC analyst","The people, and environment makes it a great place to work","The amount of hours, but that was known going into the job","5.0","2020-10-20T08:25:43.293","Current employee - Corporate Banking Analyst","New York, NY","REGULAR","next_f"
"37237584","Good work environment","Good work environment","Helpful management and an encouraging environment","Technology is huge weakness at RBC, systems are all outdated and don't communicate with each other.","4.0","2020-10-16T10:55:15.133","Current employee - Registered Client Associate","San Francisco, CA","REGULAR","next_f"
"36847568","A","A","Definitely the people you work with","Could use some help with training","4.0","2020-10-07T11:52:43.783","Former employee - Real Estate Closer","Raleigh, NC","REGULAR","next_f"
"36807048","Great benefits, great people","Great benefits, great people","Really excellent colleagues and great benefits make this a decent place to work.","The pay is targeted to be middle of the road and there is an expectation to go above and beyond in all positions,","4.0","2020-10-06T18:19:40.420","Current employee - Human Resources Business Analyst","Minneapolis, MN","REGULAR","next_f"
"36645888","A Canadian company, so great health insurance","A Canadian company, so great health insurance","Excellent health insurance even for Part-timers.","Being a bank teller used to be a nice job helping the customer, but now all banks force you to sell sell sell accounts. It's pushy, and wrong.","4.0","2020-10-02T19:13:14.843","Former employee - Bank Teller","Gastonia, NC","PART_TIME","next_f"
"36517776","Good","Good","Great culture and firm overall at RBC","Nothing too bad about the firm","4.0","2020-09-29T20:00:30.717","Current employee - Investment Banking Analyst","New York, NY","REGULAR","next_f"
