"review_id","title","body","pros","cons","rating","date","role","location","employmentStatus","_source"
"103116481","Great","Great","It is really great working here","Hard to decide what to eat at the cafeteria","5.0","2026-03-10T11:47:45.697","Current employee - Technical Account Manager (TAM)","San Jose, CA","REGULAR","next_f"
"103050129","Great company","Great company","Good WLB Great teams and Great culture","Getting things out can be tricky with multi cross orgs","5.0","2026-03-04T22:36:37.230","Current employee - Principal Product Manager","San Jose, CA","REGULAR","next_f"
"103048707","Great company","Great company","Great products Good people Good culture","Lots of products leads to lots of people","5.0","2026-03-04T19:33:20.607","Current employee - Sales Representative","New York, NY","REGULAR","next_f"
"103035128","Great company but don't rely on them for H1B","Great company but don't rely on them for H1B","Low pressure, great benefits, and good working culture.","Slow moving and bad HR department that was condescending and unhelpful.","4.0","2026-03-03T22:38:52.277","Former employee - Product Marketing Manager","San Jose, CA","REGULAR","next_f"
"103025727","Hard to grow","Hard to grow","Some people are nice and willing to mentor","Too many staff levels that take projects","2.0","2026-03-03T08:42:52.217","Current employee - UX Designer","San Francisco, CA","REGULAR","next_f"
"103025686","Sales Operations","Sales Operations","I loved my time working at Adobe. Great company and better people. Sabbaticals are incredible with 4-6 weeks off every 5 years based on when you started.","There are some seasons that you work long hours, with little to no recognition. Balance of work sometimes differs between team members based on who they are aligned to.","5.0","2026-03-03T08:40:46.747","Former employee - Team Lead, Sales Operations","Lehi, UT","REGULAR","next_f"
"102959855","Great Place to work at","Great Place to work at","People and benefits are amazing.","Marketing Departments are very siloed from each other.","5.0","2026-02-25T14:16:08.340","Former employee - Digital Marketing Specialist","Austin, TX","REGULAR","next_f"
"102937287","run away","run away","Excellent benefits Work - life balance depends on project","Poor management and leadership No clear vision for the company's future","3.0","2026-02-24T06:27:01.963","Current employee - Software Development Engineer (SDE)","San Jose, CA","REGULAR","next_f"
"102931579","great company","great company","everything is great, caring to its employees","nothing bad. just apply for its job openings","4.0","2026-02-23T20:10:30.170","Former employee - Senior Software Engineer","San Jose, CA","REGULAR","next_f"
"102907665","Strong engineering culture","Strong engineering culture","High-impact ML projects, especially in GenAI and document intelligence Smart, collaborative teammates with strong engineering standards Competitive compensation and solid benefits Clear focus on product quality and user experience Opportunity to own projects and work cross-functionally","Work–life balance can be challenging, especially during releases Tight deadlines and shifting priorities create pressure Cross-team dependencies increase workload Expectations can extend beyond normal working hours Pace can feel intense for long periods","3.0","2026-02-21T12:18:16.643","Current employee - ML Engineer","San Jose, CA","REGULAR","next_f"
"102898404","Love working here!","Love working here!","The team is incredibly inviting, and there is just infinite potential with how to grow.","It can definitely be overwhelming to learning everything there is to the job, but I feel like that just comes with the territory naturally no matter where you go.","5.0","2026-02-20T10:23:00.113","Current employee - Business Development Representative (BDR)","San Francisco, CA","REGULAR","next_f"
"102885705","Dream Job","Dream Job","Amazing culture, fantastic pay, great benefits.","There are no negatives about working here.","5.0","2026-02-19T11:28:27.813","Current employee - Account Executive","Los Angeles, CA","REGULAR","next_f"
"102863850","Nice work and life balance","Nice work and life balance","Good work and life balance","I don’t have any cons to list.","5.0","2026-02-18T00:01:18.340","Current employee - Quality Engineer","San Jose, CA","REGULAR","next_f"
"102854461","Contracted employee","Contracted employee","i had a friendly and helpful team","Lack of future planning around contract end","3.0","2026-02-17T07:36:30.503","Former employee - Customer Success Manager","New York, NY","REGULAR","next_f"
"102826746","Great culture and genuine people","Great culture and genuine people","Fantastic and genuine colleagues. Hard to beat the culture. Teammates feel like people you can be friends with outside of work though this is probably heavily team dependent. Great opportunities to pivot","Some politics but not as bad as other companies.","4.0","2026-02-14T00:21:44.353","Former employee - Associate Legal Counsel","San Jose, CA","REGULAR","next_f"
"102825458","Great culture, but very siloed","Great culture, but very siloed","Culture, work life balance, people","Unaligned priorities across orgs create frustrating silos","4.0","2026-02-13T18:19:27.923","Current employee - Program Manager","Denver, CO","REGULAR","next_f"
"102821796","Good","Good","Work life balance depending on the role. High priority roles don’t have balance, but lesser priority roles do","Not a con, but it’s an older crowd. Not very many younger people","4.0","2026-02-13T10:02:21.230","Current employee - Senior Financial Analyst","San Francisco, CA","REGULAR","next_f"
"102812488","best job ever","best job ever","remote great pay / better benefits","working at a big company isn't for everyone","5.0","2026-02-12T17:20:42.617","Former employee - Account Manager","West Palm Beach, FL","REGULAR","next_f"
"102714552","Great Company to work for","Great Company to work for","One of the best Culture","work is not challenging enough","5.0","2026-02-06T07:02:06.180","Former employee - Sr. Enterprise Architect","Detroit, MI","REGULAR","next_f"
"102703460","Great company","Great company","Work life balance, benefits, pay, culture","Huge company, siloed, hard to move the needle","5.0","2026-02-05T15:53:43.390","Current employee - Senior Operations Manager","Denver, CO","REGULAR","next_f"
"102649428","Great Company","Great Company","Huge company but each office feels small. Offer hybrid work from home. Pay and benefits are great.","No cons for the moment","5.0","2026-02-03T11:37:28.550","Current employee - Business Development Representative (BDR)","Denver, CO","REGULAR","next_f"
"102633450","Good WLB","Good WLB","good wlb decent growth decent pay","slower pace not enough pay if you're looking for more not exciting products depending on your team","4.0","2026-02-02T21:22:30.087","Current employee - IOS Engineer","San Jose, CA","REGULAR","next_f"
"102611097","Best Company","Best Company","really good place to work, good work liofe balance , competitive pay","no cons , slow growth","5.0","2026-02-01T22:40:03.220","Current employee - SWE New Grad","San Jose, CA","REGULAR","next_f"
"102610274","Sales AE review","Sales AE review","Adobe is a great place to work if you’re in sales and want to sell strong products that actually deliver value. The brand opens doors, customers respect the platform, and the product roadmap (especially around AI) makes it easier to have strategic, executive-level conversations. The culture is genuinely supportive and collaborative — sales isn’t a “lone wolf” environment. Product, activation, CS, and marketing teams are smart, engaged, and willing to partner, which makes a big difference when working complex enterprise deals. Benefits and flexibility are also top-tier, and leadership generally trusts you to run your business.","Like most large companies, things can move slowly and there are a lot of stakeholders involved, which can be frustrating when you’re trying to move fast on deals. The sales environment is evolving quickly, so priorities and coverage models can shift year to year. You need to be comfortable navigating change and advocating for yourself.","3.0","2026-02-01T21:16:11.757","Current employee - Sales Representative","Austin, TX","REGULAR","next_f"
"102608971","Ok","Ok","Xmas and summer shut downs are great perks.","Not a lot work life balance the higher you go.","3.0","2026-02-01T19:05:46.200","Current employee - Principal Program Manager","San Jose, CA","REGULAR","next_f"
"102591676","So far so good","So far so good","People friendly, many perks, projects","Big org, lots of process, face challenge from ai","4.0","2026-01-31T07:15:20.453","Current employee - Senior MLE","San Jose, CA","REGULAR","next_f"
"102536419","I don't get the hype","I don't get the hype","Pay, Benefits, etc. All the things that they do to keep people around.","Very siloed and difficult to get help or clarity on anything. Important emails go unanswered, crucial stakeholders required for meetings are frequently double booked, processes take weeks instead of days, and every time I try to get something done I encounter multiple unnecessary blockers, usually due to a breakdown of communication across teams. Enormous, bloated company, leaders don't want to make decisions so they just kick the can to another team. Too many different sites across timezones slows everything down. The back to office policy is ridiculous, unnecessary, and unevenly applied and we get no guidance during major storms or global events. And despite being a software company, our 3P software is dated and inefficient.","2.0","2026-01-28T14:16:32.070","Current employee - Program Manager","New York, NY","REGULAR","next_f"
"102526661","Great place to work!","Great place to work!","Great benefits, smart people, software is fun to sell","Can be difficult, lots of pressure","5.0","2026-01-28T07:00:09.397","Current employee - Sales","New York, NY","REGULAR","next_f"
"102513322","Decent Company Without Innovation","Decent Company Without Innovation","WLB is ok even in the least reputable orgs","No innovation anywhere. Highly political.","3.0","2026-01-27T14:53:00.700","Current employee - Machine Learning Engineer","San Jose, CA","REGULAR","next_f"
"102511933","Pretty good, not amazing","Pretty good, not amazing","Good people to work with. Good pa.","Culture seems to be shifting away from prioritizing work life balance.","4.0","2026-01-27T13:31:55.283","Current employee - Software Development Engineer","Lehi, UT","REGULAR","next_f"
"102431216","Great Company","Great Company","Room to grow, most everyone is highly motivated and extremely capable.","Many years before you can get into management","5.0","2026-01-22T20:27:29.830","Current employee - Data Engineer","Lehi, UT","REGULAR","next_f"
"102427701","Good Company","Good Company","Great pay Great benefits Great work/life balance","Getting to big, lots of bureaucracy.","4.0","2026-01-22T15:52:28.667","Current employee - Director of Sales","San Diego, CA","REGULAR","next_f"
"102419446","Wonderful people, mediocre work","Wonderful people, mediocre work","I love the people I work with and the work I do. Adobe works hard to include everyone—not just the loudest voice. Great offices. Great benefits including clubs, a gym, a video game room, and activities.","It's wild west. Official processes are often ignored. PM, Design, and Engineering often operate in parallel. Too much churn. Too many needless inefficiencies. Too many silos. A handful of senior leaders that are more interested in building a personal kingdom than good products.","4.0","2026-01-22T09:02:07.927","Current employee - Product Designer","Lehi, UT","REGULAR","next_f"
"102404018","Amazing company, depends on the team","Amazing company, depends on the team","-great work life balance -people are usually nice","-projects can be slow depending on the product/team","5.0","2026-01-21T16:34:00.510","Current employee - Senior Frontend Engineer","San Francisco, CA","REGULAR","next_f"
"102354989","Love this company","Love this company","Treats employees well Movement laterally and horizontally Opportunities to learn","Sometimes can take a while to get promoted","5.0","2026-01-19T19:19:42.163","Current employee - Business Development","San Francisco, CA","REGULAR","next_f"
"102300273","Mid","Mid","1 month Sabbatical after 5 years, 4-6 months paid paternity/ maternity","Lot's of disparate software, too many middle managers, each with their own priorities. This means that everything and nothing is a priority at the same time.","3.0","2026-01-16T08:47:37.980","Current employee - Solution Account Manager","Salt Lake City, UT","REGULAR","next_f"
"102289126","Great company hard work","Great company hard work","Great support from management and department with ongoing training","Can be luck of the draw with territories and verticals","5.0","2026-01-15T19:44:29.343","Former employee - Account Development Manager","Lehi, UT","REGULAR","next_f"
"102286845","Account Executive Digital Media","Account Executive Digital Media","- culture and benefits are great here","- quota in the past couple of years has been somewhat unrealistic","4.0","2026-01-15T16:45:57.177","Former employee - Account Executive","San Jose, CA","REGULAR","next_f"
"102281606","Politics, Cylo work.","Politics, Cylo work.","Great Food and Work Life Blance","Office Politics, No Bonding with Teammates and No Career Opportunities","3.0","2026-01-15T11:44:03.880","Current employee - Senior Software Engineer II","San Jose, CA","REGULAR","next_f"
"102265444","Good Culture and Good People","Good Culture and Good People","A good place to work with good people","Too conservative with strategy and execution","4.0","2026-01-14T19:00:09.977","Current employee - Account Executive","Memphis, TN","REGULAR","next_f"
"102237639","Ageism is alive","Ageism is alive","Fantastic place to work, spent many enjoyable years there.","Old people need not apply. It’s a young persons work place.","5.0","2026-01-13T15:44:13.673","Former employee - Computer Scientist","San Jose, CA","REGULAR","next_f"
"102203661","Work at Adobe","Work at Adobe","great work life balance at Adobe","could be slow at times.","5.0","2026-01-12T07:48:59.480","Current employee - Senior Software Engineer","Lehi, UT","REGULAR","next_f"
"102190900","Good Overall","Good Overall","Good culture, people, and work-life balance","Fewer people in the office [in person]","4.0","2026-01-11T14:30:11.363","Current employee - Data Science Engineer","San Jose, CA","REGULAR","next_f"
"102144373","Once great, but left bitter taste with recent shift in leadership","Once great, but left bitter taste with recent shift in leadership","Great healthcare plans (Once) positive, supportive culture Flexibility of work setting","New leadership somewhat frequently - moved culture in a negative direction Bureaucratic and slow to move Teams doing the same things without realizing it, then turning around and blaming each other","3.0","2026-01-08T11:25:18.800","Former employee - Operations Manager","Los Angeles, CA","REGULAR","next_f"
"102119115","Great","Great","Benefits, culture, promotions, just a great company","Some hard areas to advance in because everyone’s so great at their jobs, competitive","5.0","2026-01-07T10:25:36.460","Former employee - Business Development Representative (BDR)","Detroit, MI","REGULAR","next_f"
"102101711","A company worth growing with...","A company worth growing with...","Adobe is a company that, as a whole, strives to consider the individual. I have seen this time and time again from C-level leaders and my own personal managers. They care about your growth and ensuring you have an excellent experience working for them.","Some people managers are in positions that are best not being managers; they are excellent architects, senior-level professionals, but shouldn't be managing employees. That being said, I have seen them provide opportunities for these employees to learn, grow, and give them a chance before looking for better fits for their employees.","4.0","2026-01-06T14:59:13.200","Current employee - Site Reliability Engineer","Lehi, UT","REGULAR","next_f"
"102051887","Great Place to Work","Great Place to Work","Adobe is the best place i've worked by far.","Moves slow in certain areas like recruitment","5.0","2026-01-03T11:59:49.593","Current employee - Director","New York, NY","REGULAR","next_f"
"102043582","Compensation MLE Adobe","Compensation MLE Adobe","Good Company to work in!","Slow, Less Navigation, Unclear about AI Space.","4.0","2026-01-02T13:11:17.330","Current employee - Machine Learning Engineer","San Jose, CA","REGULAR","next_f"
"101987959","Great Team","Great Team","Greta salary, benefits, and people","Lots of changes with reorganization &amp; focus","5.0","2025-12-28T07:27:09.413","Current employee - Customer Success Manager","New York, NY","REGULAR","next_f"
"101953390","Solid Job","Solid Job","Good perks, and pay with bonuses","No room for movement up word","4.0","2025-12-23T14:59:21.013","Former employee - Manager","San Jose, CA","REGULAR","next_f"
"101951820","You'll be comfortably unhappy","You'll be comfortably unhappy","Good benefits, work environment good","Advancement opportunities are few and far between. There is a lot of favoritism and it doesn't matter how much you contribute to their goals if you aren't in favor you aren't going anywhere.","3.0","2025-12-23T12:00:04.640","Current employee - Senior Order Management Analyst","Utahn, UT","REGULAR","next_f"
"101920061","Friendly culture, good work-life balance, and great benefits","Friendly culture, good work-life balance, and great benefits","- great with work-life balance - hybrid schedule (2/3 days in office) - in office cafeteria, gym, and music room","- new grad role salaries feel slightly low compared to other tech firms - lack of support for internal career moves","4.0","2025-12-21T01:28:34.353","Current employee - Program Manager","San Jose, CA","REGULAR","next_f"
"101917595","BEST company to work for","BEST company to work for","Great company, with lots of great engineers, managers and and tech leaders.","None that i can think of","5.0","2025-12-20T16:13:57.077","Current employee - AI Platform Engineer","San Jose, CA","REGULAR","next_f"
"101870184","Review of Adobe Research","Review of Adobe Research","1. Talented, motivated people. 2. Freedom to work on problems that interest you.","1. Products have a lot of legacy and are slow-moving. 2. A lot of politics &amp; friction between Research and Firefly.","4.0","2025-12-17T11:28:00.110","Current employee - Resarch Scientist","San Francisco, CA","REGULAR","next_f"
"101866166","Meh","Meh","Good pay, good product, good executive leadership","I worked remotely, so this doesn't necessarily apply to Tysons, but the people I worked with were unrealistically confident in their abilities. Talked poorly about and to the client and overall just not pleasant to work with.","3.0","2025-12-17T08:02:17.573","Former employee - Program Manager","Tysons Corner, VA","REGULAR","next_f"
"101781859","Overall a good company","Overall a good company","Smart PM group to wrok with. Scale of impact is exciting.","Some groups could be tough to work at. Could be very hierarchical","4.0","2025-12-11T20:08:07.060","Current employee","San Jose, CA","REGULAR","next_f"
"101777252","Great Benefits, okay leadership","Great Benefits, okay leadership","Benefits, Inclusive community, wonderful personal work-life balance","Leadership is astray, constant re-orgs, the hardest workers get the least attention and the most work.","3.0","2025-12-11T13:19:03.843","Current employee - Marketing","San Jose, CA","REGULAR","next_f"
"101753961","Great place to work at","Great place to work at","Good technology, work life balance","salaries tend to be on the low side and must move the get major bumps in salary","5.0","2025-12-10T10:17:42.580","Current employee - Enterprise Architect","Dallas, TX","REGULAR","next_f"
"101656416","Good company","Good company","Good benefits and great pay","Politics should not be a part of any company","3.0","2025-12-04T17:36:35.220","Former employee - Senior Recruiter","Atlanta, GA","REGULAR","next_f"
"101567138","Solid company to spend a significant amount of time at","Solid company to spend a significant amount of time at","Work life balance, predictable annual raises, fun activities and perks. Great coworkers.","Promotions can be political and frustrating.","4.0","2025-11-30T19:10:02.093","Current employee - Senior Program Manager","Lehi, UT","REGULAR","next_f"
"101547922","Great company for internship","Great company for internship","No too much production pressure. A good place for doing pure research.","Your experience depends on how much resources your group will have.","5.0","2025-11-28T17:01:45.570","Current employee - Research Scientist Engineer Intern","San Jose, CA","REGULAR","next_f"
"101546142","Amazing place to work","Amazing place to work","Good WLB and amazing folks!","Few if any real cons, Not FAANG tier comp but not really an issue for quality of life gains!","5.0","2025-11-28T12:59:37.973","Former employee - Senior Software Engineer","San Jose, CA","REGULAR","next_f"
"101529807","Software Engineer","Software Engineer","Work-Life Balance and Good Culture","Slow promotion and lack of good management vision","4.0","2025-11-27T11:29:48.407","Current employee - Software Engineer","San Jose, CA","REGULAR","next_f"
"101434279","Resting on laurels","Resting on laurels","AI offering, acrobat platform, creative cloud. Products sell themselves, but competition has arisen with little resistance or rebuttal. The offices are very nice at Adobe. Good employee benefits.","The company is resting on its laurels. It does not feel like there is much leadership at the helm at the moment as the stock price continues to dwindle severely. The culture I'd describe as very laid back, coasting, no real sense of urgency or innovation.","4.0","2025-11-22T06:35:15.053","Current employee - Inside Sales Representative","McLean, VA","REGULAR","next_f"
"101424108","Great Benefits","Great Benefits","Very warm workplace and great environment","need to leave the company when you're early career for corrected salary","5.0","2025-11-21T10:56:44.543","Current employee - Business Systems Analyst","Seattle, WA","REGULAR","next_f"
"101408723","Poor leadership","Poor leadership","Best WLB in GenAI I guess","leadership cannot keep up with AI competition","3.0","2025-11-20T17:02:36.167","Current employee - Machine Learning Engineer","San Jose, CA","REGULAR","next_f"
"101403880","Good place overall, but things can get chaotic internally","Good place overall, but things can get chaotic internally","Solid company perks and benefits.","Bureaucracy and politics cause change to happen very slowly.","4.0","2025-11-20T11:59:40.663","Former employee - Partnership Manager","San Francisco, CA","REGULAR","next_f"
"101354451","Loved my time at Adobe","Loved my time at Adobe","Great culture, great products. Reasonable expectations for corporate. Good WLB (if it's not Q4, obviously).","Very slow, bureaucratic. Contracts take forever to be processed.","5.0","2025-11-18T11:29:42.263","Former employee - Sales Manager","Chicago, IL","REGULAR","next_f"
"101316314","Awesome company","Awesome company","Great people, great benefits, great culture.","There really aren't any. It's a perfect company to work for.","5.0","2025-11-16T20:59:59.540","Former employee - Sr. Solutions Consultant","Lehi, UT","REGULAR","next_f"
"101303646","Work is work for","Work is work for","Hybrid work with in office time not strictly enforced","Work-a-holic culture. A lot of egos.","3.0","2025-11-15T19:02:01.787","Current employee - Content Producer","Seattle, WA","REGULAR","next_f"
"101274587","Good for beginner.","Good for beginner.","Great benefits. Pay ok, above average.","Culture depends on org. Several orgs have terrible WLB. Slow career advancement.","3.0","2025-11-13T22:48:29.627","Former employee - Senior Product Manager","San Jose, CA","REGULAR","next_f"
"101271469","Truly a great company","Truly a great company","The people. The people are the best part of Adobe. You will not find this high quality of co-workers at many other places. The benefits are also fantastic. The charitable match is far superior to other large tech companies. The education reimbursement is wonderful.","Things can sometimes move slow because this is a large company and has bureaucracy, but it isn't worse than other companies of this size and in fact is quite a bit better.","5.0","2025-11-13T18:16:16.770","Current employee - Solution Specialist","Lehi, UT","REGULAR","next_f"
"101239052","Challenging work","Challenging work","Day to day changes in position","Company workload has increased since Covid","4.0","2025-11-12T11:12:24.540","Current employee - Partner Manager","Denver, CO","REGULAR","next_f"
"101172226","Software Engineer","Software Engineer","Strong brand reputation: Adobe is a well-established, respected tech company. Innovative product portfolio: Work on creative tools like Photoshop, Illustrator, and Adobe Sensei. Competitive compensation: Salaries, bonuses, and stock options are generally strong. Work-life balance: Many teams report reasonable hours and flexibility. Learning opportunities: Access to cutting-edge tech, internal mobility, and professional development.","Large company bureaucracy: Slower decision-making and more red tape. Product legacy complexity: Older codebases can be hard to modernize. Team experience varies: Culture and workload can differ widely by org. Innovation pace: Some engineers feel constrained by product cycles or legacy systems.","4.0","2025-11-09T18:54:15.827","Former employee - Software Engineer","Seattle, WA","REGULAR","next_f"
