"review_id","title","body","pros","cons","rating","date","role","location","employmentStatus","_source"
"80463040","-","-","-Work Culture -Professional Growth -Work Life Balance","Haven't found any downsides yet","5.0","2023-09-27T10:59:35.643","Current employee - Experience Design Strategist","San Francisco, CA","REGULAR","next_f"
"80444202","Ok","Ok","Benefits nice people and structure","Chaotic environment and always behind","3.0","2023-09-26T23:23:55.633","Current employee - Designer","San Jose, CA","REGULAR","next_f"
"80358539","Learned a lot","Learned a lot","Great place to intern- good experience.","no cons- great experience at Adobe.","5.0","2023-09-24T06:53:35.523","Former employee - Intern","Santa Clara, CA","PART_TIME","next_f"
"80330471","Adobe San Francisco","Adobe San Francisco","Decent benefits employee discount for products","Overly centralized leadership making it hard to make quick decisions","4.0","2023-09-22T13:43:09.670","Former employee - Group Manager","San Francisco, CA","REGULAR","next_f"
"80303636","Great company, little opportunity for growth","Great company, little opportunity for growth","Awesome benefits and environment to collaborate","There is very little opportunity to grow","5.0","2023-09-21T18:16:18.847","Current employee - Software Engineer","Santa Clara, CA","REGULAR","next_f"
"80220365","Good company","Good company","Great pay here are more words","None and some more words","5.0","2023-09-19T14:29:11.327","Current employee - Softwre Engineer","San Jose, CA","REGULAR","next_f"
"80186825","Super Good Experience","Super Good Experience","Lots of interns to connect with. Really good work life balance and company culture.","Easy to get lost as an intern at such a big comapny.","5.0","2023-09-18T17:35:49.490","Former employee - Software Engineer(Internship)","San Francisco, CA","REGULAR","next_f"
"80175386","Great place to work","Great place to work","Great place to work and great people, great work life balance","politics exist as with any company, but IMO not as bad","5.0","2023-09-18T10:56:41.800","Current employee - Software Engineer","San Jose, CA","REGULAR","next_f"
"80148963","Great","Great","Great work culture and people","NA. Nothing as such is bad","5.0","2023-09-17T14:14:54.543","Former employee - Project Manager","Indianola, IA","REGULAR","next_f"
"80133654","Work for a company that isn't owned by a malevolent oligarch.","Work for a company that isn't owned by a malevolent oligarch.","Not evil and doesn't practice age discrimination. Lot's of opportunities to learn and advance.","No travel since Covid and development is too focused on short term objectives.","5.0","2023-09-16T17:05:44.923","Current employee - Senior Software Engineer","Seattle, WA","REGULAR","next_f"
"80113338","Flexible and good learning","Flexible and good learning","Learned a lot Great vendors","Too much red tape and unnecessary process","4.0","2023-09-15T15:43:31.153","Former employee","Washington, DC","REGULAR","next_f"
"80107421","Good people, leadership seems very confused","Good people, leadership seems very confused","Great people Interesting field of work Great benefits","Management seems often confused by direction for products","4.0","2023-09-15T11:31:33.133","Current employee - Senior Software Engineer","San Francisco, CA","REGULAR","next_f"
"80045836","Greta place to work!","Greta place to work!","Amazing talent programs for employees","Fast paced and somewhat of a difference experience based on your manager.","5.0","2023-09-13T18:14:47.497","Current employee - Global Head of Talent & Development","San Jose, CA","REGULAR","next_f"
"80044399","Great experience","Great experience","Good solid company, great to build a network.","Growth opportunities are pretty inconsistent","5.0","2023-09-13T17:10:23.283","Former employee - Administrative Assistant","Lehi, UT","REGULAR","next_f"
"80028669","Great place to work!","Great place to work!","Tons of amenities and support!","Giant company, hard to move up internally since there is a lot of competition.","5.0","2023-09-13T08:50:50.007","Current employee","Lehi, UT","REGULAR","next_f"
"79915146","It's","It's","Environment Work Coworkers Friendly Snacks","Busy Not always clear on assignments","4.0","2023-09-09T19:10:17.720","Current employee - Secretary","Lehi, UT","PART_TIME","next_f"
"79889065","Amazing genuine yet competitive place","Amazing genuine yet competitive place","-Crazy smart people depending on team -Too much pressure from sales and lack of innovation -Career development","-Can be very competitive -Management plays favorites","5.0","2023-09-08T11:27:45.267","Current employee - Senior Manager","New York, NY","REGULAR","next_f"
"79882596","Good Firm","Good Firm","Pay and time off policy","Too many politics that differed by office. Old boys club still in effect.","4.0","2023-09-08T07:44:05.927","Former employee - Sales Manager","New York, NY","REGULAR","next_f"
"79867442","Great company","Great company","Love working at this company. They treat their employees really well. They give great benefits and stock options. Managers are nice.","Work is boring. Everyone assumes you understand their field or line of work. Very fast paced and give short deadlines.","5.0","2023-09-07T18:54:26.103","Current employee - Senior Instructional Designer","Allen, TX","REGULAR","next_f"
"79820388","1 Year Associate Grad Program","1 Year Associate Grad Program","- great benefits - good company culture - heavy emphasis on giving and receiving feedback -lots of growth opportunities","- very large company - confusing ecosystem","4.0","2023-09-06T10:29:29.517","Former employee - Customer Success Associate","New York, NY","REGULAR","next_f"
"79782520","Amazing place to work!","Amazing place to work!","amazing benefits. smart co-workers. successful company with products i believe in.","The pace can get overwhelming if you aren't used to it.","5.0","2023-09-05T09:25:54.857","Current employee - Solutions Architect","Lehi, UT","REGULAR","next_f"
"79732299","Adobe experience","Adobe experience","Have learned a lot, generally helpful &amp; fun co-workers","Poor work / life balance.","3.0","2023-09-03T16:38:15.763","Current employee - Art Director","Seattle, WA","REGULAR","next_f"
"79715682","salary","salary","good salary,superior benefits and pay","poor management in the pm area","3.0","2023-09-02T14:53:26.400","Current employee - Engineering Manager","Utah, IL","REGULAR","next_f"
"79699497","Great Company","Great Company","Clear communication Great work life balance Smart people Interesting product areas","A typically large corporate environment","5.0","2023-09-01T16:17:34.477","Former employee - Senior Software Engineer","Seattle, WA","REGULAR","next_f"
"79651814","Excellent Employer","Excellent Employer","Great Benefits Culture Training and Support Career Progression","None that I can add","5.0","2023-08-31T06:25:09.163","Former employee - Solutions Architect","Fort Lauderdale, FL","REGULAR","next_f"
"79592302","Okayish","Okayish","Its a big company, so the pay, benefits and employee resources are good","It's too big for entry level employees to thrive. It's difficult to get training and mentorship if you're new to the role.","2.0","2023-08-29T12:44:43.503","Current employee - Financial Analyst","San Jose, CA","REGULAR","next_f"
"79591921","Not real commission","Not real commission","Great company culture, wellness program, and technology.","They don't pay true commissions and your job will be hourly (not salary).","4.0","2023-08-29T12:34:35.983","Former employee - Account Executive","San Jose, CA","REGULAR","next_f"
"79564629","Bad","Bad","Good environment with coworkers. Respectful","Management has no plan. Very bad","2.0","2023-08-28T18:34:01.783","Former employee - Software Engineer","San Jose, CA","REGULAR","next_f"
"79489809","Adobe is on PEOPLE's annual list of 100 Companies That Care 2023","Adobe is on PEOPLE's annual list of 100 Companies That Care 2023","This award recognizes companies that go above and beyond to honor their customers, empower their employees, and make the world a better place. We're recognized for our work with the Equity and Advancement Initiative, where we're collaborating with leading nonprofits to foster racial and social justice around the world. Adobe matches employee contributions to charities and disaster response organizations, supports employees doing Board service, and more. Adobe supports hybrid remote and in-office working arrangements.","As with any company that is growing rapidly, progressive policies and corporate decisions are not always in 100% alignment with all employees. Adobe does listen and adjust to employees concerns.","5.0","2023-08-25T13:33:32.490","Current employee - Studio Manager","San Francisco, CA","REGULAR","next_f"
"79488827","Good company","Good company","Good pay and benefits overall","Nothing that I know of,","5.0","2023-08-25T12:55:09.027","Current employee - Software Engineer","San Jose, CA","REGULAR","next_f"
"79485038","Amazing Place to Work","Amazing Place to Work","Great work-life balance, caring teams, fulfilling role","Nothing negative, I had a great time as an intern.","5.0","2023-08-25T10:34:53.980","Former employee - Cyber Fraud Intern","San Jose, CA","REGULAR","next_f"
"79380964","Large with lots of beuracracy","Large with lots of beuracracy","Hybrid work Paternity/ Maternity leave Competitive Pay","Large bureaucracy and slow moving internal processes","3.0","2023-08-22T13:48:23.600","Current employee - Sales Account Manager","Lehi, UT","REGULAR","next_f"
"79377149","Work as Front-end developer on their website","Work as Front-end developer on their website","Good company, great place to work","Egoist team, non supportive manager","3.0","2023-08-22T11:56:37.620","Former employee - Web Development Engineer","Lehi, UT","REGULAR","next_f"
"79289259","Technical Account Manager (TAM)","Technical Account Manager (TAM)","Amazing culture, benefits and work to life balance","Abrupt change in role is common","4.0","2023-08-19T07:01:43.360","Current employee - Technical Account Manager (TAM)","San Jose, CA","REGULAR","next_f"
"79276407","Great challenge and growth opportunities","Great challenge and growth opportunities","Fun team lots of opportunity to grow and learn","Lots of work to do","5.0","2023-08-18T13:56:30.137","Current employee - Cyber Security","Lehi, UT","REGULAR","next_f"
"79276131","Great benefits, comfy tech job, be OK with burueacracy","Great benefits, comfy tech job, be OK with burueacracy","Great benefits, Flexible working schedule(s), great leaders, smart people","A lot of internal confusion, siloes, and disorganization in mobilizing non-DX and Creative Cloud parts of the business.","4.0","2023-08-18T13:42:36.757","Current employee - Senior Solutions Consultant","San Francisco, CA","REGULAR","next_f"
"79212860",".",".","None, big brand but highly toxic culture","Toxic cultures, backstabbing coworkers, poor leadership, pip culture","1.0","2023-08-16T17:44:10.510","Former employee - Finance Lead","San Jose, CA","REGULAR","next_f"
"79143691","Great comapany","Great comapany","Amazing company to work for","There is None disadvantage and it’s a great work place","5.0","2023-08-14T19:22:51.773","Current employee","Salt Lake City, UT","REGULAR","next_f"
"79129987","It really is a great place to work","It really is a great place to work","Great company culture Career advancement opportunities Product innovation Awesome benefits Diversity and inclusion","I don’t have anything negative to say, truly","5.0","2023-08-14T10:15:12.880","Current employee - Account Executive","San Jose, CA","REGULAR","next_f"
"79110363","Amazing Place to Work Longterm","Amazing Place to Work Longterm","I feel really supported and hoisted up in this role. The benefits are amazing. The people are great. I also love my manager which goes a long way. As far as craft goes, people are really knowledgeable and I’ve learned a lot.","Working with PMs can be hard sometimes.","5.0","2023-08-13T17:36:17.943","Current employee - User Experience Designer","New York, NY","REGULAR","next_f"
"78991821","Best company I have worked for","Best company I have worked for","Gives you the tools you need to be successful. Great Benefits","Constantly changing responsibilities. (Could also be a pro)","5.0","2023-08-09T06:42:31.253","Current employee","New York, NY","REGULAR","next_f"
"78970666","Fantastic company","Fantastic company","Incredible benefits, supportive management and great work life balance","Hard to move up without experience, but need experience to move up","5.0","2023-08-08T14:06:48.383","Current employee - Business Development Representative (BDR)","Lehi, UT","REGULAR","next_f"
"78937667","A company with Good work and life balance and promising outlook","A company with Good work and life balance and promising outlook","Good work and life balance","some teams are too slow, not good for cross team collaboration if you are running to meet deadline","4.0","2023-08-07T16:25:07.300","Current employee - Manager","San Jose, CA","REGULAR","next_f"
"78907563","Maximum job security, minimum opportunities for career growth","Maximum job security, minimum opportunities for career growth","- It's really hard to get PIPed/fired - Everyone's generally really nice and I've never really encountered workplace toxicity that wasn't immediately addressed - Work life balance is about as good as it gets - Despite commands from leadership, hardly anyone is working on-site &gt;50%","- No one ever quits or gets fired, so there's little opportunity for upward or lateral mobility - The larger/older the codebase, the more difficult it is to contribute, and the more fragile the automation/build pipeline - The fact that so many still WFH makes it really difficult to get things from people when you need them -- expect Slack responses in either 2 minutes or 2 days","4.0","2023-08-06T19:25:40.373","Current employee - Software Developer 4","Seattle, WA","REGULAR","next_f"
"78743385","No security","No security","Some good people. Very clicky","Management sucks. Doesn't care about employees","1.0","2023-08-01T01:54:39.787","Former employee - Sales Manager","New York, NY","REGULAR","next_f"
"78726593","Best work life balance","Best work life balance","- Work life balance - Community - Job security","- Healthcare is solid but not the best - Work isn't crazy interesting, depending on team","5.0","2023-07-31T12:16:22.487","Former employee - Software Engineer","New York, NY","REGULAR","next_f"
"78699174","Very good","Very good","Great employers. Highly recommend company","Nothing at all. Great employees","5.0","2023-07-30T13:41:48.937","Current employee - Customer Service Manager (CSM)","San Antonio, TX","REGULAR","next_f"
"78657994","Yeah","Yeah","Its kinda stressing but nice overall","stressing bro you know right","4.0","2023-07-28T08:09:33.360","Current employee - Program Manager","Minnesota Lake, MN","REGULAR","next_f"
"78634278","Great place to work","Great place to work","Amazing benefits. Truly cares about employees.","Large company, can be easy to get lost. You have to put in the effort to be noticed.","5.0","2023-07-27T12:36:21.930","Current employee - Customer Success Manager","Tysons Corner, VA","REGULAR","next_f"
"78611661","Great Company","Great Company","Great benefits, great products for Enterprise companies. Name brand helps with prospecting at the Enterprise level. Management has been outstanding and supportive. Paid very well for this position and many BDR's are exceeding well beyond 100% of their quotas Tough to promote right now, but when market turns back around, Adobe has a great promotion path to level up in your career.","2023 has been tough to see any promotions due to economic factors. Has built a bottleneck of many BDR's being in seat for over 1.5 years with not many seats to fill at the next level. Comp plans are always changing which can be frustating","5.0","2023-07-26T21:42:03.427","Current employee - Account Development Representative","San Jose, CA","REGULAR","next_f"
"78594797","Great place to work, lot's of red tape.","Great place to work, lot's of red tape.","Great leadership and resources at your disposal.","Everything takes a long time to happen at Adobe. Processes on processes on processes.","4.0","2023-07-26T10:09:54.623","Current employee - Account Executive","Lehi, UT","REGULAR","next_f"
"78570359","Great company","Great company","Adobe a is terrific company to work for!","There are none that I can think of at this time.","5.0","2023-07-25T15:57:24.223","Current employee - Customer Success Engineer","California City, CA","REGULAR","next_f"
"78563523","They truly care about their employees","They truly care about their employees","They go above and beyond to provide an employee first experience. It's the first company where I felt like I really mattered.","No SOPs which make it hard for someone new coming into the company, but everyone is super helpful.","5.0","2023-07-25T11:44:10.700","Current employee - Senior Marketing-Manager","Los Angeles, CA","REGULAR","next_f"
"78509781","Great to place to work","Great to place to work","Amazing Culture and the team Good Pay Great benefits which includes 2 shutdowns (Summer and Winter), Wellness Days Strong Focus on Innovation","Hard to move up the ladder Priorities shift in a lightening speed Limited Resources / Hiring practices are very conservative","4.0","2023-07-23T22:23:03.300","Current employee - Senior Process Manager","San Jose, CA","REGULAR","next_f"
"78463268","Amazing Company better Benifits","Amazing Company better Benifits","Great base pay, amazing health and family benefits, so many resources to grow your career","Massive ecosystem to learn. Can be hard for newer employees who haven't worked at a larger company before","5.0","2023-07-21T09:11:55.363","Current employee - Sr Business Development representative","New York, NY","REGULAR","next_f"
"78414458","Great company to work for","Great company to work for","At the cutting edge of Generative AI for Design","Matrixed organization makes it difficult to make decisions","5.0","2023-07-19T21:12:58.990","Current employee - Product Marketing","San Francisco, CA","REGULAR","next_f"
"78400089","Great Place to Work and Develop","Great Place to Work and Develop","Worklife balance, friendly coworkers, internal career development and empathetic culture.","Limited salary growth over time.","5.0","2023-07-19T11:21:35.987","Current employee - Principal Business Consultant","Los Angeles, CA","REGULAR","next_f"
"78257789","Relaxed, growth is a problem","Relaxed, growth is a problem","- Very relaxed work and reasonable expectations - Very nice people, everyone is super family and life balance oriented","- A bit under pay compared to fb, google, etc. - Very limited growth opportunity after level 50","4.0","2023-07-14T08:58:33.377","Current employee - Senior Software Engineer","New York, NY","REGULAR","next_f"
"78234578","Best company to work with","Best company to work with","Best company to work with","nothing I can think of","5.0","2023-07-13T14:15:51.197","Current employee - Senior Computer Scientist","San Francisco, CA","REGULAR","next_f"
"78234265","Adobe Culture","Adobe Culture","Its a great company to work for","Values people who have been there for a long time","4.0","2023-07-13T14:03:43.437","Former employee","San Francisco, CA","REGULAR","next_f"
"78189137","Former Employee","Former Employee","benefits, my direct team was great, easy to get coverage with large teams","very bureaucratic - if you were not constantly networking internally it was hard to get promoted","3.0","2023-07-12T09:43:27.913","Former employee - Talent Acquisition","New York, NY","REGULAR","next_f"
"78155943","Great company to work for","Great company to work for","Great work life balance Great career opportunities","Just like any big organizations, there are politics and slow processess","5.0","2023-07-11T11:42:59.033","Current employee - Enterprise Account Executive","San Francisco, CA","REGULAR","next_f"
"78063687","Great Company","Great Company","Great culture, Great Food, Really Interesting Projects, Lots of opportunity for upward mobility, Tons of intelligent people to learn from","Salary can be more, Salary can be more, Salary can be more, Takes a lot to get the recognition you deserve to get a promotion; arguably more than in other places.","5.0","2023-07-08T01:06:12.737","Current employee - Software Engineer II","San Jose, CA","REGULAR","next_f"
"77841283","good place to work on top products","good place to work on top products","- Good work life balance in company","- Slow paced work , but thats a pro anyway","5.0","2023-06-29T17:38:08.560","Current employee - Software Developer","Seattle, WA","REGULAR","next_f"
"77836843","Adobe is an AMAZING company to work for","Adobe is an AMAZING company to work for","Adobe is all about the individual employee! You'll find amazing teams who are all eager and willing to help each other! We work together to continue to drive Adobe as the global leading creative software company!","Internal Mobility is possible but not as common as some people would like","5.0","2023-06-29T14:02:29.450","Current employee - Strategic Vendor MANAGER","Lehi, UT","REGULAR","next_f"
"77762031","Research internship review","Research internship review","As far as compensation and salaries, they treat you as full-time employees","The experience really depends on your mentor. I did not have much exposure to their product, my mentor treated me as a paper generation machine.","2.0","2023-06-27T11:23:57.353","Current employee - Research Intern","San Jose, CA","REGULAR","next_f"
"77759038","Amazing place to work","Amazing place to work","Pay, benefits, work life balance - literally everything","Experience Cloud Specific - story needs refinement","5.0","2023-06-27T09:58:53.900","Current employee - Senior Solutions Consultant","Austin, TX","REGULAR","next_f"
"77726196","Good settling company","Good settling company","Amazing company and great work-life balance","I still have to find that out","5.0","2023-06-26T11:49:15.480","Current employee - Sr Program Manager","Seattle, WA","REGULAR","next_f"
"77706497","Great Company","Great Company","Good WLB, Firefly team is really good, Research is great","I am contradicting myself but in recent time the WLB has taken a hit due to the GenAI pace of development. But still better than other places imo","5.0","2023-06-25T23:59:20.007","Current employee - Senior Machine Learning Engineer","San Jose, CA","REGULAR","next_f"
"77670071","BizOps Entry Salary","BizOps Entry Salary","Great benefits and amazing products","Large corporation and takes many years to move up the ladder of leveling to increase base pay.","5.0","2023-06-23T21:05:04.657","Current employee - Business Operations Manager","San Francisco, CA","REGULAR","next_f"
"77612923","Great environment, great opportunities","Great environment, great opportunities","Good work life balance Good compensation Working on stimulating problems","Not much, keep up with the good work","5.0","2023-06-22T04:13:01.837","Current employee - Research Intern","San Francisco, CA","REGULAR","next_f"
"77585506","I love Adobe!","I love Adobe!","Made the leap to Adobe and it was one of the best decisions of my career. Adobe is an innovative company with great leadership. Amazing products. They really care about their employees. Good work life balance. Great compensation. Makes me want to go above and beyond.","Adobe has grown fast and they haven’t really built processes and mindsets that can scale. This is being worked on but a side effect is that there are a lot of inefficient processes that slow things down.","5.0","2023-06-21T09:08:42.753","Current employee - Human Resources Business Partner HRBP","San Jose, CA","REGULAR","next_f"
"77565180","great","great","great place to work would rec","headquarters is in SJ — cold city","5.0","2023-06-20T19:10:07.270","Current employee - Content Strategist","San Francisco, CA","REGULAR","next_f"
"77419966","Very trusting, humane company with highly motivated and talented people.","Very trusting, humane company with highly motivated and talented people.","I’ve worked at adobe for nearly two years. So far I’ve been impressed by the amount of trust you both give and receive at the company. It’s so refreshing after being at other large corporations. In my role, I’m completely surrounded by people who take pride in their work and really set the bar of excellence super high. The team is awesome. The people have great ideas.","Can be hard to be innovative on some of the legacy flagship products.","5.0","2023-06-15T13:16:17.637","Current employee - Senior Design Program Manager","Los Angeles, CA","REGULAR","next_f"
"77389697","Amazing Employer","Amazing Employer","Great values, highly motivated talent, great leadership, fantastic compensation package and benefits.","I don't have any cons to submit.","5.0","2023-06-14T18:29:27.610","Current employee - Principle Product Manager","Lehi, UT","REGULAR","next_f"
"77306835","Solid place to work","Solid place to work","- Great benefits - True work life balance - Continuing to innovate in the market","- Big corporation; things move slow","4.0","2023-06-12T15:52:01.823","Current employee - Sr Product Marketing Manager","San Francisco, CA","REGULAR","next_f"
"77239794","Salary","Salary","Environment, working hours, flexibility, people","Salary, shifts, meetings, vendors, customers","5.0","2023-06-09T18:07:00.377","Former employee - Network Engineer","Athens, GA","REGULAR","next_f"
"77234906","Great Place to Work","Great Place to Work","The Smartest People to Work With","No much clarity in the role/team","4.0","2023-06-09T13:25:49.050","Current employee - Customer Success Manager","New York, NY","REGULAR","next_f"
