"review_id","title","body","pros","cons","rating","date","role","location","employmentStatus","_source"
"96003575","Keep the customer as the focal point","Keep the customer as the focal point","Smart Mgt/People and amazing Sales Engineer Support","Too much Group Think/ Woke ideologies, Expensive &amp; Poor Product Support, Not nimble or customer centric in terms of responsiveness. Many 7-11PM days while others in the 'ecosystem' are yawning and not missing their 'mental health breaks'. Cronyism galore. Product lines are pitted against each other. Comp plans don't remunerate for multi year agreements with massive quotas assigned.","3.0","2025-03-20T08:42:29.043","Current employee - Senior Strategic Account Executive","New England, ND","REGULAR","next_f"
"95916207","Best company","Best company","Love the people - lots of amazing products.","Fast paced, ever changing environment","5.0","2025-03-17T21:12:43.403","Current employee - Account Manager","New York, NY","REGULAR","next_f"
"95881059","Good company","Good company","Decent culture but depends on team","Culture is getting worse and very San Jose centric","4.0","2025-03-16T20:44:17.300","Current employee - Senior Software Engineer","New York, NY","REGULAR","next_f"
"95871678","Software Developer","Software Developer","Good work life balance and coworkers","Sometimes bonus and compensation can be a little harsh","5.0","2025-03-16T10:04:23.103","Current employee - Software Developer 3","Seattle, WA","REGULAR","next_f"
"95857378","Fantastic benefits","Fantastic benefits","Benefits are incredible - unlimited PTO, one week off in July and December, good selection of medical and dental, great parental leave. After 5 years you can take a month long sabbatical.","Duplicative teams across marketing. Company still acts as though it's a small company when it's not. Communication between teams could be improved. Culture is healthy but clique-ish - hard to join unless you know someone.","4.0","2025-03-15T11:06:54.117","Current employee - Marketing Manager","San Francisco, CA","REGULAR","next_f"
"95846067","Good culture but bloated company","Good culture but bloated company","Good wlb People are smart Some strong products in market","Politics Can be slow/ narrow scope Corporate Uses old technologies","3.0","2025-03-14T18:05:48.987","Current employee - Senior Product Marketing Manager","San Francisco, CA","REGULAR","next_f"
"95836965","Good place to work","Good place to work","Good team mates, good wlb, not many layoffs","Stock price is on the down turn, no free food","5.0","2025-03-14T10:39:45.597","Current employee - Research Scientist","San Jose, CA","REGULAR","next_f"
"95833568","Great Company, Great People","Great Company, Great People","Lots of resources and support from management","Can be difficult to progress into other roles","4.0","2025-03-14T08:43:33.740","Current employee - Business Development Representative (BDR)","Austin, TX","REGULAR","next_f"
"95811260","Great place to be","Great place to be","Very smart, kind people in the Lehi office.","It's a big company. Red tape at times.","5.0","2025-03-13T12:56:28.390","Current employee - Software Engineer","Lehi, UT","REGULAR","next_f"
"95786701","good","good","it is a pretty good place","i dont have any negatives","5.0","2025-03-12T20:54:16.267","Former employee - Senior MLE","San Jose, CA","REGULAR","next_f"
"95669392","Love Adobe","Love Adobe","Great culture, great benefits, work life balance","none! Love working at adobe","5.0","2025-03-09T11:49:31.103","Current employee - Renewal Sales Specialist","New York, NY","REGULAR","next_f"
"95659361","Software Architect","Software Architect","Good salary Great customers to work for Smart people Mostly remote ( but for project based travel) Good benefits","Cant get promoted easily. Very limited relationships with colleagues ( everyone is remote in professional services). Can get blindsided easily - this is scary for obvious reasons. No real value for experience/skill - everybody is an architect ( anyone ranging from 8+ to 20+ years)","4.0","2025-03-08T18:06:59.883","Current employee - Software Architect","New York, NY","REGULAR","next_f"
"95614377","Fantastic company, a bit slower than I expected but great","Fantastic company, a bit slower than I expected but great","* Management works hard to be tuned into both product and engineering needs * Excellent institutional knowledge across all the domains they work in. * Smart, passionate colleagues across the board. * Excellent work/life balance. People here work hard but don't over-work, that balance is hit really well culturally.","* Code bases are a bit slow to work in. This is par for the course for big tech, I can't fault Adobe too hard here.","5.0","2025-03-06T18:40:05.433","Current employee - Software Engineer (P40)","San Jose, CA","REGULAR","next_f"
"95606827","Adobe","Adobe","love the people, product and the culture","challenges include the changing environment year to year","4.0","2025-03-06T13:06:43.070","Current employee - Account Executive","New York, NY","REGULAR","next_f"
"95573071","Pretty Good","Pretty Good","Good WLB Interesting product Good teammates","Feels stagnant at times and career growth is slow.","5.0","2025-03-05T14:14:56.183","Current employee - Software Engineer","New York, NY","REGULAR","next_f"
"95570776","NA","NA","Good company level leadership, Good company values. Employee friendly","Lot restructure, Lot of department level leadership changes,","5.0","2025-03-05T12:54:10.263","Current employee - Manager of GTM Strategy and Operations","San Francisco, CA","REGULAR","next_f"
"95561120","Short review","Short review","Work-life balance is the best.","Not much career growth and the RSUs are limited compared to big techs.","4.0","2025-03-05T08:03:51.870","Current employee - Sr. Software Engineer","New York, NY","REGULAR","next_f"
"95557889","Great Place to Work","Great Place to Work","Great benefits. Good atmosphere. Lots of activities. Education reimbursements &amp; improvement reimbursements","It is a huge company that is constantly looking to streamline, so be impactful.","5.0","2025-03-05T06:22:35.270","Current employee - Technical Support Engineer IV","Lehi, UT","REGULAR","next_f"
"95546507","Good life/work balance!","Good life/work balance!","Adobe has a really good life/work balance. Not really forcing you to work really hard, but you have to think","You have to pay for meals. Good salad bar though!","5.0","2025-03-04T20:58:28.873","Current employee - Software Engineer","San Jose, CA","REGULAR","next_f"
"95536650","Overworked","Overworked","Great co-workers Company shut down week of July 4th Company shut down between Christmas and New Years","The many benefits offered by Adobe are to hide a toxic work environment that leads to severe burnout. The reason people tend to stay at this company is not because it's a great place to work, it's because they pay very well, offer ESPP, unlimited PTO (that is hard to use), and decent healthcare. Everyone is overworked, overextended, and exhausted. It's what is expected and not at all recognized or appreciated by leadership. Internal mobility is difficult if you're remote or don't live near certain office locations.","2.0","2025-03-04T13:00:00.020","Former employee - Program Manager","New York, NY","REGULAR","next_f"
"95527369","Fantastic company","Fantastic company","There are significant growth opportunities, both in terms of personal development and career progression. Pay and benefits are both very competitive.","Work-life balance is not as strong as I've seen at other companies. Common for folks to reach over the weekend or expect work outside of regular work hours. Some of this can be addressed with strong boundaries, but the culture definitely supports prioritizing work over home life.","5.0","2025-03-04T07:54:15.453","Current employee - Digital Strategy Consultant","New York, NY","REGULAR","next_f"
"95514415","Great company","Great company","good pay good wlb annual shutdown twice","tech stack outdated management weak","5.0","2025-03-03T21:51:55.457","Current employee - Machine Learning Engineer","San Jose, CA","REGULAR","next_f"
"95507912","Less deadline driven development, please","Less deadline driven development, please","Adobe has a suite of products with great brand recognition. They're fun to work on.","Jumping from project to project where the deadline is set without even having defined what the feature set is going to look like. Cleverly avoids layoffs by having people's position be eliminated where they now have to find their own next spot inside the company.","4.0","2025-03-03T15:57:48.063","Current employee - Engineering Manager","Seattle, WA","REGULAR","next_f"
"95503966","Great Company, But Limited Career Growth","Great Company, But Limited Career Growth","Great company culture, excellent benefits, strong brand reputation, innovative products, and talented colleagues","No clear path to promotion, slow career progression, and limited internal mobility.","4.0","2025-03-03T13:08:24.520","Current employee - Business Development Representative (BDR)","New York, NY","REGULAR","next_f"
"95460898","Good Impact","Good Impact","High visibility projects Nice coworkers Global wellbeing day","Slow process Product innovation is needed","5.0","2025-03-01T13:16:14.687","Current employee - Senior Engineering Manager","San Jose, CA","REGULAR","next_f"
"95412594",".",".","good good good good good","salary was to low compared to others","4.0","2025-02-27T12:07:49.027","Former employee - Sales Representative","Denmark, WI","REGULAR","next_f"
"95358176","Highly Recommend to Kickstart Tech Sales Career","Highly Recommend to Kickstart Tech Sales Career","You get to work with the best digital marketing, digital media, and creative solutions in the tech space. Understand the enterprise sales cycle and are customer facing with some of the biggest companies in the world. They have a great support structure for you to thrive","Hard to make the jump straight to an Account Executive","5.0","2025-02-25T22:58:37.053","Current employee - Business Development Representative (BDR)","San Jose, CA","REGULAR","next_f"
"95335593","Great company","Great company","Pay, benefits, employee perks, solid CEO","Can be difficult navigating internally due to the sheer size of the company.","5.0","2025-02-25T07:58:44.277","Current employee - Customer Success Manager (CSM)","Charlotte, NC","REGULAR","next_f"
"95324248","No clear direction","No clear direction","People are nice and always willing to help","No clear direction from leadership","3.0","2025-02-25T00:36:04.020","Current employee - Designer","Los Angeles, CA","REGULAR","next_f"
"95316783","Great Company","Great Company","Wonderful company to work for","PMs are still in early 2000s mode not in the AI era","5.0","2025-02-24T17:49:32.243","Current employee - Engineer","San Jose, CA","REGULAR","next_f"
"95294981","Not bad place","Not bad place","Was good for hybrid work","Too many “bosses” and not enough room for creative","3.0","2025-02-24T05:44:17.730","Former employee - Marketing Assistant","Pittsburgh, PA","REGULAR","next_f"
"95263808","Fantastic Employer","Fantastic Employer","At Adobe I work with very talented people on fulfilling, interesting projects. The company strives to take good care of their employees and build a better community.","No cons at the moment.","5.0","2025-02-22T14:37:06.913","Current employee - Sr Software Engineer","Lehi, UT","REGULAR","next_f"
"95249725","Amazing place to work with great benefits, pay, culture.","Amazing place to work with great benefits, pay, culture.","Rewarding work High quality tools and training","Becoming less remote work available.","5.0","2025-02-21T18:24:29.423","Current employee - Data Scientist","San Jose, CA","REGULAR","next_f"
"95247777","Awesome company culture","Awesome company culture","Smart people doing cool things","Big companies are complicated and there's a lot to navigate","5.0","2025-02-21T16:01:33.330","Current employee - Senior Counsel","San Francisco, CA","REGULAR","next_f"
"95229515","Cool","Cool","Prob better than some tech companies. Workload really depends on your team.","Lay offs mean more workload","5.0","2025-02-21T03:50:16.960","Current employee - Business Operations Manager","San Francisco, CA","REGULAR","next_f"
"95198090","Great company, better benefits","Great company, better benefits","Incredible benefits if you’re full-time, a lot of resources to do your job, great vibes and amenities, such great people to work with","There was no trust in upper leadership by the time I left in my org due to lack of keeping promises and lack of communication from the top, they don’t truly believe in internal mobility and it’s almost impossible to pivot into new opportunities because of the elitism of the Hiring Managers, a lot of wasted potential in those employees","4.0","2025-02-20T06:17:57.640","Former employee","Lehi, UT","REGULAR","next_f"
"95180436","Good Company and Values","Good Company and Values","Culture, WLB, Tech stack and products","Slow paced work and slow growth","5.0","2025-02-19T16:33:39.673","Current employee - Software Development Engineer (SDE)","Boston, MA","REGULAR","next_f"
"95141080","Good work life balance","Good work life balance","- easy work - good work life balance - good benefits","- low growth - older employees (can be a minus if you are young and ambitious) - stock going down - lots of reorgs","4.0","2025-02-18T15:46:24.383","Former employee - Product Manager","San Jose, CA","REGULAR","next_f"
"95132139","Nice working environment","Nice working environment","Nice campus, good working environment","The project was changed during the internship","3.0","2025-02-18T10:46:37.200","Former employee - Machine Learning Research Intern","San Jose, CA","REGULAR","next_f"
"95122586","solid company to work for","solid company to work for","good people, room for growth, career development","layoffs are brutal - all personal connections don't matter","4.0","2025-02-18T06:02:27.880","Current employee - Marketing Manager","New York, NY","REGULAR","next_f"
"95046247","Company in Decline","Company in Decline","Good work life balance. Generally easy low pressure environment which means you can slack off if you want, but the org suffers from too many low performing teams and individuals who have little consequences.","It's accountants over engineers and technical excellence. The company ceased making great products and solely focuses on acquisitions and building a moat for existing tech. Customers are increasingly unhappy with quality and pricing. Since stock started falling, most efforts have been cost cutting. They cheap out everywhere now, including replacing all HR and payroll with chatbots. Get paid incorrectly? Go to a chatbot or wait over a week for a human response. Payroll issues happen more than should at a multi billion dollar company. Engineering is completely fractured into too many offshore teams that no one is then responsible for things actually working.","1.0","2025-02-14T17:12:30.357","Former employee","San Jose, CA","REGULAR","next_f"
"95035360","It's been good","It's been good","Great People, Great Benefits, Love the office","Sales process isn't figured out. Constantly . Not many opportunities to grow","4.0","2025-02-14T08:00:34.423","Current employee - BDR","Lehi, UT","REGULAR","next_f"
"95034264","Great work-life balance, very political","Great work-life balance, very political","great benefits and work life balance","horrible career mobility and growth. management sucks","4.0","2025-02-14T07:19:47.983","Current employee - Sales","New York, NY","REGULAR","next_f"
"94967817","A great place to work","A great place to work","Creative environment, supportive leaders, collaboration","Decision by committee can slow things down","5.0","2025-02-11T21:17:45.690","Former employee - Human Resources Business Partner HRBP","Lehi, UT","REGULAR","next_f"
"94927995","Limited growth","Limited growth","great wlb, people are very nice","limited growth opportunity, lots of barrier to execute and innovate","3.0","2025-02-10T12:53:52.920","Current employee - Data Scientist","San Francisco, CA","REGULAR","next_f"
"94910340","Adobe","Adobe","good work life balance most of coworkers are nice Seattle office is lovely","compensation not very competitive, company is getting too big","4.0","2025-02-09T22:46:42.013","Current employee - Senior Ssoftware Engineer","Seattle, WA","REGULAR","next_f"
"94909526","Great benefits, competitive pay","Great benefits, competitive pay","Benefits and work-life balance was really good.","Not enough emphasis on education and growing within the company. They have benefits that give you stipend for education materials but I wish it was more of a cultural thing.","5.0","2025-02-09T21:22:27.630","Former employee - Software Engineer","New York, NY","REGULAR","next_f"
"94909157","Bureaucratic but great benefits","Bureaucratic but great benefits","Great benefits and pay is competitive (maybe slightly on the lower side compared to FAANG). Most employees and managers are good, kind people. Culture is very friendly, positive, nice. Very supportive of people with families or anyone needing special accommodations.","Bureaucratic and slow. Depending on what org you are in, can be very political. Can't get things done as quickly as I'd like. Every decision requires layer upon layer of approvals.","4.0","2025-02-09T20:37:10.500","Current employee - Senior Product Manager","San Francisco, CA","REGULAR","next_f"
"94829887","Good People Benefits, Antiquated Internal Tooling","Good People Benefits, Antiquated Internal Tooling","Benefits are amazing Pay is on the mid to high end People are generally easy to work with, fewer @$$#%)^s","Antiquated internal tooling in DME division in High-touch RTM A bit too much, ""That's how we do it"", rather than leaning forward Risks losing install base in the competitive AI-oriented software landscape","4.0","2025-02-05T13:05:54.270","Current employee - Director, GTM Strategy","San Jose, CA","REGULAR","next_f"
"94809538","Best Place to Work!","Best Place to Work!","Great people, work life balance, collaborative","Hard to move up into higher roles","5.0","2025-02-04T19:21:11.977","Current employee - Renewal Sales Specialist","Lehi, UT","REGULAR","next_f"
"94805999","good","good","good wlb and reasonable pay","move too slow and many old people","5.0","2025-02-04T15:24:06.913","Current employee - Research Scientist","San Jose, CA","REGULAR","next_f"
"94801494","Mixed bag","Mixed bag","Benefits are good. Flexible time off is nice.","Disorganized. Questionable priorities and leadership decisions at the organization level.","3.0","2025-02-04T11:51:37.270","Current employee - Technical Account Manager (TAM)","Austin, TX","REGULAR","next_f"
"94797594","Great opportunity","Great opportunity","-lots of benefits -collaborative environement -involvement throughout sales cycle","-constant changes -a lot can be out of your control -upward mobility has slowed","4.0","2025-02-04T08:59:13.653","Current employee - Business Development Representative (BDR)","Lehi, UT","REGULAR","next_f"
"94786809","Overall good","Overall good","Good work life balance, fair compensation, great products, people are superb","Some years it can be challenging to progress with minor politics involved.","5.0","2025-02-03T22:48:38.710","Current employee - Senior Software Engineer","Seattle, WA","REGULAR","next_f"
"94783825","Average","Average","Decent benefits and pay. Nothing revolutionary.","Pros are also cons. Average pay.","5.0","2025-02-03T18:33:04.453","Current employee - Senior Software Engineer","San Jose, CA","REGULAR","next_f"
"94778983","Easy, Unproductive Political Work","Easy, Unproductive Political Work","I don't contribute much, so I can watch a lot of Netflix","I think shareholders are starting to figure this out","2.0","2025-02-03T13:11:52.757","Current employee - Director","San Jose, CA","REGULAR","next_f"
"94750713","Don't join if you respect yourself","Don't join if you respect yourself","You can get branded workwear just like at any fastfood or delivery service.","At first you'll be in awe if you are an intern or never worked at a big company but that fades away quickly. You'll have to spend at least half of your time and resources to advocate for your importance. This is nonsense, but that's how it works at Adobe if you want to make a career, you don't actually need to work, just talk louder and it will be appreciated and rewarded with 7 figures. If you are a talented tech introvert, such people will ride you to the burnout and then replace you with fresh blood. At Adobe we: - ask employees for complete dedication and then throw them away - tell them it was a tough year and pocket their rewards - rig the bought surveys about being #1 place to work - respect slackers that talk a lot and disdain people that actually get the work done So if you are coming for experience you'd better go elsewhere. Adobe is not FAANG and not even close to that. This company has a stigma of tech laggard and it will be really hard to find a good job after it in tech domain.","1.0","2025-02-01T20:37:41.053","Current employee - Solutions Architect","Austin, TX","REGULAR","next_f"
"94720280","best place to work","best place to work","benefits culture people workplace CEO","slow growth in IT/ATS, strategy unclear,","4.0","2025-01-30T23:19:48.467","Current employee - Sr. Director","San Jose, CA","REGULAR","next_f"
"94713573","Helpful and Encouraging","Helpful and Encouraging","Almost everyone I have met at Adobe has been incredibly helpful and supportive. So many fantastic resources for me use and people to connect with.","A lot of inactivity from certain parts of the org and there are some issues that rather than getting resolved get a face lift","4.0","2025-01-30T14:22:32.020","Current employee - Project Manager","San Francisco, CA","REGULAR","next_f"
"94692909","Some good... a lot bad in my group","Some good... a lot bad in my group","Good work/life balance, Pretty good benefits (Medical insurance is just OK), good commissions, Great PTO - they force employees to take time off, Well established tech brand. A lot of good people working there.","- Poor management - sales managers don't support reps, are absent when needed and a lot of cross-brand managers control rep pricing. -Multiple Glassdoor reviews state ""random layoffs occur annually..."" this is true as it happened to me in less than 10 months at Adobe. - Sales is very process heavy and very ""secretarial"" as reps do clerical work (ie processing $50 orders) - Poor onboarding for sales roles and product training -MGT sends mixed messages and changes sales plays weekly -Internal processes and systems within some groups are surprisingly awful for a F500 company. Client Data is different in different systems.","3.0","2025-01-29T19:09:26.117","Former employee - Senior Account Manager","Saint Louis, MO","REGULAR","next_f"
"94684215","Epic","Epic","Good people, great wlb, upward mobility","not too much to say","5.0","2025-01-29T11:10:52.713","Current employee - Technical Account Manager (TAM)","New York, NY","REGULAR","next_f"
"94597517","Great","Great","the corporation cares about people","most managers don't care about their people","5.0","2025-01-25T09:16:58.517","Current employee - Marketing Analyst","New York, NY","REGULAR","next_f"
"94596713","Excellent work environment","Excellent work environment","Many top engineers and computer scientists to learn from. Very employee focused","Can be very demanding of your time","5.0","2025-01-25T08:03:48.817","Former employee - Senior Engineer","San Jose, CA","REGULAR","next_f"
"94558444","Great work life balance","Great work life balance","Great work life balance for someone who wants to be in tech.","Lack of career development within the org","5.0","2025-01-23T11:22:14.723","Current employee - Business Development Representative (BDR)","Dallas, TX","REGULAR","next_f"
"94558151","Growth and recognition","Growth and recognition","Pay, benefits, stock, time off","Can feel very large, not able to travel.","5.0","2025-01-23T11:08:28.603","Current employee - Support Services Manager","Denver, CO","REGULAR","next_f"
"94539668","Too big","Too big","Great worklife balance and great for families","not great to learn and if you are just starting out. Too slow and you will only learn 1 task","4.0","2025-01-22T17:47:18.163","Current employee - Head of Demand Generation","New York, NY","REGULAR","next_f"
"94531810","Great work culture, work life balance and benefits","Great work culture, work life balance and benefits","Great work culture, lot of in office activities to keep teams inspired, and positive, yet competitive culture among teams and in general, Provides flexible work options and overall good work life balance Has good balance of wellness days off, holidays and other benefits","not as fast paced as some other competitors","5.0","2025-01-22T11:12:54.760","Current employee - Senior Technical Product Manager","San Jose, CA","REGULAR","next_f"
"94502944","Great Company To Work For","Great Company To Work For","Great benefits and great opportunities for advancement.","Stock refreshes aren't great unless you're ML/AI","5.0","2025-01-21T11:58:05.930","Current employee - Senior Software Engineer","San Francisco, CA","REGULAR","next_f"
"94499149","Good pay, everything else sucks","Good pay, everything else sucks","benefits, pay and stocks. bonus and unlimited pto. Take all your time","I hated my time there. My manager was horrible and my team lied all the time.","1.0","2025-01-21T09:45:42.187","Current employee - Engagement Manager","Washington, DC","REGULAR","next_f"
"94419542","Software Development Engineer","Software Development Engineer","Good teammates and good benefits","reorganizations happened more in the past year","5.0","2025-01-17T10:33:14.607","Former employee - Software Development Engineer","Seattle, WA","REGULAR","next_f"
