"review_id","title","body","pros","cons","rating","date","role","location","employmentStatus","_source"
"99886585","Challenging Licensing Requirements but decent place to work","Challenging Licensing Requirements but decent place to work","Benefits, Facility (gorgeous and full of accommodations), work from home, training, great supervision (my boss was so professional and supportive, one of the best I have ever had.","The licensing tests to be a trader can be a bit difficult and they do teach you but the Zoom format was tough and the test was difficult even with a lot of other resources like peer tutoring and office hours. I left because I could not pass all the licensing tests. I got all but 1 so they wanted to move me and the other departments were not for me.","4.0","2025-09-09T05:38:33.047","Former employee - Customer Service Representative","Merrimack, NH","REGULAR","next_f"
"99877466","Trainable","Trainable","Super thorough training Supportive manager Supportive Team","Can be overwhelming to juggle multiple task","5.0","2025-09-08T19:39:05.560","Current employee - Client Service Representative","Westlake, TX","REGULAR","next_f"
"99877171","Good stuff","Good stuff","Work life balance is good, you can typically leave work at work","Hybrid schedule is a bit much, there are a lot of redundancies in roles, many cooks in the kitchen","4.0","2025-09-08T19:17:22.610","Current employee - Senior Manager","Boston, MA","REGULAR","next_f"
"99871955","Be warned if you want to grow, this is not the place for you.","Be warned if you want to grow, this is not the place for you.","I made some of my best friends working here.","Management here is a joke. They move bad managers around instead of getting rid of them. Toxic people should be removed from the equation not moved to new opportunities.","1.0","2025-09-08T13:33:16.937","Former employee - Director of Marketing","Boston, MA","REGULAR","next_f"
"99869463","Phenomenal Company","Phenomenal Company","Great work life balance, great benefits, awesome people to work with.","Working remote can limit some opportunities.","5.0","2025-09-08T11:40:04.440","Current employee - Investment Management Consultant II","Houston, TX","REGULAR","next_f"
"99868539","Good place for career","Good place for career","Good place to have a start in finance","There is a lot of clients to deal with","5.0","2025-09-08T11:04:58.380","Current employee - Client Support Specialist II","Fort Lauderdale, FL","REGULAR","next_f"
"99867931","Amazing Place to Work","Amazing Place to Work","Great company culture, they invest in their employees, amazing benefits.","culture varies from branch to branch","5.0","2025-09-08T10:42:18.440","Former employee - Investor Center Intern","San Jose, CA","REGULAR","next_f"
"99867886","Financial Consultant","Financial Consultant","Good benefits and decent pay","Corporate vibes and a lot of turnover","4.0","2025-09-08T10:41:13.183","Former employee - Financial Consultant","Northbrook, IL","REGULAR","next_f"
"99863465","Okay","Okay","Decent pay and room for growth","Very draining taking calls all day","3.0","2025-09-08T07:52:30.217","Current employee - Client Support Specialist","Merrimack, NH","REGULAR","next_f"
"99861339","Great company to work for","Great company to work for","Awesome leadership Company and management encourage feedback and adopt it Great benefits","Base pay could be better","5.0","2025-09-08T06:32:10.103","Current employee - Fraud Customer Response Specialist","Jacksonville, FL","REGULAR","next_f"
"99851280","Planning Consultant","Planning Consultant","Pay and benefits that can be great","Upward mobility and the opportunity for performance","5.0","2025-09-07T18:17:43.237","Current employee - Planning Consultant","Dallas, TX","REGULAR","next_f"
"99850310","Great!!","Great!!","Amazing benefits and development opportunities","No cons of note yet","5.0","2025-09-07T16:28:02.807","Current employee - Rlationship Manager","Johnson City, TN","REGULAR","next_f"
"99849531","Good Money but Boring Work","Good Money but Boring Work","The money is really good if you hustle hard.","The work is not very intellectually stimulating and can get old very quick. It is also sales, so there is a lot of rejection.","4.0","2025-09-07T14:57:58.167","Current employee - Financial Consultant","Los Angeles, CA","REGULAR","next_f"
"99849446","A formerly great company heading in the wrong direction","A formerly great company heading in the wrong direction","28 Days PTO after 5+ years Relatively stable employment, seems lower layoff risk than other companies in the industry Internal mobility is good (except in NC where there is currently a hiring freeze in all but name)","50% RTO, relatively low base pay, nearly impossible to get promoted, benefits being methodically removed (computer reimbursement, fitness reimbursement), flexibility being limited (must attend all 5 days in office, noncompliance may result in reduced bonus eligibility and/or termination). Culture has become much more corporate in recent years. Continuous addition of bureaucratic processes (time tracking and excessive number of governance boards). Tech decisions made with no basis in reality and the expectation of delivering business value while constantly undercutting the developers opinions and changing the fundamental expectations of the job.","2.0","2025-09-07T14:47:57.057","Current employee - Principal Software Engineer","Durham, NC","REGULAR","next_f"
"99849409","It’s a solid iob","It’s a solid iob","Good place to work at","Managers are a bit frazzled","5.0","2025-09-07T14:43:19.190","Current employee - Software Developer","Salt Lake City, UT","REGULAR","next_f"
"99848312","Where Psychological Safety Matters, Until It Doesn’t","Where Psychological Safety Matters, Until It Doesn’t","• Exceptional Learning Environment: Fidelity offers robust training and development opportunities, especially for those early in their careers or transitioning into leadership roles. I gained deep expertise in fund accounting, operational oversight, and inclusive team management. • Hybrid Work Model: The flexibility to work remotely part-time was a major asset, especially during transitional periods. It supported work-life balance and productivity. • Comparable Benefits Package: Health insurance, retirement plans, and tuition reimbursement were competitive and well-managed. Fidelity invests in employee wellness and financial literacy. • Opportunities for Advancement: Internal mobility is encouraged, and I was able to progress from entry-level to management through consistent performance and relationship-building. • Strong Compliance Culture: Fidelity takes regulatory alignment seriously, which creates a structured and risk-aware environment especially valuable in financial services.","• Psychological Safety Varies by Team: While some leaders fostered trust and inclusion, others relied heavily on control and hierarchy. Speaking up wasn’t always safe, especially during organizational shifts. • Limited Autonomy in Leadership Roles: Despite being in management, decision-making was often constrained by top-down directives, which made it difficult to implement innovative or human-centered solutions. • Culture of Overwork in Certain Areas: High expectations and performance pressure sometimes led to burnout, especially when support systems weren’t equitably distributed across teams. • Inconsistent DEI Integration: While Fidelity made strides in diversity and inclusion, the application of these values varied widely across departments. Some initiatives felt performative rather than embedded. • Opaque Communication During Transitions: Major organizational changes such as restructuring or role eliminations were not always communicated transparently, which impacted morale and trust.","3.0","2025-09-07T12:51:23.530","Former employee - Manager","Merrimack, NH","REGULAR","next_f"
"99844523","Great!","Great!","Great work life balance and great place to work! Great benefits as well","None that I can think of","5.0","2025-09-07T07:00:46.510","Current employee - Associate","Boston, MA","REGULAR","next_f"
"99842171","Amazing","Amazing","Learn a lot Network across America Learn how to apply applications","Too much work Wish there more variety","5.0","2025-09-07T02:00:06.503","Current employee - Finance Analyst","Westlake, TX","PART_TIME","next_f"
"99838937","Not a bad gig","Not a bad gig","Plenty of mobility, WPA sets you up great for a branch if that’s where you want to be. Remote FC roles starting to pop up. Smithfield is growing rapidly so there will be leadership options available as well.","Steep learning curve for newcomers. For those without prior experience in 401(k) services or a call center environment, the initial learning curve can be quite challenging, especially when it comes to system navigation and effectively interpreting internal resources. It’s helpful to be aware that once you’re within the Fidelity internal mobility structure, compensation for new roles is generally pre-determined, with limited room for negotiation. Offers are typically fixed, and there’s often a strong pipeline of internal candidates.","5.0","2025-09-06T17:01:07.300","Current employee - Workplace Planning Associate","Smithfield, RI","REGULAR","next_f"
"99838250","10+ years and you'll still be smiling","10+ years and you'll still be smiling","People. Culture. Opportunities. You combined all of that with the benefits... voila.","It can be a bit overwhelming with how large the organizations and recognizing opportunities you'd like to pursue or align with your career goals. But if you network and take ownership- you can.","5.0","2025-09-06T15:21:52.467","Current employee - Customer Service Representative","Greenwood Village, CO","REGULAR","next_f"
"99833174","Secure Company","Secure Company","Work Life balance is great","Paid less than other firms for similar work but that also is the trade off for a better work life balance. 401k Investments options arent great, biased take but I want BTC exposure.","4.0","2025-09-06T06:32:52.860","Current employee - Crypto investigator / Analyst","Westlake, TX","REGULAR","next_f"
"99832983","Don’t believe the hype","Don’t believe the hype","Pay is decent but compared to the market it is below. Work isn’t hard unless they ask you to work overtime.","So many red flags. When it went from one week in office to two weeks a month. Things began to go downhill. Asking reps for more and more overtime without remorse. Once they get what they need out of you it’s a waiting game to see who they like and will brown nose the most to get a role out of entry level. College kids with no experience are more valuable than people with real work experience. Then it’s the people that kiss up to their managers then it’s all about what color you are. Don’t believe me at first class it seems diverse but then you begin to notice it’s either one or the other. Not much room for people of a certain color. It’s either you fit in with their narrative or you will not have opportunities. Younger generation will be promoted and giving more opportunities and bonuses before you will even get an opportunity to think about a new role.","2.0","2025-09-06T06:11:08.783","Former employee - Customer Service Representative (CSR)","Westlake, TX","REGULAR","next_f"
"99824373","Best Job Ever","Best Job Ever","-Fully Remote -Great Benefits -Overtime Encouraged","-lots of training -learning a lot of new things","5.0","2025-09-05T13:45:43.153","Current employee - Financial Customer Associate","Omaha, NE","REGULAR","next_f"
"99806757","Comp","Comp","Learn many things are open","Political across the board for everything","3.0","2025-09-04T20:07:50.017","Current employee - EVP","Boston, MA","REGULAR","next_f"
"99796705","Great experience and professional development","Great experience and professional development","fast paced. always learning something new. great work culture","i feel there is always a shift in management so things do change quickly so you need to adapt fast","4.0","2025-09-04T10:22:46.797","Former employee - Regional Support Technician","Smithfield, RI","REGULAR","next_f"
"99794192","Worth the drive?","Worth the drive?","The benefits are wonderful and reasonable in price.","They are NOT very flexible with work from home even if you live over 50 miles away. If you are NOT willing to drive to Westlake Tx do not accept the position.","3.0","2025-09-04T08:42:44.900","Former employee - Analyst","Westlake, TX","REGULAR","next_f"
"99780022","Too many in middle management","Too many in middle management","Recession proof and very friendly","Too much politics ans less deserving people in leadership.","3.0","2025-09-03T19:03:35.993","Current employee - Sr. Software Engineer","Research Triangle Park, NC","REGULAR","next_f"
"99771455","soul sucking","soul sucking","good benefits, cool managers and coworkers for the most part","it is a grind. It is repetitive. Base salary is trash.","3.0","2025-09-03T11:29:57.730","Current employee - Workplace Planning Consultant I","Denver, CO","REGULAR","next_f"
"99764851","Implementation Project Manager","Implementation Project Manager","Flexibility Culture Management Training Learning opportunity","High Volume Work/life balance In role mobility","5.0","2025-09-03T07:18:36.313","Current employee - Project Manager/Implementation Consultant","Covington, KY","REGULAR","next_f"
"99762540","CRA salary","CRA salary","Hybrid, in depth training, average pay","Nonstop phone calls and long hours","3.0","2025-09-03T05:47:17.947","Former employee - Client Relationship Advocate","Merrimack, NH","REGULAR","next_f"
"99749510","Great starter","Great starter","Culture, pay, experience, licensing, management","No real cons, great place out of college","5.0","2025-09-02T14:58:38.950","Current employee - Team Leader","Salt Lake City, UT","REGULAR","next_f"
"99748370","Okay","Okay","Coworkers being in the same boat as you","Pay is below market level and is hard to be sustainable","3.0","2025-09-02T13:56:44.527","Former employee - Associate","Durham, NC","REGULAR","next_f"
"99747905","Great start in Financial Services","Great start in Financial Services","- Great Training - Career Growth - Hybrid work","- Feel like a number sometimes","4.0","2025-09-02T13:34:52.063","Former employee - Customer Relationship Advocate","Denver, CO","REGULAR","next_f"
"99743951","Roll of the dice","Roll of the dice","Decent pay, licensing is great, campus is nice, hybrid work is nice","Revolving door of managers and interim managers. Literally a coin flip if you get a decent one, and if you do, they’ll just get moved elsewhere in a couple of months","3.0","2025-09-02T10:43:11.317","Former employee - Stock Plan Associate","Merrimack, NH","REGULAR","next_f"
"99740407","Solid job, decent role","Solid job, decent role","Big company with great benefits and a vast network to tap into","Role isn't the most challenging one in your 20s","4.0","2025-09-02T08:24:01.493","Former employee - Shareholder Analyst","Boston, MA","REGULAR","next_f"
"99735533","Current employee","Current employee","Good Work life balance. Easy lead pool","Not compensated like other advisory firms","4.0","2025-09-02T04:56:44.420","Current employee - Financial Consultant","Chicago, IL","REGULAR","next_f"
"99721993","Big Corporation with Sweatshop vibes","Big Corporation with Sweatshop vibes","- Paid for the licenses Series 7 and 63 - Friendly and accepting environment and Management is doing a good job at keeping it that way - You have access to the whole company directory up to Abby herself. What it means is that you can easily network and the company encourages it. - With enough effort and a little bit of luck you can hop your way up the ladder. A lot of vertical and lateral mobility.","$7a","3.0","2025-09-01T12:08:55.297","Former employee - Trading Specialist","Jacksonville, FL","REGULAR","next_f"
"99709278","All depends on your manager","All depends on your manager","-They pay for training and certification. The training department was incredible.","They sell you on a job that you aren't going to do. They pretend they're about customer service, but it is just a call center with certifications. Some managers were incredible, some are horrible. There diversity programs, but your manager won't let you off the phones to actually attend them, even if you ask in advance. Any kind of movement is subject to one person's opinion, even if you get your former managers to stand up for you.","3.0","2025-08-31T23:40:41.463","Former employee - Financial Advisor","Covington, KY","REGULAR","next_f"
"99707210","Positive besides WFH policy","Positive besides WFH policy","- Good stock bonuses - Excellent end of year bonus percentages","- Restrictive WFH policy - HR determines pay ranges and promotions, not direct peers or manager","4.0","2025-08-31T19:33:10.130","Current employee - Cloud Engineer","Durham, NC","REGULAR","next_f"
"99703353","Good","Good","Great company with great work environment","Nothing to say because everything is good","5.0","2025-08-31T11:25:07.263","Current employee - Senior DevOps Engineer","Westlake, TX","REGULAR","next_f"
"99675051","Coast","Coast","Low stress, stable, hybrid working model","Not very busy, slow, typical issues for a very large company","3.0","2025-08-29T07:35:55.880","Current employee - VP, Engineering","Boston, MA","REGULAR","next_f"
"99663093","Great Company","Great Company","-WLB -Profit Share -Friendly Coworkers","-Hard to grow -RTO -","5.0","2025-08-28T17:00:09.287","Current employee - Cloud Engineer","Durham, NC","REGULAR","next_f"
"99641058","Visa farm","Visa farm","Unlimited funding from a hedge fund","Hope you speak Hindi bro","1.0","2025-08-27T20:41:14.010","Former employee - Software Engineer","Raleigh, NC","REGULAR","next_f"
"99627180","Good benefits and bonus","Good benefits and bonus","Yearly bonus 401k match and profit sharing Hybrid work schedule","Some management isn’t always there for you","4.0","2025-08-27T08:13:27.250","Current employee - Talent Acquisition Partner","Westlake, TX","REGULAR","next_f"
"99625543","Great Place to Work","Great Place to Work","- Flexibility - Internal Opportunity for growth -Retirement Match + Profit Sharing","Would like to have office space more consistently","5.0","2025-08-27T07:10:16.357","Current employee - Financial Consultant","Oak Brook, IL","REGULAR","next_f"
"99625225","A lot of politics","A lot of politics","Very smart people, want to try new things, very fast paced","A lot of politics, doing the right thing is not always true","3.0","2025-08-27T06:58:57.723","Former employee - Vice President","Boston, MA","REGULAR","next_f"
"99611669","New Grad Comp","New Grad Comp","Work life balance is good","Pay is not as competitive","4.0","2025-08-26T15:31:53.187","Current employee - Associate Software Engineer","Durham, NC","REGULAR","next_f"
"99585834","great","great","wlb , ctc for long term","slow growth in the begining","4.0","2025-08-25T16:01:05.457","Current employee - Senior Quant Developer","Jersey City, NJ","REGULAR","next_f"
"99578375","Good for getting Licensed","Good for getting Licensed","Day 1 benefits PTO program Paid study time","Phone based, call center role","4.0","2025-08-25T09:57:23.203","Current employee - Client Relations Associate","Jacksonville, FL","REGULAR","next_f"
"99575284","Good pay","Good pay","Pay is good. Had great managers and manager interactions. Lots of support and some pretty great coworkers","It is a phones based job. And I am eagerly awaiting more non phones positions to be available to the Omaha location","5.0","2025-08-25T07:42:42.523","Current employee - HSA Representative","Omaha, NE","REGULAR","next_f"
"99564343","Good job","Good job","Good benefits, great locations. Fantastic managers","Base pay could be higher","5.0","2025-08-24T18:32:15.037","Current employee - Customer Service Representative","Westlake, TX","REGULAR","next_f"
"99564291","Great place to work for someone not desiring a robust career","Great place to work for someone not desiring a robust career","Great benefits and strong culture","Limited industry resources. Sales role but not sales…?","4.0","2025-08-24T18:26:15.167","Former employee - Investment Solutions Representative","Westlake, TX","REGULAR","next_f"
"99562897","Review","Review","If you work hard it’s very rewarding and pays well.","It is the perfect entry into wealth management","5.0","2025-08-24T15:53:36.993","Current employee - Workplace Planning Consultant","Raleigh, NC","REGULAR","next_f"
"99561367","Good Company","Good Company","Good first step into Financial Services Positive work environment Holidays off","Call center 50% in office Sparce opportunities to get out of a phone role","5.0","2025-08-24T13:01:52.090","Current employee - High Net Worth Associate","Westlake, TX","REGULAR","next_f"
"99553598","Toxic work culture","Toxic work culture","Many good people work there","My manager lied in my performance reviews and HR acknowledged that he was lying, but said that Fidelity's official policy is that factually inaccurate statements in performance reviews are not considered a problem. HR also said that if my coworkers were spreading false allegations about me, that was a legitimate performance problem that my manager should report about me and that they were not willing to do anything about the defamation. All of this violates their written policies on professional ethics, but they have a disclaimer on the policy that basically says it doesn't actually mean anything.","1.0","2025-08-23T19:52:58.440","Former employee - Quantitative Analyst","Boston, MA","REGULAR","next_f"
"99552333","Great company","Great company","Very supportive and caring managers. Good pay for what’s asked of you. Lots of mobility and positive culture.","Lots of hoops to jump through to move around within the company. Very competitive.","5.0","2025-08-23T16:13:26.953","Current employee - Workplace Planning Consultant III","Dallas, TX","REGULAR","next_f"
"99550283","One of the best financial compies","One of the best financial compies","-Great benefits -Great Pay &amp; Incentives -Great Training","Hybrid Schedule Commute A lot of changes to management","4.0","2025-08-23T11:25:09.007","Current employee - Customer Relationship Advocate","Merrimack, NH","REGULAR","next_f"
"99547815","Extremely busy for not great pay but could be worse","Extremely busy for not great pay but could be worse","You get to work from home half the time and there is a generous 7% 401k match","Extremely busy even during when they said it would be the slow season so we could allegedly focus on development. Mediocre pay. They need to hire more people or pay more so more people want to do it. Some of the software barely works and is like from the 90s but hardly anything ever improves because the management is so disconnected from the front line and has never taken a phone call recently themselves.","3.0","2025-08-23T07:25:47.527","Current employee - Stock Plan Associate","Covington, KY","REGULAR","next_f"
"99541899","Great","Great","Community and supportive team leaders","Requires lots of studying off the clock to obtain licenses","5.0","2025-08-22T18:57:41.480","Current employee - Customer Relationship Advocate","Smithfield, RI","REGULAR","next_f"
"99539631","Great work life balance","Great work life balance","Great work-life balance. This can be team dependent, but it is very rare to be pulled into work during off-hours or on the weekend. People are generally friendly, and are understanding of the need to prioritize family life over work when necessary.","The pay could be better, especially compared to what other software engineers are making at other companies. The Westlake office is very full during connect weeks, and flex seating makes it hard to find a desk after 9:30AM.","4.0","2025-08-22T15:05:33.890","Current employee - Software Engineer","Westlake, TX","REGULAR","next_f"
"99523247","Experience step","Experience step","They do a really good job hiring some of the best people.","The managers are too nice and doesn’t have direct communication","3.0","2025-08-21T22:54:50.220","Former employee - Financial Customer Associate","Covington, KY","REGULAR","next_f"
"99494585","Great first finance role","Great first finance role","Prepares you well, lots of potential, great time off policy","Slow career progression, lots of competition for promotion, hiring/promotion freezes.","5.0","2025-08-20T18:46:37.517","Current employee - High Net Worth Service Associate","Denver, CO","REGULAR","next_f"
"99492747","RBS","RBS","Great environment and career opportunities","High call volume. 30-40 calls per day","5.0","2025-08-20T16:35:54.180","Former employee - Retirement Brokerage Services Representative","Merrimack, NH","REGULAR","next_f"
"99492523","Great Place for long Career","Great Place for long Career","Fantastic benefits with good profit sharing, bonuses, health care and opportunities for advancement.","They began having all employees come to the office every other week regardless of whether you have direct teammates in your office or your role.","5.0","2025-08-20T16:18:13.310","Current employee - Manager Business Analysis","Durham, NC","REGULAR","next_f"
"99491636","Solid Company","Solid Company","Good Culture, very helpful management and nice 401k match","Tough to move vertically because it is competitive","4.0","2025-08-20T15:23:50.460","Current employee - Work Place Planning Consultant I","Cleveland, OH","REGULAR","next_f"
"99489257","Great for building a Finance Career","Great for building a Finance Career","Gets you a great start into financial services and provides ample licensing time","Growth can be a bit slow if you are looking outside of a call center type work","4.0","2025-08-20T13:20:37.747","Current employee - Customer Relationship Advocate","Westlake, TX","REGULAR","next_f"
