"review_id","title","body","pros","cons","rating","date","role","location","employmentStatus","_source"
"101605246","Great Company","Great Company","A great company to work for.","If you are able to land a company like this, stay there.","4.0","2025-12-02T12:06:28.360","Former employee - Financial Analyst","Durham, NC","REGULAR","next_f"
"101602820","Good company to work for but could benefit from higher pay","Good company to work for but could benefit from higher pay","Great people, lots of opportunities for growth, excellent benefits","Low base pay compared to other companies in the area","4.0","2025-12-02T10:08:15.147","Current employee - Senior Business Analyst","Boston, MA","REGULAR","next_f"
"101586607","Great company!","Great company!","Excellent benefits, yearly bonus, profit sharing. Hybrid work week.Have been there for more than 20 years and have never regretted it","None that I can think of","5.0","2025-12-01T16:50:11.517","Current employee - Software Engineer","Smithfield, RI","REGULAR","next_f"
"101582549","great company","great company","benefits, career mobility, can build a career here","salaries can be on the low end,","4.0","2025-12-01T12:26:45.300","Former employee - Director","Boston, MA","REGULAR","next_f"
"101581059","Great Company to work","Great Company to work","Great environment for early careers.","Growth can take a while.","5.0","2025-12-01T11:09:57.900","Current employee - Cloud Engineer","Durham, NC","REGULAR","next_f"
"101579604","Amazing","Amazing","Strong culture and mission. Amazing benefits and work life balance. Leadership who listens and is aligned with your success","Slow advancement at times, not the best gym benefits","5.0","2025-12-01T09:59:29.167","Current employee - Investment Consultant","New York, NY","REGULAR","next_f"
"101567463","Great place for a career","Great place for a career","Great leadership, compensation, and clear upward mobility","Moving goalposts as the company alters the role to best serve their clients.","5.0","2025-11-30T19:52:27.253","Current employee - Financial Consultant","Charlotte, NC","REGULAR","next_f"
"101564695","Great company","Great company","-Benefits -Environment -Culture -Training -Managers","None. This is a great company to work for.","5.0","2025-11-30T13:46:05.287","Current employee - Financial Representative","Little Rock, AR","REGULAR","next_f"
"101558866","Great place to work","Great place to work","Benefits are amazing, work is fulfilling, company culture is excellent.","None I can think of.","5.0","2025-11-30T00:06:53.937","Current employee - Director","Boston, MA","REGULAR","next_f"
"101556693","Excellent Place to Work","Excellent Place to Work","- Flexible on the clock schedule - Great managers - Very understanding and generally laid back company culture","- Stats can be a bit unforgiving as calls can vary greatly depending on the call - Staff are a bit reserved, which can come off a bit cold at times.","5.0","2025-11-29T16:23:50.500","Current employee - Client Relationship Advocate","Smithfield, RI","REGULAR","next_f"
"101549256","Good job","Good job","Great culture, a lot of resources, great support, and time for self development","Pay is decent could be better","5.0","2025-11-28T21:11:44.983","Current employee - Customer Relationship Advocate","Jacksonville, FL","REGULAR","next_f"
"101548898","Love it here","Love it here","Great benefits. Nice people to work with.","Can’t think of anything honestly","5.0","2025-11-28T19:57:34.253","Current employee - HR Associate","Westlake, TX","REGULAR","next_f"
"101523065","Fidelity","Fidelity","Great Company, great benefits and flexible work life balance","Not the highest paying in the field, they rely a lot on benefits rather than base+bonus comp.","5.0","2025-11-27T03:51:35.153","Current employee - Senior Manager","Boston, MA","REGULAR","next_f"
"101503324","Great role, ok pay","Great role, ok pay","Empowers you to make decisions and help clients in the way you see would be most efficient. Great team and supportive culture. Great pipeline for career growth as there is WMS 1,2,and3. Great work life balance, they don’t want you working late.","We use like 10 different platforms a day to do 1 job. It gets a lot sometimes, but they are always working to make technology advancement. Biggest con is the pay. It’s livable but not great. 63,500 base with target bonus is 18,500. You can not afford to live alone in New England on this salary.","4.0","2025-11-26T04:08:59.133","Current employee - Wealth Management Service Specialist I","Smithfield, RI","REGULAR","next_f"
"101452322","Great Lifer Company","Great Lifer Company","Amazing Leadership, Supportive Work Culture, Job Mobility, Remote, Time for Development and Great Benefits","Heavy Reliance on Call Metrics and Unruly Clients","5.0","2025-11-23T20:04:44.093","Former employee - CSS1 (Remote)","Newark, NJ","REGULAR","next_f"
"101449912","FSR","FSR","Good company culture. Good work life balance","Long process to get licensed","5.0","2025-11-23T15:18:29.153","Current employee - Financial Services Representative","New York, NY","REGULAR","next_f"
"101440563","Great","Great","Career development Culture Inclusion benefits","nothing to really say here.","5.0","2025-11-22T17:42:22.023","Current employee - CRA I","Denver, CO","REGULAR","next_f"
"101435227","Great Company","Great Company","Both vertical and horizontal movement within the company, with an emphasis on employee growth, great work-life balance, and solid WFH policy.","Pay is slightly below the industry average","5.0","2025-11-22T08:20:06.927","Current employee - Senior Accountant","Boston, MA","REGULAR","next_f"
"101430671","Good Company","Good Company","PTO is great paternity is even better. Pay is good and I do like the culture.","It’s easy to complain about the mental workload but compared to the other jobs I think it’s very good","5.0","2025-11-21T21:35:43.850","Current employee - Workplace Planning Consultant II","Salt Lake City, UT","REGULAR","next_f"
"101429581","Good place to work but low pay","Good place to work but low pay","Good place to work, chill,","Lots of yellow tape, low pay","4.0","2025-11-21T19:04:19.167","Current employee - Associate","Smithfield, RI","REGULAR","next_f"
"101423397","working for fidelity","working for fidelity","great people-learned a lot-very supportive management","very busy-glued to your desk at times","5.0","2025-11-21T10:16:07.620","Current employee - HSA Specialist","Albuquerque, NM","REGULAR","next_f"
"101412198","N/a","N/a","excellent working environment, good company culture","nothing to share, good overall","5.0","2025-11-20T21:55:31.670","Current employee - Data Scientist","Boston, MA","REGULAR","next_f"
"101411287","Great company","Great company","Benefits are great, lots of career mobility, good culture","Pay is low for entry level starting out","5.0","2025-11-20T20:34:48.747","Current employee - Customer Relationship Advocate","Covington, KY","REGULAR","next_f"
"101410835","Overall compensation","Overall compensation","Benefits, profit sharing, 401k match, PTO","In office requirement, bureaucracy, minimal raises internally","4.0","2025-11-20T19:56:17.277","Current employee - Communications Consultant","Westlake, TX","REGULAR","next_f"
"101409181","Stay away from OSG Client Services","Stay away from OSG Client Services","Company Benefits Hybrid work Nice building Diverse","Corporate politics Lack of growth Glorified call center","2.0","2025-11-20T17:42:09.987","Former employee - Customer Service Representative","Smithfield, RI","REGULAR","next_f"
"101375914","Great place","Great place","Good people, great working environment","Nothing I can really think of","5.0","2025-11-19T08:53:35.827","Current employee - Customer Relationship Advocate","Westlake, TX","REGULAR","next_f"
"101373408","Good benefits","Good benefits","Company has lower starting salaries but make up for it in benefits","Lower pay compared to other competitors","4.0","2025-11-19T07:11:03.567","Current employee - CRA I","Merrimack, NH","REGULAR","next_f"
"101370669","Great place to work","Great place to work","Offer support and plethora of career opportunities","Mobility in branch dependant on location","5.0","2025-11-19T05:09:17.897","Current employee - Financial Services Representative","Chicago, IL","REGULAR","next_f"
"101360593","Fidelity Wealth Management Internship","Fidelity Wealth Management Internship","Amazing people, process, and learning experience","A little outside of the Boston Area","5.0","2025-11-18T17:18:04.113","Former employee - Summer Intern","Boston, MA","PART_TIME","next_f"
"101337617","Decent pay","Decent pay","Money, benefits, cafeteria, coffee shop, atmosphere, team work","management, supervisors, favortism and metrics","3.0","2025-11-17T17:22:39.020","Former employee - Customer Service Representative","Merrimack, NH","REGULAR","next_f"
"101336340","Management is a mess, but the work isn’t hard","Management is a mess, but the work isn’t hard","Flexibility, good pay, good coworkers.","Management is a mess, the performance metrics are achievable but you have to really work hard for it","3.0","2025-11-17T15:47:31.417","Former employee - Central Relationship Manager","Salt Lake City, UT","REGULAR","next_f"
"101331352","Na","Na","Good place. Great people to work with.","Unless you work in 401k or personal investments. They really don’t care about you","4.0","2025-11-17T11:17:54.490","Current employee - Quality Control Analyst","Dallas, TX","REGULAR","next_f"
"101312616","Good company","Good company","Easy company to move up in","Lower pay than other comparable jobs","5.0","2025-11-16T14:23:53.853","Former employee - Financial Representative","Pasadena, CA","REGULAR","next_f"
"101311800","Good place to start","Good place to start","nice benefits package, understanding management","low pay and crowded workspace","3.0","2025-11-16T13:02:00.430","Current employee - Operations Specialist","Sanger, TX","REGULAR","next_f"
"101311679","Review","Review","Good Benefits package overall; Hybrid working model","Job is always in jeopardy with frequent layoffs","3.0","2025-11-16T12:50:53.213","Former employee - Senior Project Manager","Smithfield, RI","REGULAR","next_f"
"101308801","Good but not the best","Good but not the best","Always has opportunity to learn","Payout is Lower than competitors","4.0","2025-11-16T08:09:35.777","Current employee - Stock Plan Services","Utahna","REGULAR","next_f"
"101308639","Phone center job. Sucks the soul.","Phone center job. Sucks the soul.","Health benefits. That's about it.","Low paying job for the amount of work that you'll do. All they care about is metrics. Adds pressure to the employee. They also observe you every moment you make by video and the time you take breaks. Annoying.","2.0","2025-11-16T07:51:38.107","Current employee - Financial Customer Associate","Westlake, TX","REGULAR","next_f"
"101305129","Good","Good","Good Employer with good resources","Nothing wrong, cheap managers do lots of politics","3.0","2025-11-15T23:55:13.270","Former employee - Principal Software Engineer","Boston, MA","REGULAR","next_f"
"101293279","Politics can get in the way of making progress","Politics can get in the way of making progress","Strong company with diverse set of businesses","Very hesitant to make change / experiment even when opportunities are fairly clear","4.0","2025-11-14T20:21:18.743","Current employee - Vice President, Finance","Boston, MA","REGULAR","next_f"
"101290207","CRA review","CRA review","Great entry level job in finance","Not applicable, an all around great experience.","5.0","2025-11-14T14:41:12.230","Current employee - CRA I","Merrimack, NH","REGULAR","next_f"
"101285541","Good place to work","Good place to work","nice smart people and i wake up excited to go to work. i think my projects are good and stimulating","i think its hard to grow in fidelity and find upward mobility. also very siloed","5.0","2025-11-14T09:57:11.473","Current employee - Strategy and Business Operations","Boston, MA","REGULAR","next_f"
"101284282","Great work Culture","Great work Culture","Good base pay. Young and hip co-workers. Clear management.","Corporate ideology, hard to be an individual","5.0","2025-11-14T08:50:08.403","Former employee - Financial Service Representative","Sacramento, CA","REGULAR","next_f"
"101271567","Great place to work","Great place to work","The culture on all three teams I’ve been on have been good","None really. It’s still corporate America","4.0","2025-11-13T18:23:18.567","Current employee - Investment Solutions Representative II","Jacksonville, FL","REGULAR","next_f"
"101271005","Great schedule flexibility","Great schedule flexibility","Culture is great. Leadership is incredible.","Clients can feel like small fish in a large pond.","5.0","2025-11-13T17:40:25.767","Current employee - Managing Director","Westlake, TX","REGULAR","next_f"
"101263489","Great Culture","Great Culture","Everyone seems super helpful and very willing to help you succeed","Repetitive call center environment for the first couple of years","5.0","2025-11-13T10:38:44.743","Current employee - Client Service Specialist","Tampa, FL","REGULAR","next_f"
"101247246","Great Company to work for!","Great Company to work for!","- Great benefits, specifically 401k matching - Stock Options - Highly competative salary - Positive team work environment - Lots of upward mobility","- IC role is production based so can be stressful at times","5.0","2025-11-12T19:22:44.600","Current employee - Investment Consultant","Colorado Springs, CO","REGULAR","next_f"
"101234665","Good company but call center role","Good company but call center role","No finance experience necessary Paid training and licensing Solid company with great benefits","Call center role. Performance metrics are unforgiving and can be very hard to meet","4.0","2025-11-12T08:34:01.907","Former employee - Customer Relationship Advocate","Merrimack, NH","REGULAR","next_f"
"101232733","Its a good place to work.","Its a good place to work.","They offer good perks and 401k benefits.","It gets bureaucratic but you can move around within the company without much friction.","5.0","2025-11-12T07:19:29.207","Current employee - Senior UI Engineer","Westlake, TX","REGULAR","next_f"
"101231348","N/A","N/A","Very good work life balance","Not flexible on remote work since covid hit, was a lot more flexible before then","3.0","2025-11-12T06:29:34.297","Former employee - Senior Software Engineer","Tristates, NY","REGULAR","next_f"
"101214030","Solid position","Solid position","WFH every other week which is nice","Lots of calls to take every day","3.0","2025-11-11T12:04:31.227","Current employee - Financial Customer Associate","Westlake, TX","REGULAR","next_f"
"101205612","Good first job","Good first job","Learn a lot, nice people","Pay is not the best","4.0","2025-11-11T06:27:38.373","Current employee - Customer Relationship Advocate","Smithfield, RI","REGULAR","next_f"
"101191191","Discouraging owners and toxic work environment","Discouraging owners and toxic work environment","None that I can think of unfortunately. My team was strong but held back by archaic business practices.","$7f","1.0","2025-11-10T13:47:14.997","Former employee - Finance Analyst","Tampa, FL","REGULAR","next_f"
"101171901","Excellent","Excellent","Biweekly in-person office Best company culture","Nothing to say about cons","5.0","2025-11-09T18:18:16.260","Current employee - Senior Full Stack Engineer","Durham, NC","REGULAR","next_f"
"101170083","Great Company","Great Company","Great Environment with supportive management","Burn out quickly in busy season","5.0","2025-11-09T14:41:37.300","Current employee - Workplace Planning Consultant","Smithfield, RI","REGULAR","next_f"
"101159330","WPC1","WPC1","Learn a lot about 401ks","Monotony and repetitive. Large corporate feel.","4.0","2025-11-08T14:52:10.017","Current employee - Workplace Planning Consultant I","Boston, MA","REGULAR","next_f"
"101158581","A Fine Company","A Fine Company","Great work life balance, good oppritunity to learn new skills","Severe lack of culture, all systems are outdated, pay is not competitive, and career development is mostly based on time rather than performance","3.0","2025-11-08T13:14:22.643","Current employee - Full Stack Software Engineer","Durham, NC","REGULAR","next_f"
"101151238","Great benefits, Get stuck","Great benefits, Get stuck","Benefits, offices are fantastic besides parking, lots of PTO","Easy to get stuck on a bad team, or bad manager","4.0","2025-11-07T22:18:23.623","Current employee - Full Stack Software Engineer","Durham, NC","REGULAR","next_f"
"101143787","Retirement Specialist","Retirement Specialist","Lots of resources so you can give any customer the support they need.","Lots of special situations that can require further research and support.","5.0","2025-11-07T11:09:41.757","Former employee - Retirement Specialist","Salt Lake City, UT","REGULAR","next_f"
"101141553","Good benefits","Good benefits","Great benefits, especially 401k match, profit sharing","50% work in office and they're pretty strict about it","4.0","2025-11-07T09:21:08.687","Current employee - Director, Leadership Development","Smithfield, RI","REGULAR","next_f"
"101120805","Fidelity","Fidelity","Good place to begin your career","Not a very inviting staff of people","5.0","2025-11-06T10:37:10.670","Former employee - Finance Analyst","Boston, MA","REGULAR","next_f"
"101120577","Hierarchical","Hierarchical","Great coaching, realistic sales expectations, fair pay, great technology","High volume, slower growth, unrealistic timelines","3.0","2025-11-06T10:26:50.253","Former employee - Financial Representative","Towson, MD","REGULAR","next_f"
"101119819","Cultish, Unaware, &amp; Over-Eager","Cultish, Unaware, &amp; Over-Eager","Many opportunities, offices are nice","Upper management is not aware of what's happening at the ground level. They put all the work on certain people while others slack off or bring about way too much unneccessary ""work"". There are a lot of side projects that will be asked (read: demanded in a cheerful tone) of employees which require a huge time commitments and can be very stressful. The on-camera appearances are so unnecessary and were not a part of my work contract, yet expected often. Also, I've never had a harder time finding work after leaving this place, and I've heard from many others that this could be due to its pyramid-scheme-like structure. Once I worked there, it became an identity that was difficult to trade for anything else.","1.0","2025-11-06T09:54:02.910","Current employee - Digital Editor","Boston, MA","REGULAR","next_f"
"101111223","Don't believe the Hype","Don't believe the Hype","Working at the branch is easier than the regional center. Pay is undermarket but is always paid on time - no Xmas bonus however.","Branch life is extremely stressful. Fidelity certainly has goals and will squeeze you as much as they can - my manager barely appreciated my efforts but always shared that there's one thing I can improve.","1.0","2025-11-06T03:08:31.297","Current employee - Relationship Manager","Winston-Salem, NC","REGULAR","next_f"
"101105475","Great culture","Great culture","Great for licensing and career entry","High stress work environment and lower pay in return for high expectations from management","3.0","2025-11-05T19:44:19.607","Current employee - WPC","Denver, CO","REGULAR","next_f"
"101091372","Great","Great","Everyone is super supportive and want you to succeed and get the job","No one tells you how accurate you have to be on your background check.","5.0","2025-11-05T07:13:33.737","Current employee - Customer Service Representative","Salt Lake City, UT","REGULAR","next_f"
"101079811","not bad this is just my pov","not bad this is just my pov","good environment, professional staff, fair benefits","you need to experience to find out","5.0","2025-11-04T18:18:57.063","Former employee - Officer","New York, NY","","next_f"
"101074107","Competitive Salary","Competitive Salary","Competitive salary for this market and inline with salary of the region.","I have nothing negative to say around salary. The company offers salaries that align for this job in the market.","5.0","2025-11-04T12:24:18.387","Former employee - Business Analyst","Cranston, RI","REGULAR","next_f"
"101069908","Great Place","Great Place","Everyone is amazing, nice, and helpful. A great learning environment, and WLB is very good.","Sometimes thinks move a bit too slow, and working with old technologies.","5.0","2025-11-04T09:21:20.833","Former employee - Internship","Westlake, TX","REGULAR","next_f"
"101055472","Differs wildly from team, manager, and business unit","Differs wildly from team, manager, and business unit","- any personality can succeed- just need to find the right manager - LEAP program encourages excellence &amp; curiosity - stable","- 90% idiots: people who refuse to read documentation, take responsibility, contribute ideas (these people exist at every level) - some of the worst code i have ever seen - some really bad managers (focused on appearances rather than deliverables, not able to work with other leadership etc) - 1 of every 2 weeks must be in office - largely hire white &amp; Indian men despite so much talk about diversity... - other than diversity, there are many other forms of hypocrisy- one of our core values is ""being data driven"" but the RTO approach was not data driven at all (and failed to account for office capacity which was a very basic number that they should have known) - compensation is famously low compared to other places","1.0","2025-11-03T18:55:19.657","Current employee - Senior Software Engineer","Durham, NC","REGULAR","next_f"
"101049456","CRA","CRA","Time off, overall easy job","Dealing with customers who don’t know information","5.0","2025-11-03T12:28:15.220","Current employee - Customer Relationship Advocate","Westlake, TX","REGULAR","next_f"
"101034452","Decent company terrible department","Decent company terrible department","Paid break for 45 minutes. Licensing for early careers.","Gaslighting clients to buy a managed solution rather than giving advice. Constantly understaffed with nonstop queue. Constantly changing KPIs. Gradually adding responsibilities with no pay increase. Promotability is mostly playing favorites.","2.0","2025-11-02T23:36:21.680","Former employee - Investment Solutions Representative","Greenwood Village, Arapahoe, CO","REGULAR","next_f"
"101030961","Fidelity Salary","Fidelity Salary","Amazing Company, Amazing Culture, Amazing Teammates, Health Focussed","Not many cons I can think of.","5.0","2025-11-02T17:20:08.977","Current employee - Associate Full Stack Developer","Dallas, TX","REGULAR","next_f"
"101030204","Work life balance","Work life balance","Good Benefits , Average team culture, 401k Match","RTO Policies, micro management, Team culture","4.0","2025-11-02T15:46:04.047","Current employee - Senior Software Engineer","Durham, NC","REGULAR","next_f"
"101028648","Chill","Chill","Chill family-friendly company to work at with good work-life balance.","Way too chill. Nothing much really going on.","4.0","2025-11-02T12:48:27.197","Current employee - Associate Software Engineer","Durham, NC","REGULAR","next_f"
"101026734","Not great","Not great","Unlimited overtime and good bonuses","Treated like you’re just a number, bad work place culture, poor training","1.0","2025-11-02T09:18:22.407","Former employee - Finance Associate","Albuquerque, NM","REGULAR","next_f"
"101020184","Awesome!","Awesome!","Super nice people, lots of growth, great company","Starting at the bottom as a CRA is super low pay","5.0","2025-11-01T16:53:25.987","Former employee - Client Relations Intern","Westlake, TX","REGULAR","next_f"
"101015080","Fidelity Investments Great Work Life Balance but Underpays","Fidelity Investments Great Work Life Balance but Underpays","Great work life balance, but they are known to pay below market comps","Bad pay, required to go in to the office, ppt deck heavy company","3.0","2025-11-01T06:11:16.033","Former employee - Associate","Boston, MA","REGULAR","next_f"
"101011145",".",".","Benefits, Work life balance, Career mobility","nothing much . . .","5.0","2025-10-31T20:15:42.437","Current employee - Principal Software Engineer","Durham, NC","REGULAR","next_f"
"101010453","Salary","Salary","Work life balance, culture, training","None that I can think of","5.0","2025-10-31T18:21:32.660","Current employee - Workplace Planning Consultant I","Merrimack, NH","REGULAR","next_f"
"101006258","Mostly ok","Mostly ok","Bonus Profit sharing Great health insurance Good benefits Great campus","Hybrid only, not fully remote Pay is not determined fairly Reorgs are a nightmare.. feels like I'm working for a start up","4.0","2025-10-31T11:51:21.790","Current employee - Customer Support Specialist","Durham, NC","REGULAR","next_f"
"101003434","Solid company","Solid company","Great benefits and competitive pay.","Almost a cult like culture.","3.0","2025-10-31T09:11:48.660","Former employee - Director","Boston, MA","REGULAR","next_f"
"101002074","Educational","Educational","Help gain licensing and work your way to experiencing the branch profession.","Hard to stay on pace Have to pass your exams or fail by a certain amount or else the job is inactive","4.0","2025-10-31T08:00:35.990","Former employee - Financial Services Representative","Pittsburgh, PA","REGULAR","next_f"
"100998590","Decent job, Great company","Decent job, Great company","Great benefits, work from home hybrid, opportunity for shares, excellent platform to offer clients and state of the art planning","Pay structure not the most competitive, little increases yearly, career opportunities far and few between","3.0","2025-10-31T04:54:02.017","Current employee - ISR II","Jacksonville, FL","REGULAR","next_f"
