"review_id","title","body","pros","cons","rating","date","role","location","employmentStatus","_source"
"102796155","WFC","WFC","Amazing company, best benefits around, competitive total income package, excellent training and ongoing support, training, mentoring, partnerships; phenomenal reputation. Truly an organization that you can work with for you entire career - just like I did, now happily retired in my 50s only to firmly focus on personal, health, hobby and family goals.","None, this is one of the best organizations that you had ever consider working for. And, there is so many different ways that you can work with and align yourself internally once you are onboard and thriving.","5.0","2026-02-11T14:21:13.297","Former employee - Workplace Financial Consultant","Denver, CO","REGULAR","next_f"
"103114300","Good Place to work","Good Place to work","Supportive colleagues, strong brand reputation, and good work-life balance. The pace can be manageable compared to many high-pressure financial firms.","As a large organization, decision-making can be slow. Growth opportunities may feel limited in certain areas, and organizational processes can involve multiple layers of approval.","3.0","2026-03-10T09:28:19.200","Former employee - Director","Westlake, TX","REGULAR","next_f"
"103110523","Flexible","Flexible","Hybrid schedule Plenty of PTO","Started heavily monitoring hours “in office” Management system convoluded leading to some micro-managing","5.0","2026-03-10T05:19:46.493","Current employee - Snior Software Engineer","Durham, NC","REGULAR","next_f"
"103104756","Good coworkers, bad return to work policies","Good coworkers, bad return to work policies","Great opportunities for advancement Talented, driven coworkers Extremely professional","Return to office policy had no flexibility and ultimately led to my departure from the company","3.0","2026-03-09T18:30:37.460","Former employee - Senior Associate","Merrimack, NH","REGULAR","next_f"
"103096447","Good experience but bad pay","Good experience but bad pay","Get your licenses and they help with that","Pay is not worth the amount of work in the role","3.0","2026-03-09T07:43:07.290","Former employee - Customer Relationship Advocate","Smithfield, RI","REGULAR","next_f"
"103088654","CRA","CRA","Great onboarding process through getting SIE, 7, 63 licensing. Training on in-house systems and protocols. Modern office with a new cafeteria, constantly remodeled floors, efficient desk setup, and paid public transportation.","The subsidised gym program is weak; I can get a better deal on my own. I can not think of any, every other week, work from the office. Unless you want to work 100% from home, every other week is a good mix.","5.0","2026-03-08T14:56:34.347","Current employee - Customer Service Representative","Salt Lake City, UT","REGULAR","next_f"
"103073567","Great so far","Great so far","Benefits, location, food, in/out of office policy","Nothing to complain about here","5.0","2026-03-06T13:06:42.907","Current employee - Analyst","Boston, MA","REGULAR","next_f"
"103063361","It's great but..","It's great but..","Senior Management is in tune with the team Plenty of work and OT (don't go over 50 hrs!) Great inclusion with the team during in-office Dynamic Working","Team managers are under-qualified Metrics focused even in slow periods Too much OT can get you fired! Benefits are TERRIBLE!! A.I. can do this job - and soon it will! Must bring over outside accounts to be managed by Fidelity or risk termination","2.0","2026-03-05T19:14:16.277","Current employee - Customer Account Resolution Senior Associate","Dallas-Fort Worth","REGULAR","next_f"
"103060825","Micromanagement","Micromanagement","Benefits are good, little upward mobility, pay is just average","WOKE, riddled with PC nonsense. It was surviveable pre-covid but since then the leadership has lost their minds.","1.0","2026-03-05T14:33:44.857","Former employee - High Net Worth Service Associate","Jacksonville, FL","REGULAR","next_f"
"103055359","Good","Good","Good environment with great benefits","Pay is slightly lower than industry","5.0","2026-03-05T07:33:47.107","Current employee - Cloud Engineer","Merrimack, NH","REGULAR","next_f"
"103049492","Good Job","Good Job","The benefits are top tier","Like any job metrics matter","5.0","2026-03-04T21:10:39.970","Current employee - CRA I","Durham, NC","REGULAR","next_f"
"103047684","Great place to work","Great place to work","Good culture, py, benefits and more","None that I can think of","5.0","2026-03-04T17:43:58.303","Current employee - Senior HR Manager","Boston, MA","REGULAR","next_f"
"103041110","Great Opportunities","Great Opportunities","Lots of support and mentoring, company really makes an effort to help their employees improve. 100% paid tuition for certain undergraduate programs. 7% 401(k) match. Many more benefits, too many to list.","Can't think of any right now.","5.0","2026-03-04T08:39:28.840","Former employee - Electronic Response Specialist","Covington, KY","REGULAR","next_f"
"103030597","FIdelity","FIdelity","Good life Good pay Good Netweork","Boring Not the best exit opps","5.0","2026-03-03T14:24:10.230","Current employee - Investment Associate","Westlake, TX","REGULAR","next_f"
"103029853","Salary","Salary","Benefits and generous leave for families","A lot of oversight for new employees","3.0","2026-03-03T13:22:18.320","Former employee - Financial Services Representative","Los Angeles, CA","REGULAR","next_f"
"103028830","It is a Grind","It is a Grind","The work environment and benefits are great.","The job is essentially a call center and it can be mentally taxing.","4.0","2026-03-03T12:09:32.350","Current employee - Customer Relationship Advocate","Salt Lake City, UT","REGULAR","next_f"
"103028472","Benefits","Benefits","Wonderful benefits. Very generous retirement and profit sharing.","No unfavorable experience during my tenure.","5.0","2026-03-03T11:43:49.143","Current employee - Customer Service Representative","Atlanta, GA","REGULAR","next_f"
"103026333","Strong culture, impactful work, and great learning environment","Strong culture, impactful work, and great learning environment","Fidelity offers a strong culture of integrity, collaboration, and continuous learning. Leadership is supportive and encourages data-driven decision-making. The company provides exposure to large-scale financial datasets and meaningful analytical projects that directly impact business outcomes. There are good growth opportunities, competitive benefits, and a stable work environment. Teams are generally collaborative, and cross-functional communication is encouraged.","Some processes can be structured and slow due to compliance and regulatory requirements. Decision-making may involve multiple approvals, which can delay implementation. Workload can increase during month-end or quarter-end reporting cycles. Certain legacy systems may require modernization to improve efficiency.","5.0","2026-03-03T09:20:11.623","Current employee - Financial Data Analyst","Birmingham, AL","REGULAR","next_f"
"103008037","Corporate Machine","Corporate Machine","Benefits are great, but quickly turn into golden handcuffs where “advisors” are 6 weeks from the next bonus. Comp is market adjustments where everyone gets paid the same for the same role regardless of workload or merit. Great place to start in the industry, get CFP or other designations and build experience and then you can jump to whenever you want after 3-5 years of grinding it out here.","Completely sales focused, they say they are “helping people”, but really the focus and pay structure is to push clients into products as fast as possible with the minimal amount of planning needed. If you are serious about financial planning, go to an RIA. If you want to make a lot of money, and have managers always want more (you’re never doing enough), then this is a good fit. Everyone gets paid the same in a role unless your manager likes you (favoritism), then you’ll get shares which payout 3 years later. Constant stack ranking and comparisons vs peers. “What have you done for me this month” mindset. The year I passed the CFP and significantly grew skills/performance, I received a 0% raise and inflation was 6%. The next year was 1.4%, and the year after that was 3%. Over 3 years I lost almost 15% of my pay to inflation while being the most highly educated and certified person in my branch.","2.0","2026-03-02T05:29:46.410","Former employee - Planning Consultant","Milwaukee, WI","REGULAR","next_f"
"102995635","Great company","Great company","Learn a lot great industry starting point with a great team culture","None that I can think of right after reflecting on my time there","5.0","2026-02-28T12:21:38.723","Former employee - High Networth associate","Philadelphia, PA","REGULAR","next_f"
"102984020","Very Fun","Very Fun","Large Amount of Room For Growth","Very Little Assistance From Management","4.0","2026-02-27T07:16:08.887","Current employee - Data Analyst","Smithfield, RI","REGULAR","next_f"
"102983453","Great culture and work life balance","Great culture and work life balance","accommodating decent pay nice bonus","in person hybrid schedule office in the middle of nowhere long drive","5.0","2026-02-27T06:26:50.237","Current employee - Program Manager","Westlake, TX","REGULAR","next_f"
"102961082","Good Culture","Good Culture","Good culture, nice people who want to see you succeed","Pay, little to no upward mobility","4.0","2026-02-25T16:16:43.420","Current employee - Brokerage Operations Associate","Jersey City, NJ","REGULAR","next_f"
"102959957","Great job","Great job","Prefect benefits, great hours and good pay as well.","Can’t say anything bad about this position.","5.0","2026-02-25T14:23:54.330","Former employee - Customer Service Representative","Westlake, TX","REGULAR","next_f"
"102953244","Great Company","Great Company","Pay, Benefits, Training, and Location","Limited Growth Potential in market, and Coaching is inconsistent","4.0","2026-02-25T06:24:35.633","Former employee - Investment Consultant","Greenville, SC","REGULAR","next_f"
"102952451","Customer service","Customer service","Decent benefits, PTO, VTO and mental health benefits","Calls are back to back most days","4.0","2026-02-25T05:21:35.927","Current employee - Finacial Services Representative","Durham, NC","REGULAR","next_f"
"102950093","Part time","Part time","flexible hours if you're a student. Can make your own schedule","Pay isn't that great to be honest","5.0","2026-02-25T02:01:34.037","Former employee - Customer Support Representative","Westlake, TX","PART_TIME","next_f"
"102945661","CRA","CRA","Great entry level position an experience to see the industry","Very difficult to move up and low salary","4.0","2026-02-24T17:17:53.120","Former employee - Customer Relationship Advisor","Merrimack, NH","REGULAR","next_f"
"102941856","Decent","Decent","Good for growth, education, and pay was decent","Lot of stats to worry about and may come with micro management","4.0","2026-02-24T11:36:55.950","Former employee - Investment Solutions Representative I","Durham, NC","REGULAR","next_f"
"102937242","Grear place to work, but relationships are key","Grear place to work, but relationships are key","- Good benefits - Great pay structure - Flexible WFH options","- Opportunities can be gatekept and are relationship-based","4.0","2026-02-24T06:23:47.083","Former employee - HR-Operations Manager","Boston, MA","REGULAR","next_f"
"102936882","Amazing Company","Amazing Company","Work life balance, remote, no micro management, lots of opportunity to move up. Benefits","Always changing- upgrading systems, lots of acronyms you have to learn","5.0","2026-02-24T05:58:45.943","Current employee - Investment Management Consultant II","Houston, TX","REGULAR","next_f"
"102930978","Amazon Politics And Culture, But Without The Pay","Amazon Politics And Culture, But Without The Pay","The day-to-day project workload is well-paced, and the deadlines are realistic, which is a rarity in many tech firms. The office facilities are excellent and provide a great working environment. Professionally, the role offers invaluable experience in managing massive data volumes under high regulatory pressure, teaching you how to build robust systems where there is very little room for error. The base salary is relatively modest, but when you factor in all of the bonuses, retirement plan matching, etc, the pay package is substantial, especially relative to the local cost of living.","$7a","2.0","2026-02-23T18:58:11.733","Former employee - Data Engineer","Durham, NC","REGULAR","next_f"
"102923009","Salary","Salary","Flexibility and work life balance - low stress","Pay is very low- takes a while to advance even if you’re performing","3.0","2026-02-23T07:41:47.023","Current employee - Customer Relationship Advocate","Denver, CO","REGULAR","next_f"
"102916226","Great Training- Horrible Management","Great Training- Horrible Management","You get pretty good training and theirs lots of opportunities for bonuses","Extreme micromanaging for no reason","1.0","2026-02-22T18:35:23.247","Former employee - Financial Services Representative","Nebraska City, NE","REGULAR","next_f"
"102913142","Metric Focused","Metric Focused","excellent PTO excellent health insurance","High stress call center with high focus on metrics. Back to back calls Focused on quantity of calls","1.0","2026-02-22T09:36:56.297","Former employee - Customer Financial Associate","Omaha, NE","REGULAR","next_f"
"102909220","Unmotivated people collected paychecks","Unmotivated people collected paychecks","Great benefits and remote working","It’s a place to collect paychecks","2.0","2026-02-21T17:48:10.120","Current employee - Research Analyst","Boston, MA","REGULAR","next_f"
"102907846","Great company","Great company","Work environment is very good.","Nothing to mention at the moment.","5.0","2026-02-21T12:48:09.347","Current employee - Data Engineer","Durham, NC","REGULAR","next_f"
"102897565","Not bad","Not bad","Offers good work life balance","Too adamant with the dynamic working policy and internal transfers, quit coz of that","4.0","2026-02-20T09:13:17.333","Former employee - Software Engineer","Nashua, NH","REGULAR","next_f"
"102896886","Good entry level role","Good entry level role","Paid to study for SIE, Series 7 and 63","Stats tied to phone performance is contradictory","4.0","2026-02-20T08:17:39.840","Former employee - Customer Relationship Advocate","Smithfield, RI","REGULAR","next_f"
"102889309","Soul Draining","Soul Draining","Fully paid study time for licensing. Good 401k match after 1 year employment. Good work life balance.","Low pay. Upward mobility, especially out of client service is next to impossible. Deceptive upper management who emphasizes ease of mobility when in reality you are stuck in the same roles for over a year. Upper management pressures your managers to micromanage you by the minute.","2.0","2026-02-19T17:33:32.920","Current employee - Client Service Specialist I","Greenwood Village, Arapahoe, CO","REGULAR","next_f"
"102872533","Unethical hiring practices, to start","Unethical hiring practices, to start","The Firm is experiencing a troubling loss of confidence in its integrity. Ongoing issues within business partnerships over recent years have eroded trust and significantly impacted team morale and internal confidence.","The loss of team morale and internal confidence.","1.0","2026-02-18T12:56:14.667","Former employee - Business Development","Denver, CO","REGULAR","next_f"
"102869998","Learn everyday to progress","Learn everyday to progress","Benefits, PTO, hybrid role, office perks ( espresso)","Difficult role if you don’t learn how to master the metrics and also learn 401k policy info or changes DAILY. experience in finances helps a lot","4.0","2026-02-18T09:41:02.840","Former employee - Financial Associate","Jacksonville, FL","REGULAR","next_f"
"102869534","Stablity and Risk averse","Stablity and Risk averse","Stable place. Forgiving and respectful. Not cut throat","Slow Not always meritocratic Low impact contribution","4.0","2026-02-18T09:08:17.630","Current employee - Senior Quant Developer","Jersey City, NJ","REGULAR","next_f"
"102865814","Don't be fooled.","Don't be fooled.","Paid for licensing Hybrid schedule","Severely underpaid Horrible incompetent customers Garbage benefits Very fake corporate culture Terrible communication","1.0","2026-02-18T04:12:38.810","Current employee - CRA I","Jacksonville, FL","REGULAR","next_f"
"102853859","Fantastic overall compensation","Fantastic overall compensation","There is a lot of variety in the role.","There were too many plans in the book of business to have a proper work/life balance. The reputation of Fidelity made clients feel they were entitled to anything they asked for.","5.0","2026-02-17T06:52:59.407","Former employee - Managing Director","Covington, KY","REGULAR","next_f"
"102846370","Great Entry Level Role","Great Entry Level Role","Get your licences and management pours into you","lower pay when you start out","5.0","2026-02-16T14:31:05.220","Current employee - Customer Relationship Advocate","Westlake, TX","REGULAR","next_f"
"102839028","Review","Review","Good 401k plan Good potential for bonuses","Not real room for advancement unless you “know someone”….","4.0","2026-02-16T01:57:08.307","Former employee - Client Services Manager","Covington, KY","REGULAR","next_f"
"102823199","Good work life balance","Good work life balance","Working with amazing people and good work life balance","The Pay is pretty low","5.0","2026-02-13T12:19:16.743","Current employee - Customer Relationship Advocate","Salt Lake City, UT","REGULAR","next_f"
"102796867","Weird obsession with making people work at the office","Weird obsession with making people work at the office","Good benefits. Decent Pay. Team members have generally been good people I enjoy working with.","HR has an obsession with making people go to the office. After covid, they made us go to the office one week per month. Then that increased to two. Recently they posted an attendance policy to tell people to make sure they stay the full day for in office weeks - which they have not actually specified what that means. Is 8 am on time? 9 am? is 4 pm the end of the day? 5 pm? Translation: Track onsite attendance arbitrarily in order to penalize people arbitrarily despite actual work performance.","2.0","2026-02-11T15:33:53.420","Current employee - Software Engineer","Durham, NC","REGULAR","next_f"
"102789500","very positive experience","very positive experience","Great coworkers and ample incentive to do your best work.","Such a large company that sometimes things happen slowly because there are so many interested parties.","5.0","2026-02-11T06:50:13.167","Former employee - Marketing","Boston, MA","REGULAR","next_f"
"102782358","Financial Consultant","Financial Consultant","Pay is good if you work hard and take on coaching recommendations.","Stess, support staff turnover and changes is very high.","3.0","2026-02-10T19:51:52.437","Current employee - Finance","Seattle, WA","REGULAR","next_f"
"102771119","Good","Good","Benefits, PTO, 401k match, college loan assistance","Sales based job tough to hit metrics","4.0","2026-02-10T06:46:00.793","Current employee - Regional Investment Consultant","Smithfield, RI","REGULAR","next_f"
"102763433","Good culture","Good culture","Good culture and good benefits","None that come to mind","5.0","2026-02-09T19:25:09.277","Current employee - Director","Boston, MA","REGULAR","next_f"
"102763117","Financial Advisor","Financial Advisor","Good corporate culture. Large stable company.","Low pay. Little upward mobility.","4.0","2026-02-09T18:56:14.707","Current employee - Financial Advisor Associate","Salt Lake City, UT","REGULAR","next_f"
"102759054","salary","salary","good work life balance schedule","not that many I can think of","4.0","2026-02-09T13:20:18.867","Current employee - Investment Solutions Representative","Westlake, TX","REGULAR","next_f"
"102755919","Good Company","Good Company","Great benefits, compensation, and opportunity for advancement.","Assembly Line of Financial Planning","4.0","2026-02-09T10:22:33.427","Former employee - VP-Financial Consultant","Boston, MA","REGULAR","next_f"
"102745817","Best place of my career.","Best place of my career.","Culture, Salary, Leadership are all incredible. Leaders will constantly say hi, and take associate surveys seriously.","Constant change of processes to improve the experience. May lead to hiccups or unfair advantage to more tenured associated.","5.0","2026-02-08T23:51:57.753","Current employee - Workplace Planning Associate","Salt Lake City, UT","REGULAR","next_f"
"102742410","Excellent place to work","Excellent place to work","Good benefits and good environment","Salary base is low And shares continue to be split","5.0","2026-02-08T16:46:45.770","Current employee - SVP Operations","Boston, MA","REGULAR","next_f"
"102733679","Best company to work","Best company to work","Best work culture in the industry","None that i know of","5.0","2026-02-07T18:24:33.380","Current employee - Principal Full Stack Engineer","Westlake, TX","REGULAR","next_f"
"102732313","Too Woke","Too Woke","- Generous benefits - Beautiful campus - Office amenities","- Fires employees for the slightest offenses - Woke - Teams chats are too heavily monitored and flagged - Employs many incompetent individuals, many without a business/finance degree or with no degree at all","3.0","2026-02-07T14:25:22.030","Former employee - Money Movement Control Wire Risk Associate","Westlake, TX","REGULAR","next_f"
"102730734","Treats Employees well","Treats Employees well","Great benefits, great pay and easy progression if the roles are open","“Kool-aid” vibes and mostly lifers","4.0","2026-02-07T10:50:23.123","Former employee - Planning Consultant","Portland, OR","REGULAR","next_f"
"102729551","Fidelity is great!","Fidelity is great!","Great company, amazing leadership, work/life balance, benefits","It's become harder to move into a Financial Consultant position","5.0","2026-02-07T08:36:38.277","Current employee - Planning Consultant","New York, NY","REGULAR","next_f"
"102719687","Generally an above average employer to work for","Generally an above average employer to work for","Very decent benefits if, life go's according to plan, if there's and unexpected deviation navigating their benefits through the third party provider ther use can be challenging and time consuming.","As with any company there are niche specific issues but generally their a decent company.","4.0","2026-02-06T12:04:20.640","Current employee - Workplace planning consultant 1","Covington, KY","REGULAR","next_f"
"102717767","Totally over-corporate","Totally over-corporate","pays ok, clean workplace, excellent benefits","too corporate, everyone is super micromanaged, C-suite execs have absolutely no clue what's going on in the trenches &amp; always come up with new ways to torture everyone else as a means to justify their jobs. also, definitely pay gaps for male vs female","2.0","2026-02-06T10:00:45.390","Former employee - Software Engineer","Smithfield, RI","REGULAR","next_f"
"102713550","Pretty good","Pretty good","Great co-workers, very good benefits.","I don't have any cons to share at this time.","4.0","2026-02-06T06:06:14.723","Current employee - Account Manager","Denver, CO","REGULAR","next_f"
"102707734","Good company","Good company","Good benefits, great 401K match","Base pay is low compared to industry","4.0","2026-02-05T22:04:57.330","Current employee - Senior Financial Analyst","Boston, MA","REGULAR","next_f"
"102707091","Great boss","Great boss","- Good people - Good pay","- None that I have","5.0","2026-02-05T20:59:45.780","Former employee - Data Analyst","Boston, MA","REGULAR","next_f"
"102705923","Comfortable and steady","Comfortable and steady","Good benefits Decent pay Profit sharing a guarantee Pretty flexible","In office time could be worse","5.0","2026-02-05T19:14:11.680","Current employee - Business Analyst","Merrimack, NH","REGULAR","next_f"
"102699955","Decent. Call center not fun","Decent. Call center not fun","You get benefits and good learning experience","Severely underpaid and PTO process is awful","3.0","2026-02-05T12:17:42.930","Former employee - Financial Services Representative","Raleigh, NC","REGULAR","next_f"
"102682229","It's a job","It's a job","Call center, always work to do","Repetitive, angry customers, no managerial support.","2.0","2026-02-04T19:03:05.500","Current employee - Team Lead","Durham, NC","REGULAR","next_f"
"102681078","Not fun","Not fun","Benefits, PTO, and support from leader","Pay, time off, bonus, growth","2.0","2026-02-04T17:42:40.680","Current employee - Financial Customer Associate","Merrimack, NH","REGULAR","next_f"
"102678569","FC Fidelity","FC Fidelity","worklife balance is solid no complaints","as usual management is not great they only tell you to keep selling","3.0","2026-02-04T15:01:03.217","Former employee - Financial Consultant","Nashville, TN","REGULAR","next_f"
"102676490","Salary","Salary","Easy job and very easy metrics","Little to no growth opportunities","3.0","2026-02-04T13:13:57.643","Current employee - Client Service Representative","Raleigh, NC","REGULAR","next_f"
"102669911","grear","grear","very great company cares about people","You have to earn stripes before making money","5.0","2026-02-04T08:26:58.693","Former employee - Investment Solutions Representative II","Jacksonville, FL","REGULAR","next_f"
"102654776","Salary","Salary","Work life balance and people","Salary and lunch break and workload","5.0","2026-02-03T16:17:00.253","Former employee - Financial Representative","Boston, MA","REGULAR","next_f"
