"review_id","title","body","pros","cons","rating","date","role","location","employmentStatus","_source"
"97771578","Good Start","Good Start","Great place to start your wealth management career, lots of opportunity to learn and get licensed. Great culture, and a happy place to work. Lots of opportunity for free time.","Lower ceiling, but plenty of opportunities for growth and you can become an advisor quicker than at other firms. Lower pay compared to other firms.","5.0","2025-06-02T16:05:28.933","Current employee - Financial Services Representative","San Jose, CA","REGULAR","next_f"
"97769040","First-time in finance","First-time in finance","The training is very helpful to get you ready to pass the various exams you need to work in the finance industry.","The compensation could be more after you are done with training.","3.0","2025-06-02T13:50:27.230","Current employee - Customer Service Representative","Salt Lake City, UT","REGULAR","next_f"
"97712044","Fidelity review","Fidelity review","Great Pay and Benefits Great people and environment","A lot of politics and personal relationship including romantic","3.0","2025-05-30T08:20:36.613","Former employee - VP of architecture","Boston, MA","REGULAR","next_f"
"97698795","Nice company with good benefits","Nice company with good benefits","Best 401K option for retirement","Initial employment offer is IC","5.0","2025-05-29T18:37:30.723","Current employee - Senior Java Developer","Dallas, TX","REGULAR","next_f"
"97697505","Isr","Isr","Good people , great benefits, nice office","You spend half your day answering inbound phone calls","4.0","2025-05-29T17:17:23.013","Current employee - Fixed Income Specialist","Covington, KY","REGULAR","next_f"
"97693710","Good","Good","Friendly environments with lots of good people!","Management change rules easily! It makes the culture unstable","3.0","2025-05-29T13:49:41.003","Former employee - Scrum Master","Westlake, TX","REGULAR","next_f"
"97686819","Great place to work","Great place to work","Great benefits, good culture, beautiful office","Little room for career development","5.0","2025-05-29T09:02:44.790","Current employee - Client Service Manager II","Westlake, TX","REGULAR","next_f"
"97686257","Associate analyst salary","Associate analyst salary","Good culture and growth opportunities","Underpaid compared to rest of industry","3.0","2025-05-29T08:43:35.090","Former employee - Associate Analyst","Jersey City, NJ","REGULAR","next_f"
"97660707","No room to breathe","No room to breathe","Education reimbursement and Flexible hours","Micromanaging Short breaks Low pay","2.0","2025-05-28T10:35:57.560","Former employee - Customer Service Associate","Covington, KY","PART_TIME","next_f"
"97652178","Good company","Good company","Flexible, autonomy, room for growth and learning","Lower pay than other companies with similar jobs","4.0","2025-05-28T05:28:56.317","Current employee - Financial Analyst","Smithfield, RI","REGULAR","next_f"
"97636514","Culture Significantly Changed","Culture Significantly Changed","Your experience really depends on your team and business unit.","Compensation and benefits are well below industry standard. Which is a problem since the positive reviews were really a thing of the past and now Fidelity's culture is no different from any other investment company, but you'll get paid less and expected to work more.","1.0","2025-05-27T14:14:21.740","Former employee - Director","Boston, MA","REGULAR","next_f"
"97614050","Great place","Great place","Great team and awesome work","Very narrow corporate ladder vs other companies","5.0","2025-05-26T20:49:30.433","Current employee - Intern","Minneapolis, MN","REGULAR","next_f"
"97578236","Growth opportunities","Growth opportunities","PTO, networking, hybrid work, benefits","lots of calls. Intellectually and emotionally challenging work at times.","5.0","2025-05-24T16:16:16.940","Current employee - Executive Services Associate","Westlake, TX","REGULAR","next_f"
"97561621","Great place to work","Great place to work","benefits, culture, work life balance all great","No issues at all Good place to work","5.0","2025-05-23T12:25:29.073","Current employee - Investment Solutions Representative","Smithfield, RI","REGULAR","next_f"
"97558355","Great Company","Great Company","Value your work life balance","Lower pay than industry average","5.0","2025-05-23T09:46:41.840","Current employee - Central Relationship Manager","Salt Lake City, UT","REGULAR","next_f"
"97540922","Good company, bad job","Good company, bad job","Fidelity is a great company with great benefits.","It is a call center and you can deal with some rude people.","4.0","2025-05-22T16:31:53.197","Former employee - Workplace Planning Consultant","Jacksonville, FL","REGULAR","next_f"
"97512762","Can't live on the pay","Can't live on the pay","Amazing culture, people and products","Based on what I’ve heard, the compensation for this role hasn’t changed since 2019, despite the significant impact inflation has had on the cost of living. I’ve heard that Schwab offers approximately 20% more for the same role. While I genuinely value being part of this team and would prefer to stay, it feels like they’re taking advantage of the tough job market and paying people as low as they can because they know there are others to backfill if we leave. I’m not sure if Abby or the compensation team are fully aware of how low this wage is for someone living in Denver. Even promotions don’t entirely solve the issue, as they’re building off a base salary that’s already well below market. For context, I hold a bachelor's degree in finance and my Series 7 license.","3.0","2025-05-21T17:11:35.200","Current employee - Customer Relationship Manager","Denver, CO","REGULAR","next_f"
"97507931","Great Place to work","Great Place to work","Great company with great benefits","You can't work fully remote anymore unless you are a top vp","5.0","2025-05-21T12:55:57.347","Current employee - Senior Full Stack Engineer","Raleigh, NC","REGULAR","next_f"
"97496905","Best place to work","Best place to work","Flexible and accommodating with so many benefits","Need to go into office two weeks per month","5.0","2025-05-21T06:26:22.637","Current employee - Financial Representative","Merrimack, NH","PART_TIME","next_f"
"97447662","Good place","Good place","Great benefits, great colleagues, relaxed culture","low base pay, incentives in staying long term with company","5.0","2025-05-19T11:46:02.220","Current employee - Investment Solutions Representative","Merrimack, NH","REGULAR","next_f"
"97445853","Experience","Experience","Work culture, benefits, hybrid model","Limited job advancement opportunities for middle to senior management (eg - director to VP)","4.0","2025-05-19T10:36:24.787","Former employee - Director","Boston, MA","REGULAR","next_f"
"97444210","Good and the Bad","Good and the Bad","*It's a great place to work as an advisor if you want to help Fidelity build their business and be compensated appropriately. *Growth in role as an advisor is not challenging, however growth outside the traditional advisor path seems very unlikely.","*At the end of the day, the clients are Fidelity's. *The solutions you can offer are VERY limited compared to what an RIA can do. *The company seems to value DEI for new hires and promotion, but still rewards merit through compensation / shares.","5.0","2025-05-19T09:34:33.063","Former employee - Investment Consultant","Seattle, WA","REGULAR","next_f"
"97444012","Wpc","Wpc","Lots of support to help you","6pm shifts Monday thru Friday","5.0","2025-05-19T09:27:02.690","Current employee - Workplace Planning Consultant I","Merrimack, NH","REGULAR","next_f"
"97427706","Great Company","Great Company","Great company, people, and work/life balance","Occasional lack of true meritocracy","5.0","2025-05-18T17:09:29.677","Current employee - Senior Financial Analyst","Boston, MA","REGULAR","next_f"
"97422952","Best employer","Best employer","Great job. Great coworkers. Mobility favored.","Can’t really think of anything negative Difficult","5.0","2025-05-18T09:13:50.670","Current employee - Financial Representative","Burlington, MA","REGULAR","next_f"
"97421985","Good place to start but not great for long term.","Good place to start but not great for long term.","Great benefits. Great onsite amenities","Very heavy workload. low career advancement opportunities.","3.0","2025-05-18T07:45:40.197","Current employee - Financial Associate II","Durham, NC","REGULAR","next_f"
"97416365","Great Culture","Great Culture","Since the company is privately held, they can think longer term than their publicly held competitors. IMHO this helps provide a more stable environment.","Pay may be slightly lower than their competitors.","5.0","2025-05-17T18:48:01.967","Former employee - Director, Process Improvement","Jersey City, NJ","REGULAR","next_f"
"97411842","Friendly but lacking culture","Friendly but lacking culture","Friendly people, plenty to work on, decent pay, great childcare and paternity benefits, high 401k match","Never felt comfortable asking questions, always felt on my own with code I didn’t understand or know what it was for Management making a lot of changes that show distrust in their employees (more time in office and more strict time tracking) or cost cutting (changing a $300 annual health credit into an overpriced gym membership everyone hated) Not much opportunity for advancement, company is in cost cutting mode and limiting lateral moves or promotions, Seems like they’d rather spread those jobs around to other team members or hire cheap 8-10 month contracts to avoid raises or paying out more in benefits","2.0","2025-05-17T09:21:45.990","Former employee - Associate Software Engineer","Salt Lake City, UT","REGULAR","next_f"
"97403997","Okay","Okay","nice cafeteria nice office space","$7a","2.0","2025-05-16T18:38:22.623","Current employee - Senior Full Stack Engineer","Boston, MA","REGULAR","next_f"
"97377026","Love it","Love it","Fast movement Constantly learning Company culture Bonus","Base pay could be more competitive.","5.0","2025-05-15T15:33:37.713","Current employee - Help Desk","Salt Lake City, UT","REGULAR","next_f"
"97376855","Isr 2","Isr 2","Good education, great resources, fantastic benefits, and good worklife balance.","Call center role with lots of service duties for someone who was pitched on planning and guidance.","4.0","2025-05-15T15:22:02.707","Former employee - Investment Solutions Representative II","Merrimack, NH","REGULAR","next_f"
"97370613","no growth","no growth","good benefits at the company.","no growth within the company and poor management.","2.0","2025-05-15T10:51:24.820","Former employee - 401k Representative","Raleigh, NC","REGULAR","next_f"
"97364958","WPA","WPA","good benefits good amount of time off hybrid work","call center service calls other teams don't do their jobs and it all falls on wpa","3.0","2025-05-15T07:21:46.730","Former employee - Workplace Planning Associate","Greenwood Village, CO","REGULAR","next_f"
"97356762","Great stepping stone for career","Great stepping stone for career","-Allows you to pursue licensing -vast trading knowledge -continued training support","-limited career growth potential within department -salary could be improved","5.0","2025-05-15T00:51:51.857","Current employee - Retirement Brokerage Services Representative","Albuquerque, NM","REGULAR","next_f"
"97342112","Experience working at Fidelity Investments","Experience working at Fidelity Investments","Lots of incredible learning opportunities and programs and great network of employees","Lots of re-orgs on a regular basis, lots of changes in reporting structure moving to a model approach but creates a major disconnect and lack of leadership for employees. Pay is not competitive compared to other organizations. Being onsite is required 2 weeks a month and it is monitored. If associates don't comply they lose their job","2.0","2025-05-14T11:20:06.370","Former employee - Scrum Master","Merrimack, NH","REGULAR","next_f"
"97332229","Room for growth","Room for growth","Great place to work and grow","Starting off on the phones can be draining but best way to learn","4.0","2025-05-14T05:35:44.950","Current employee - Financial Representative","Covington, KY","REGULAR","next_f"
"97318204","Awesome Place to Work","Awesome Place to Work","Great reputation, privately held, great training and support","Expected to hold 16-20 meetings per week.","5.0","2025-05-13T15:08:55.567","Current employee - Financial Consultant","Houston, TX","REGULAR","next_f"
"97307544","Great Company to Work for!","Great Company to Work for!","Culture, Opportunities, People, Collaboration. The firm really invests in their employees so they can thrive","It takes a long time to figure how things work, to build your network which is critical to sucess.","5.0","2025-05-13T08:07:37.290","Current employee - Consultant","Troy, MI","REGULAR","next_f"
"97288388","Great company","Great company","Management Culture Paying for Licenses","Pay is a little outdated","4.0","2025-05-12T14:19:22.130","Current employee - Customer Relationship Advocate","Westlake, TX","REGULAR","next_f"
"97288044","Job review","Job review","Great work life, balance, professional, and positive culture.","Pay structure is on the low end and no end of year bonus; lots of glass ceilings to move from investment consultant to financial consultant internally.","3.0","2025-05-12T14:01:48.743","Former employee - Investment Consultant","Millburn, NJ","REGULAR","next_f"
"97287805","Think twice","Think twice","Benefits, amenities, and learning/going through the journey with other soar associates","Treated like a number, phone calls all day, repetitive, poor communication and misleading information about career advancement, no flexibility. My time there was not enjoyable and the options given to my group after SOAR was over was even worse. I would think twice before committing.","2.0","2025-05-12T13:50:10.347","Former employee - SOAR Program Associate","Durham, NC","REGULAR","next_f"
"97265537","Salary","Salary","No pros to describe in this comment box","No cons to describe in comments","4.0","2025-05-11T16:56:44.483","Former employee - Principal UX Designer","Boston, MA","","next_f"
"97261861","Fantastic benefits","Fantastic benefits","Company makes a profit sharing contribution to your 401(k), has a 7% match, and offers excellent healthcare and other benefits.","Salary is lower to start. But once you have a year or two with the firm, your gross income goes up due to bonuses and share payouts (if you've been awarded shares for your performance).","4.0","2025-05-11T10:14:20.177","Current employee - Communications Consultant","Westlake, TX","REGULAR","next_f"
"97250340","Ggreat supportreat company,","Ggreat supportreat company,","Great place to work, great upport","Bit of a grind, constantly working on your stats","5.0","2025-05-10T08:03:46.200","Current employee - WPC 1","Merrimack, NH","REGULAR","next_f"
"97246694","Best phone based department to work in","Best phone based department to work in","-same stuff each day and lower call volumes than CRA -one of the departments you can go to post CRA training (licensing) -get to do casework","-no OPA -survey bonuses but never hit them so always get high client success scores but not the total 20 surveys taken per quarter","3.0","2025-05-09T23:56:37.393","Former employee - College Planning Specialist","Dallas, TX","REGULAR","next_f"
"97217772","Treatment","Treatment","You get paid that’s it","There fake , and hypocritical","1.0","2025-05-08T14:39:11.577","Former employee - Fixed Income Specialist","Smithfield, RI","REGULAR","next_f"
"97214489","Poor management","Poor management","Free snacks and nice building","Management was terrible Training is terrible for licensing Pay","1.0","2025-05-08T12:01:26.837","Former employee - Customer Service","Covington, KY","REGULAR","next_f"
"97210636","Great Benefits and Stability, But Career Growth and Recognition Need Improvement","Great Benefits and Stability, But Career Growth and Recognition Need Improvement","Profit sharing 401k match HSA contributions Guild program Student loan repayment Hybrid schedule Stable employment","Lack of career growth/promotions Little to no raises Senior leadership doesn't value/listen to associates commentary","4.0","2025-05-08T09:04:15.320","Current employee - Managed Account Support Specialist","Dallas, TX","REGULAR","next_f"
"97209171","Wpc","Wpc","Great work life balance. Great benefits. People are kind","inbound phone role. Heavy focus on metrics","3.0","2025-05-08T08:14:30.993","Current employee - Workplace Planning Consultant","Merrimack, NH","REGULAR","next_f"
"97199069","Good company to work for","Good company to work for","Good benefits. Mobility within the company. Good management. Care about not jyst getting the work done but done right.","Bureaucracy. Too big a company. Hence low visibility. Not very challenging work.","4.0","2025-05-07T22:58:33.843","Current employee - Principal Data Engineer","Durham, NC","REGULAR","next_f"
"97185984","Great company","Great company","Great management, a fun team!","Finra tests, are very difficult. Serious tests!","5.0","2025-05-07T10:36:37.687","Current employee - Customer Relationship Advocate","Merrimack, NH","REGULAR","next_f"
"97183622",".",".","The Natural one is the participation","The fact that you are not","3.0","2025-05-07T09:05:12.043","Current employee - High Net Worth Service Associate","Covington, KY","REGULAR","next_f"
"97164938","Great Company","Great Company","Good work life balance and decent pay","None i could think of","4.0","2025-05-06T15:11:52.563","Current employee - Principal Architect","Westlake, TX","REGULAR","next_f"
"97140027","Fidelity","Fidelity","Great people and culture here","Hours are long but no weekends","1.0","2025-05-05T18:31:00.130","Former employee - Customer Service Representative","Cary, NC","REGULAR","next_f"
"97139986","Great Benefits and Career Growth","Great Benefits and Career Growth","Career Growth &amp; Mobility - Tuition Reimbursement for continued education and certifications","In office requirement 50% of the time","5.0","2025-05-05T18:29:00.210","Current employee - Scrum Master","Merrimack, NH","REGULAR","next_f"
"97131667","Fidelity is a GREAT place to work","Fidelity is a GREAT place to work","Great culture Technology is amazing Great investment and planning principals","Payout can be small Can be very busy, but it’s what you make it.","5.0","2025-05-05T11:12:38.713","Current employee - Investment Consultant","Morristown, NJ","REGULAR","next_f"
"97131067","Love it!","Love it!","Culture, flexibility, benefits, compensation and opportunity","I really can’t think of any.","5.0","2025-05-05T10:47:26.920","Current employee - Vice President","Denver, CO","REGULAR","next_f"
"97129907","Break neck but high potential","Break neck but high potential","Benefits are fantastic Great resources for continuing education Incredible support network for success and improvement","Pay is good but not equal to positions value Policies and practices shift constantly.","4.0","2025-05-05T10:04:05.417","Former employee - Financial Representative","Durham, NC","REGULAR","next_f"
"97112685","Great place","Great place","Good work life balance and benefits","Work place amenities are not great","4.0","2025-05-04T15:49:44.747","Current employee - Principal Software Engineer","Durham, NC","REGULAR","next_f"
"97109487","Low pay no opportunity to build a book","Low pay no opportunity to build a book","I’m a financial advisor with series 7 &amp; 66 &amp; insurance licenses. Had been with the firm for a couple years. No internal motility. Limited and competition roles if you want to build your own book.","They don’t embrace diversity. They only favor caucasians. You’ll be a top performer if you can make 200 cold calls a week.","2.0","2025-05-04T10:42:14.853","Former employee - Investment Consultant","Jersey City, NJ","REGULAR","next_f"
"97108170","Not bad","Not bad","Friendly environment for the most part.","A few loose screws can be found.","3.0","2025-05-04T08:37:20.663","Former employee - IT Director","Jersey City, NJ","REGULAR","next_f"
"97102647","Great company to work for","Great company to work for","Pay and incentives have been amazing and I am still rather new. Room to grow potential is also limitless.","Not very much to say other than my training manager had a God complex.","4.0","2025-05-03T19:47:40.660","Current employee - HSA Specialist","Albuquerque, NM","REGULAR","next_f"
"97093336","BA","BA","Flexible work environments for hybrid.","As with anything, outdated salary bands","4.0","2025-05-02T16:30:00.767","Current employee - Business Analyst","Durham, NC","REGULAR","next_f"
"97088996","10/10 would recommend","10/10 would recommend","Wonderful executives, excellent peers. Advisors are invested in helping their executives succeed. Top tier solutions offering. Top notch support.","Work is endless. The company is always changing- new focus every few weeks. Deployment goals are sky high.","5.0","2025-05-02T11:21:40.167","Current employee - Vice President, Executive Planning Consultant","San Francisco, CA","REGULAR","next_f"
"97071541","Great Culture","Great Culture","Culture at the company is strong","Pay isn’t up to standard of living.","4.0","2025-05-01T15:57:46.257","Current employee - Customer Relationship Advocate","Greenwood Village, CO","REGULAR","next_f"
"97063548","great","great","easy place to work and commute to","coworkers are bland but nice","3.0","2025-05-01T08:40:45.737","Current employee - anaylst","Providence, RI","PART_TIME","next_f"
"97060430","Good company","Good company","Benefits are competitive and profit sharing","Big company feel with a lot of performance reviews","4.0","2025-05-01T06:04:42.433","Current employee - Financial Consultant","Rhode Island, NY","REGULAR","next_f"
"97043357","fair company","fair company","good benefits and remote work","metrics are unrealistic and demanding","4.0","2025-04-30T10:35:51.077","Former employee - Investment Solutions Representative II","Towson, MD","REGULAR","next_f"
"97036816","Fantastic Employer","Fantastic Employer","Great culture, Supportive, Benefits are outstanding","Not many cons, I'm blessed to be employed here.","5.0","2025-04-30T06:15:33.217","Current employee - Customer Relationship Advocate","Merrimack, NH","REGULAR","next_f"
"97035787","Love this company","Love this company","Lots of support obtaining licenses, and time devoted to self-development and exploring career opportunities, hybrid work environment, working with colleagues, great benefits.","Call volumes during busy periods can be exhausting, but this is not the norm.","5.0","2025-04-30T05:26:11.180","Current employee - CRA","Jacksonville, FL","REGULAR","next_f"
"97027065","Great benefits and culture","Great benefits and culture","17% company 401k contribution (10% profit sharing and 7% company match) Good managers who want you to get promoted Good benefits","What they pay in benefits they lack in actual dollars hitting your bank account They focus heavily on stats with only your managers word to help you, which they sometimes ignore.","5.0","2025-04-29T19:27:06.733","Current employee - Health Savings Account Specialist III","Westlake, TX","REGULAR","next_f"
"97023947","Great company ‼️","Great company ‼️","Low stress, clear expectations, company culture","Promotion not merit based, they promote based on who networks the best","4.0","2025-04-29T16:07:29.150","Former employee - Workplace Planning Consultant II","Westlake, TX","REGULAR","next_f"
"97015780","Great place to work","Great place to work","Work from home 1/2 the time. Great people Good environment","Could pay a bit more","5.0","2025-04-29T10:10:05.533","Current employee - Senior Financial Analyst","Boston, MA","REGULAR","next_f"
"97009686","Amazing company with a bright future","Amazing company with a bright future","Pay &amp; benefits Work/life balance On-site amenities","Inflexibility for remote and hybrid work","4.0","2025-04-29T06:25:00.483","Former employee - Executive Office Specialist","Covington, KY","REGULAR","next_f"
"97001611","CRA Experience","CRA Experience","Good work life balance and nice people","Manager can make or break experience","3.0","2025-04-28T22:26:03.210","Former employee - Customer Relationship Advocate","Durham, NC","REGULAR","next_f"
"96993322","Customer Relationship Advocate","Customer Relationship Advocate","a lot of benefits that will help you and your family","no cons that i can think of besides the fact you have to delete all other stock apps","5.0","2025-04-28T13:33:23.627","Current employee - Customer Relationship Advocate","Jacksonville, FL","REGULAR","next_f"
"96971848","good","good","nice money. cute co workers","they fired me for going ot fight in ukraine so that was wack","4.0","2025-04-27T18:28:05.467","Former employee - CRM Manager","Westlake, TX","REGULAR","next_f"
"96958223","Amazing work culture","Amazing work culture","amazing work culture and opportunities","Average age of employees is higher","5.0","2025-04-26T15:05:41.800","Current employee - Sr Manager, Data Analytics","Boston, MA","REGULAR","next_f"
"96956867","Great work life balance","Great work life balance","Culture, training, resources, work life balance, benefits","None at this time now","5.0","2025-04-26T12:42:20.383","Current employee - Customer Relationship Advocate","Smithfield, RI","REGULAR","next_f"
"96943116","Fidelity","Fidelity","Fidelity bank of america Collabera","Fidelity Investments bank of america Collabera","5.0","2025-04-25T13:30:38.320","Current employee - Senior Data Analyst","Durham, NC","REGULAR","next_f"
