review_id,title,pros,cons,rating,date,job_title,location,employmentStatus,text,us_flag,us_flag_reason
99060341,They have good working spaces,they have good working spaces,they dont increase the salary much,3.0,2025-07-30,Project Manager,"San Jose, CA",REGULAR,They have good working spaces they have good working spaces they dont increase the salary much,US,state_code:CA
99056728,OK to stay but not for long,ok to stay but not for long,low salary politics as usual,2.0,2025-07-30,Software Engineer,"New York, NY",PART_TIME,OK to stay but not for long ok to stay but not for long low salary politics as usual,US,state_code:NY
99051687,get to work on different projects and learn from experience people around,get to work on different projects and learn from experience people around,toxic culture sometimes bias else fine else fine else fine,3.0,2025-07-30,Senior Analyst,"Cleveland, OH",REGULAR,get to work on different projects and learn from experience people around get to work on different projects and learn from experience people around toxic culture sometimes bias else fine else fine else fine,US,state_code:OH
99046847,Competitive Salary Network Experience Remote Work,competitive salary network experience remote work,work life balance advancement colleagues personal connections,4.0,2025-07-30,Business process development Senior Analyst,"Arlington, VA",REGULAR,Competitive Salary Network Experience Remote Work competitive salary network experience remote work work life balance advancement colleagues personal connections,US,state_code:VA
99045057,Remote flexible lots of project options develop different skill sets,remote flexible lots of project options develop different skill sets,long projects get stagnant slow ladder climb,4.0,2025-07-30,Technology Delivery Analyst,"Austin, TX",REGULAR,Remote flexible lots of project options develop different skill sets remote flexible lots of project options develop different skill sets long projects get stagnant slow ladder climb,US,state_code:TX
99031494,Lots of tools for professional development and good work atmosphere,lots of tools for professional development and good work atmosphere,must search yourself for projects to be staffed on,5.0,2025-07-29,Business Analyst,"Berwyn, PA",REGULAR,Lots of tools for professional development and good work atmosphere lots of tools for professional development and good work atmosphere must search yourself for projects to be staffed on,US,state_code:PA
99028010,Good people and culture People are always willing to help,good people and culture people are always willing to help,limited opportunities to grow or transfer to other sectors within the company,4.0,2025-07-29,Analyst,"Washington, DC",REGULAR,Good people and culture People are always willing to help good people and culture people are always willing to help limited opportunities to grow or transfer to other sectors within the company,US,state_code:DC
99026632,can achieve anything Offers the full scope of activities that no other consultants he can offer As a result it offers a breath of career opportunities that you cannot find anywhere else,can achieve anything offers the full scope of activities that no other consultants he can offer as a result it offers a breath of career opportunities that you cannot find anywhere else,bureaucratic big and tech focused,5.0,2025-07-29,Managing Director,"San Francisco, CA",REGULAR,can achieve anything Offers the full scope of activities that no other consultants he can offer As a result it offers a breath of career opportunities that you cannot find anywhere else can achieve anything offers the full scope of activities that no other consultants he can offer as a result it offers a breath of career opportunities that you cannot find anywhere else bureaucratic big and tech focused,US,state_code:CA
99023026,Supportive team culture Clear learning paths and career development Exposure to client work and responsibilities early on,- supportive team culture - clear learning paths and career development - exposure to client work and responsibilities early on,- navigating the bench and finding new projects can be unclear at times - large company takes time to fully understand the ecosystem,5.0,2025-07-29,Management Consultant Analyst,"Los Angeles, CA",REGULAR,Supportive team culture Clear learning paths and career development Exposure to client work and responsibilities early on - supportive team culture - clear learning paths and career development - exposure to client work and responsibilities early on - navigating the bench and finding new projects can be unclear at times - large company takes time to fully understand the ecosystem,US,state_code:CA
99021071,good people when you find your crew and community,good people when you find your crew and community,bad top level leadership to work for poor strategic direction poor communication,4.0,2025-07-29,Cybersecurity Consultant,"New York, NY",REGULAR,good people when you find your crew and community good people when you find your crew and community bad top level leadership to work for poor strategic direction poor communication,US,state_code:NY
99017380,Seems like a good place to work if you are lucky enough to stay on billable projects,seems like a good place to work if you are lucky enough to stay on billable projects,accenture will keep all employees from acqusitions for one year and then they will start laying off it is on you to find billable work and even if you do everything right you may get laid off just because there are too many employees and not enough work,2.0,2025-07-29,IT Operations Analyst,"Chicago, IL",REGULAR,Seems like a good place to work if you are lucky enough to stay on billable projects seems like a good place to work if you are lucky enough to stay on billable projects accenture will keep all employees from acqusitions for one year and then they will start laying off it is on you to find billable work and even if you do everything right you may get laid off just because there are too many employees and not enough work,US,state_code:IL
99015743,Pretty good pay and benefits A lot of opportunities with the right experience Ability to travel if that s what you re into,pretty good pay and benefits a lot of opportunities with the right experience ability to travel if that's what you're into,promised a promo year 1 it's now year 4 and still at the same level coming in as an experienced hire can become a negative thing if roles in your field aren't available you are then on the bench and forced by hr to apply to any and everything within or outside your expertise if you meet a small portion of the requirements most project roles are written for someone and filled before the role is posted,3.0,2025-07-29,Senior Analyst,"Philadelphia, PA",REGULAR,Pretty good pay and benefits A lot of opportunities with the right experience Ability to travel if that s what you re into pretty good pay and benefits a lot of opportunities with the right experience ability to travel if that's what you're into promised a promo year 1 it's now year 4 and still at the same level coming in as an experienced hire can become a negative thing if roles in your field aren't available you are then on the bench and forced by hr to apply to any and everything within or outside your expertise if you meet a small portion of the requirements most project roles are written for someone and filled before the role is posted,US,state_code:PA
99007149,It s a good company to start off Great benefits Lots of PTO Offers insurance Provides additional trainings for certifications,it's a good company to start off great benefits lots of pto offers insurance provides additional trainings for certifications,no promises on promotions or raises unlike before been on the same level for the last 3 years but doing more work than ever,4.0,2025-07-28,Security Delivery Analyst,"Philadelphia, PA",REGULAR,It s a good company to start off Great benefits Lots of PTO Offers insurance Provides additional trainings for certifications it's a good company to start off great benefits lots of pto offers insurance provides additional trainings for certifications no promises on promotions or raises unlike before been on the same level for the last 3 years but doing more work than ever,US,state_code:PA
99002420,Good work life balance pleasant coworkers,good work life balance pleasant coworkers,bad for career growth imo horrible compensation for anyone hired as an apprentice,3.0,2025-07-28,Application Development Analyst,"Atlanta, GA",REGULAR,Good work life balance pleasant coworkers good work life balance pleasant coworkers bad for career growth imo horrible compensation for anyone hired as an apprentice,US,state_code:GA
98976279,Learning people culture growth remote,learning people culture growth remote,pay stagnation little project support,5.0,2025-07-27,Strategy Analyst,"Seattle, WA",REGULAR,Learning people culture growth remote learning people culture growth remote pay stagnation little project support,US,state_code:WA
98966600,All employees trained with using AI and might be good in AI literacy,all employees trained with using ai and might be good in ai literacy,getting big company and poor in skill as personal,3.0,2025-07-26,Project Manager,"Japan, PA",REGULAR,All employees trained with using AI and might be good in AI literacy all employees trained with using ai and might be good in ai literacy getting big company and poor in skill as personal,US,state_code:PA
98965400,Great work life balance and environment,great work life balance and environment,they offshored tons of jobs,4.0,2025-07-26,Operations Lead,"San Antonio, TX",REGULAR,Great work life balance and environment great work life balance and environment they offshored tons of jobs,US,state_code:TX
98952031,Opportunities are endless Longterm job,opportunities are endless longterm job,always financial constraints it s hard to move up when you re such a little person in a big company,4.0,2025-07-25,Packaged App Development Analyst,"Tampa, FL",REGULAR,Opportunities are endless Longterm job opportunities are endless longterm job always financial constraints it s hard to move up when you re such a little person in a big company,US,state_code:FL
98951710,Remote job with minimal micromanaging,remote job with minimal micromanaging,low pay no room for advancement,3.0,2025-07-25,Account Manager Support,"Lincoln, CA",REGULAR,Remote job with minimal micromanaging remote job with minimal micromanaging low pay no room for advancement,US,state_code:CA
98945853,Better than other IT consulting companies except Deloitte,better than other it consulting companies except deloitte,low pay decent insurance benefits,4.0,2025-07-25,Application Development Associate Manager,"Bentonville, AR",REGULAR,Better than other IT consulting companies except Deloitte better than other it consulting companies except deloitte low pay decent insurance benefits,US,state_code:AR
98944989,I had an amazing experience,i had an amazing experience,consulting life of being on the bench is different,5.0,2025-07-25,Senior Analyst,"Charlotte, NC",REGULAR,I had an amazing experience i had an amazing experience consulting life of being on the bench is different,US,state_code:NC
98939190,Great company and work life balance,great company and work life balance,can easily get stuck in the wrong business group and not have a way out or transfer into another division,4.0,2025-07-25,Senior Analyst,"New York, NY",REGULAR,Great company and work life balance great company and work life balance can easily get stuck in the wrong business group and not have a way out or transfer into another division,US,state_code:NY
98934589,a large variety of technology projects great network of very smart people,a large variety of technology projects great network of very smart people,confusing to understand growth path for promotions,4.0,2025-07-24,Senior Manager (Consulting),"Houston, TX",REGULAR,a large variety of technology projects great network of very smart people a large variety of technology projects great network of very smart people confusing to understand growth path for promotions,US,state_code:TX
98925933,Variety of project when available when started,variety of project when available when started,very hard to get projects in the company raise is performance based but the internal committee does not have insight to your performance at a client so a raise is difficult to get,3.0,2025-07-24,Test Engineer,"Cleveland, OH",REGULAR,Variety of project when available when started variety of project when available when started very hard to get projects in the company raise is performance based but the internal committee does not have insight to your performance at a client so a raise is difficult to get,US,state_code:OH
98923928,Remote working is available and provides good insurance,remote working is available and provides good insurance,working hours are not so great,4.0,2025-07-24,Associate Software Engineer,"New York, NY",REGULAR,Remote working is available and provides good insurance remote working is available and provides good insurance working hours are not so great,US,state_code:NY
98906308,Very easy job requires very little brain power,very easy job requires very little brain power,no growth potential hr department is sub-par,2.0,2025-07-23,CDP Analyst,"Atlanta, GA",REGULAR,Very easy job requires very little brain power very easy job requires very little brain power no growth potential hr department is sub-par,US,state_code:GA
98905898,Work from home Some benefits like the 401k match You will meet a few good people,-work from home -some benefits like the 401k match -you will meet a few good people,this is the most soulless place i have ever worked there have been no raises or promotions for more than three years despite their insistence that you perform at the next level there is no job security or career growth and if you can't magically make a project appear after 6 weeks you will be targeted and laid off additionally the culture is very 'what have you done for me lately ' and there is a high turnover rate for example i have been with the firm for over three years and more than 60 of the firm joined after me insane leadership will straight-up ghost and ignore you this is the first professional experience where leadership will just ignore you also there is no career growth i know analysts who have been held at that level for almost 6 years now you have been warned,1.0,2025-07-23,Consultant,"Austin, TX",REGULAR,Work from home Some benefits like the 401k match You will meet a few good people -work from home -some benefits like the 401k match -you will meet a few good people this is the most soulless place i have ever worked there have been no raises or promotions for more than three years despite their insistence that you perform at the next level there is no job security or career growth and if you can't magically make a project appear after 6 weeks you will be targeted and laid off additionally the culture is very 'what have you done for me lately ' and there is a high turnover rate for example i have been with the firm for over three years and more than 60 of the firm joined after me insane leadership will straight-up ghost and ignore you this is the first professional experience where leadership will just ignore you also there is no career growth i know analysts who have been held at that level for almost 6 years now you have been warned,US,state_code:TX
98905892,GREAT benefits like 401K matched percentage ESPP program Mental Health and EAP programs Family programs like caring for dependents fertility management and parental leave,great benefits like 401k matched percentage espp program mental health and eap programs family programs like caring for dependents fertility management and parental leave,-no base pay increase in years -the constant searching for your next role and the fear that you will be fired -the expectation for a senior manager makes it hard to want to stay and do the work at the sacrifice of family -no loyalty,4.0,2025-07-23,Program and Project Manager,"New York, NY",REGULAR,GREAT benefits like 401K matched percentage ESPP program Mental Health and EAP programs Family programs like caring for dependents fertility management and parental leave great benefits like 401k matched percentage espp program mental health and eap programs family programs like caring for dependents fertility management and parental leave -no base pay increase in years -the constant searching for your next role and the fear that you will be fired -the expectation for a senior manager makes it hard to want to stay and do the work at the sacrifice of family -no loyalty,US,state_code:NY
98899976,Learned a lot and worked with wonderful people,learned a lot and worked with wonderful people,they worked us a lot hours and didn't pay us very well compared to what they were billing us out at,4.0,2025-07-23,Consultant,"Minneapolis, MN",REGULAR,Learned a lot and worked with wonderful people learned a lot and worked with wonderful people they worked us a lot hours and didn't pay us very well compared to what they were billing us out at,US,state_code:MN
98899569,Great People Teams and Leaders prioritize wellness,- great people - teams and leaders prioritize wellness,- misaligned incentives for strategy lead to slow and long engagements - pay is sub-par,4.0,2025-07-23,Senior Strategy Consultant,"Chicago, IL",REGULAR,Great People Teams and Leaders prioritize wellness - great people - teams and leaders prioritize wellness - misaligned incentives for strategy lead to slow and long engagements - pay is sub-par,US,state_code:IL
98896283,Diverse project experince If you are lucky,diverse project experince if you are lucky,terrible growth oppurtunity not recgonized for work ethic constantly having to enagage in extra non-value plus ones,1.0,2025-07-23,Associate Manager,"Columbus, OH",REGULAR,Diverse project experince If you are lucky diverse project experince if you are lucky terrible growth oppurtunity not recgonized for work ethic constantly having to enagage in extra non-value plus ones,US,state_code:OH
98888362,Exciting and fast paced culture with a lot of very smart people,exciting and fast paced culture with a lot of very smart people,lots of busy work that might not be entirely meaningful,3.0,,Marketing Associate Director,"New York, NY",REGULAR,Exciting and fast paced culture with a lot of very smart people exciting and fast paced culture with a lot of very smart people lots of busy work that might not be entirely meaningful,US,state_code:NY
98878147,portal and internal tech is nice Benefits of a design org inside,portal and internal tech is nice benefits of a design org inside,promo slots can be limited,5.0,2025-07-22,Data Scientist,"Boston, MA",REGULAR,portal and internal tech is nice Benefits of a design org inside portal and internal tech is nice benefits of a design org inside promo slots can be limited,US,state_code:MA
98876609,A lot of good people that I worked with Multiple opportunities if you know where to look,a lot of good people that i worked with multiple opportunities if you know where to look,always changing the policies hard to keep up,4.0,2025-07-22,Gvt Data Compliance Associate Manager,"Arlington, VA",REGULAR,A lot of good people that I worked with Multiple opportunities if you know where to look a lot of good people that i worked with multiple opportunities if you know where to look always changing the policies hard to keep up,US,state_code:VA
98874607,Support from a lot of different areas,support from a lot of different areas,not enough work for everyone,5.0,2025-07-22,Sernior Business Analyst,"San Francisco, CA",REGULAR,Support from a lot of different areas support from a lot of different areas not enough work for everyone,US,state_code:CA
98873271,Fun team Cool environment Cool products,fun team cool environment cool products,bad management accenture did not listen,2.0,2025-07-22,ECommerce Manager,"Hollywood, FL",REGULAR,Fun team Cool environment Cool products fun team cool environment cool products bad management accenture did not listen,US,state_code:FL
98858772,No micromanagement work from home great people flexibility,no micromanagement work from home great people flexibility,no growth opportunity or pay increases in over 4 years the business does not seem to care about recruiting a lot of politics countless layoffs no one feels secure in their job they just rolled back on all dei measures,3.0,2025-07-22,Recruiter,"Philadelphia, PA",REGULAR,No micromanagement work from home great people flexibility no micromanagement work from home great people flexibility no growth opportunity or pay increases in over 4 years the business does not seem to care about recruiting a lot of politics countless layoffs no one feels secure in their job they just rolled back on all dei measures,US,state_code:PA
98852088,Good Management in the US office,good management in the us office,pay is less when compared to us peers,3.0,2025-07-21,Team Lead,"Dallas, TX",REGULAR,Good Management in the US office good management in the us office pay is less when compared to us peers,US,state_code:TX
98851189,Good culture Many opportunities Challenging work,good culture many opportunities challenging work,no pay raises and low bonuses even for top performers,5.0,2025-07-21,Senior Manager,"Los Angeles, CA",REGULAR,Good culture Many opportunities Challenging work good culture many opportunities challenging work no pay raises and low bonuses even for top performers,US,state_code:CA
98846612,Flexible Nice people Challenging Projects,flexible nice people challenging projects,no culture at all prioritizing the wrong things,2.0,2025-07-21,Senior Director,"Alabama, NY",REGULAR,Flexible Nice people Challenging Projects flexible nice people challenging projects no culture at all prioritizing the wrong things,US,state_code:NY
98846347,People are very smart and hardworking,people are very smart and hardworking,wish we d stayed true er to who we said we are as a company and hadn t abandoned our goals of leadership diversity,3.0,2025-07-21,Associate Director,"Raleigh, NC",REGULAR,People are very smart and hardworking people are very smart and hardworking wish we d stayed true er to who we said we are as a company and hadn t abandoned our goals of leadership diversity,US,state_code:NC
98842217,It is a good company to work for,it is a good company to work for,i have enjoyed working with accenture so no cons,5.0,2025-07-21,IT Infrastructure Manager,"Phoenix, AZ",REGULAR,It is a good company to work for it is a good company to work for i have enjoyed working with accenture so no cons,US,state_code:AZ
98836959,Cool offices Decent base pay You ll likely work with some very smart very talented people,- cool offices - decent base pay - you ll likely work with some very smart very talented people,- to big to have culture - no real path for growth huge backlog of people waiting to get promoted promotion path is convoluted and tedious - apparently non-believers in menial raises,3.0,2025-07-21,Senior Experience Designer,"Minneapolis, MN",REGULAR,Cool offices Decent base pay You ll likely work with some very smart very talented people - cool offices - decent base pay - you ll likely work with some very smart very talented people - to big to have culture - no real path for growth huge backlog of people waiting to get promoted promotion path is convoluted and tedious - apparently non-believers in menial raises,US,state_code:MN
98835362,Fast promotions from within as long as you take on a bunch of plus 1 s outside of your client work,fast promotions from within as long as you take on a bunch of plus 1's outside of your client work,a lot of tools are accenture specific and don't translate over to other job opportunities outside of the company,3.0,2025-07-21,PMO Team Lead,"Nashville, TN",REGULAR,Fast promotions from within as long as you take on a bunch of plus 1 s outside of your client work fast promotions from within as long as you take on a bunch of plus 1's outside of your client work a lot of tools are accenture specific and don't translate over to other job opportunities outside of the company,US,state_code:TN
98818104,Pays well Mainly remote A lot of opportunities,pays well mainly remote a lot of opportunities,large company and it is hard to feel connected to coworkers no promotions within past 2 years,3.0,2025-07-20,Business Architecture Specialist,"Houston, TX",REGULAR,Pays well Mainly remote A lot of opportunities pays well mainly remote a lot of opportunities large company and it is hard to feel connected to coworkers no promotions within past 2 years,US,state_code:TX
98802403,Nice leadership wonderful benefits a lot of free meal,nice leadership wonderful benefits a lot of free meal,too much projects from gov slow pace,4.0,2025-07-19,Software Engineer,"San Antonio, TX",REGULAR,Nice leadership wonderful benefits a lot of free meal nice leadership wonderful benefits a lot of free meal too much projects from gov slow pace,US,state_code:TX
98792034,Lots of tools to grow your skill sets Great networking opportunities,lots of tools to grow your skill sets great networking opportunities,management is disorganized and picks favorites for project staffing,2.0,2025-07-18,Senior Consultant,"Chicago, IL",REGULAR,Lots of tools to grow your skill sets Great networking opportunities lots of tools to grow your skill sets great networking opportunities management is disorganized and picks favorites for project staffing,US,state_code:IL
