review_id,title,pros,cons,rating,date,job_title,location,employmentStatus,text,us_flag,us_flag_reason
96263024,Exposure to Diverse Projects The breadth of industries and clients provided strong foundational learning Structured Approach Clear frameworks methodologies and access to global best practices enhanced problem solving skills Strong Team Culture Colleagues were collaborative and supportive creating a positive work environment Brand Name amp Network Having Accenture on my resume opened doors and expanded my professional network,exposure to diverse projects the breadth of industries and clients provided strong foundational learning structured approach clear frameworks methodologies and access to global best practices enhanced problem-solving skills strong team culture colleagues were collaborative and supportive creating a positive work environment brand name network having accenture on my resume opened doors and expanded my professional network,lack of deep specialization rotating across projects meant broad exposure but limited depth in any one area process overload too much emphasis on rigid methodologies sometimes stifled creativity and agility limited autonomy decision-making power was often centralized at senior levels leaving little room for individual impact work-life balance challenges long hours and demanding deadlines made sustainable work-life balance difficult,3.0,2025-03-29,Analyst,"New York, NY",REGULAR,Exposure to Diverse Projects The breadth of industries and clients provided strong foundational learning Structured Approach Clear frameworks methodologies and access to global best practices enhanced problem solving skills Strong Team Culture Colleagues were collaborative and supportive creating a positive work environment Brand Name amp Network Having Accenture on my resume opened doors and expanded my professional network exposure to diverse projects the breadth of industries and clients provided strong foundational learning structured approach clear frameworks methodologies and access to global best practices enhanced problem-solving skills strong team culture colleagues were collaborative and supportive creating a positive work environment brand name network having accenture on my resume opened doors and expanded my professional network lack of deep specialization rotating across projects meant broad exposure but limited depth in any one area process overload too much emphasis on rigid methodologies sometimes stifled creativity and agility limited autonomy decision-making power was often centralized at senior levels leaving little room for individual impact work-life balance challenges long hours and demanding deadlines made sustainable work-life balance difficult,US,state_code:NY
96246201,Tiring work hours but it was ok,tiring work hours but it was ok,management can be erratic politics,3.0,2025-03-28,Consultant,"Texas City, TX",REGULAR,Tiring work hours but it was ok tiring work hours but it was ok management can be erratic politics,US,state_code:TX
96245182,good coworkers and relaxed environment,good coworkers and relaxed environment,no pay raise in the three years working there,5.0,2025-03-28,Customer Service Representative,"Chicago, IL",REGULAR,good coworkers and relaxed environment good coworkers and relaxed environment no pay raise in the three years working there,US,state_code:IL
96244662,It develops the people and there are many areas of opportunity,it develops the people and there are many areas of opportunity,it all depends on the availability of projects,4.0,2025-03-28,Manager,"Houston, TX",REGULAR,It develops the people and there are many areas of opportunity it develops the people and there are many areas of opportunity it all depends on the availability of projects,US,state_code:TX
96236118,Every Role they gave me was something I d never really done before so it was a great learning experience,every role they gave me was something i'd never really done before so it was a great learning experience,challenging markets led them to prioritize other ventures besides raises bonuses and promotions they let one no name negative review mean so much more than 30 other positive reviews,2.0,2025-03-28,Management Consultant,"Houston, TX",REGULAR,Every Role they gave me was something I d never really done before so it was a great learning experience every role they gave me was something i'd never really done before so it was a great learning experience challenging markets led them to prioritize other ventures besides raises bonuses and promotions they let one no name negative review mean so much more than 30 other positive reviews,US,state_code:TX
96225496,everyone is nice Working here was not hard,everyone is nice working here was not hard,got laid off with no reason,5.0,2025-03-27,Content Moderator,"Austin, TX",REGULAR,everyone is nice Working here was not hard everyone is nice working here was not hard got laid off with no reason,US,state_code:TX
96224899,Mainly remote Some projects are easier than others,mainly remote some projects are easier than others,some projects will have you working super long hours,5.0,2025-03-27,Management Consultant,"Atlanta, GA",REGULAR,Mainly remote Some projects are easier than others mainly remote some projects are easier than others some projects will have you working super long hours,US,state_code:GA
96224587,Tons of opportunities with some of the smartest people I ve ever met,tons of opportunities with some of the smartest people i've ever met,fairly cutthroat environment sometimes you're competing with your coworkers for projects some of the leadership can be pretty toxic,4.0,2025-03-27,Senior Principal Consultant,"San Francisco, CA",REGULAR,Tons of opportunities with some of the smartest people I ve ever met tons of opportunities with some of the smartest people i've ever met fairly cutthroat environment sometimes you're competing with your coworkers for projects some of the leadership can be pretty toxic,US,state_code:CA
96222738,Good company Good benefits Good people,good company good benefits good people,way too large it's impossible to know everyone,3.0,2025-03-27,"Director, Construction Management","Irvine, CA",REGULAR,Good company Good benefits Good people good company good benefits good people way too large it's impossible to know everyone,US,state_code:CA
96220737,Lots of room for growth learning and they push upskilling HARD If you have a question you have multiple people you can talk to Very inclusive easy place to work and get along,lots of room for growth learning and they push upskilling hard if you have a question you have multiple people you can talk to very inclusive easy place to work and get along,hard to get staffed onto projects poor system overall makes you compete with every other employee for roles the expectation is that you not only apply for these roles you're expected to message the job poster and pester them until they tell you the spot is filled they put an emphasis on 'networking' which means most spots are filled based on who you know and other applicants are ignored,4.0,2025-03-27,Package Application Development Associate,"Missouri City, MO",REGULAR,Lots of room for growth learning and they push upskilling HARD If you have a question you have multiple people you can talk to Very inclusive easy place to work and get along lots of room for growth learning and they push upskilling hard if you have a question you have multiple people you can talk to very inclusive easy place to work and get along hard to get staffed onto projects poor system overall makes you compete with every other employee for roles the expectation is that you not only apply for these roles you're expected to message the job poster and pester them until they tell you the spot is filled they put an emphasis on 'networking' which means most spots are filled based on who you know and other applicants are ignored,US,state_code:MO
96215846,Great company with amazing employees,great company with amazing employees,room for growth is limited,4.0,2025-03-27,Project Manager,"Berwyn, PA",REGULAR,Great company with amazing employees great company with amazing employees room for growth is limited,US,state_code:PA
96213180,The people I worked with were amazing The work was interesting and always changing because of the different industries Accenture is involved with,the people i worked with were amazing the work was interesting and always changing because of the different industries accenture is involved with,i feel like after my time with accenture i noticed that my pay was very below the average for an instructional designer,3.0,2025-03-27,Instructional Designer,"San Antonio, TX",REGULAR,The people I worked with were amazing The work was interesting and always changing because of the different industries Accenture is involved with the people i worked with were amazing the work was interesting and always changing because of the different industries accenture is involved with i feel like after my time with accenture i noticed that my pay was very below the average for an instructional designer,US,state_code:TX
96211476,Was high pay and flexible schedule sometimes,was high pay and flexible schedule sometimes,do not recommend toxic culture,2.0,2025-03-27,Manager,"Houston, TX",REGULAR,Was high pay and flexible schedule sometimes was high pay and flexible schedule sometimes do not recommend toxic culture,US,state_code:TX
96210633,eh not the best treatment of employees,eh not the best treatment of employees,no pay bumps for over two years,3.0,2025-03-27,Deal Structuring Specialist,"Philadelphia, PA",REGULAR,eh not the best treatment of employees eh not the best treatment of employees no pay bumps for over two years,US,state_code:PA
96203905,Lots of opportunity to work on interesting projects in various industries You can stay in one industry or function to gain expertise or you can move around and support various ones depending on your interests Large company with lots of resources allows you to get creative and develop new solutions to client problems The large scale can help you to find and implement solutions that some smaller firms may not be able to replicate Most people you work with are good to work with there are some knuckleheads as with any organization but most people I have worked with for the last 5 years have been alright,lots of opportunity to work on interesting projects in various industries you can stay in one industry or function to gain expertise or you can move around and support various ones depending on your interests large company with lots of resources allows you to get creative and develop new solutions to client problems the large scale can help you to find and implement solutions that some smaller firms may not be able to replicate most people you work with are good to work with - there are some knuckleheads as with any organization - but most people i have worked with for the last 5 years have been alright,each individual is in charge of finding their own projects so if business slows down as it is doing in q1 2025 and you can't find a project then you get performanced out even though you are a good contributor company size has large overhead which can become cumbersome when trying to sell deals - essentially if a potential deal isn't large or profitable enough then leadership won't approve - so we end up walking away from good projects base pay has not increased for a significant number of non-director people for 2 going on 3 years which has had significant impact on attrition and morale to be fair some executives have also taken some hits due to the economy but the ceo tc going from 32m usd in 2023 to 25 in 2024 does not feel like much of a belt tightening to us normal people,4.0,2025-03-27,Manager,"Houston, TX",REGULAR,Lots of opportunity to work on interesting projects in various industries You can stay in one industry or function to gain expertise or you can move around and support various ones depending on your interests Large company with lots of resources allows you to get creative and develop new solutions to client problems The large scale can help you to find and implement solutions that some smaller firms may not be able to replicate Most people you work with are good to work with there are some knuckleheads as with any organization but most people I have worked with for the last 5 years have been alright lots of opportunity to work on interesting projects in various industries you can stay in one industry or function to gain expertise or you can move around and support various ones depending on your interests large company with lots of resources allows you to get creative and develop new solutions to client problems the large scale can help you to find and implement solutions that some smaller firms may not be able to replicate most people you work with are good to work with - there are some knuckleheads as with any organization - but most people i have worked with for the last 5 years have been alright each individual is in charge of finding their own projects so if business slows down as it is doing in q1 2025 and you can't find a project then you get performanced out even though you are a good contributor company size has large overhead which can become cumbersome when trying to sell deals - essentially if a potential deal isn't large or profitable enough then leadership won't approve - so we end up walking away from good projects base pay has not increased for a significant number of non-director people for 2 going on 3 years which has had significant impact on attrition and morale to be fair some executives have also taken some hits due to the economy but the ceo tc going from 32m usd in 2023 to 25 in 2024 does not feel like much of a belt tightening to us normal people,US,state_code:TX
96201470,Good benefits Good team Decent equipment They work hard to give you up to date technology When your contract ends Accenture gives you 4 weeks fully paid to find a new role internal or external is okay If you don t find an internal role they will pay you a 2 week severance plus unused vacation Very generous,good benefits good team decent equipment they work hard to give you up to date technology when your contract ends accenture gives you 4 weeks fully paid to find a new role internal or external is okay if you don't find an internal role they will pay you a 2 week severance plus unused vacation very generous,at any job your manager can make or break your experience at accenture much of the work is contract driven so the client can eliminate the contract leaving you without work they are weirdly structured on internal talent rate like 1-11 levels considering the wide range of roles and talent and discourage moving more than one level off where you last worked,5.0,2025-03-27,Senior Customer Success Manager (CSM),"Atlanta, GA",REGULAR,Good benefits Good team Decent equipment They work hard to give you up to date technology When your contract ends Accenture gives you 4 weeks fully paid to find a new role internal or external is okay If you don t find an internal role they will pay you a 2 week severance plus unused vacation Very generous good benefits good team decent equipment they work hard to give you up to date technology when your contract ends accenture gives you 4 weeks fully paid to find a new role internal or external is okay if you don't find an internal role they will pay you a 2 week severance plus unused vacation very generous at any job your manager can make or break your experience at accenture much of the work is contract driven so the client can eliminate the contract leaving you without work they are weirdly structured on internal talent rate like 1-11 levels considering the wide range of roles and talent and discourage moving more than one level off where you last worked,US,state_code:GA
96201380,great place to work a lot,great place to work a lot,everything is dependent on the project,5.0,2025-03-27,Manager,"Chicago, IL",REGULAR,great place to work a lot great place to work a lot everything is dependent on the project,US,state_code:IL
96186831,Only in the office every other day,only in the office every other day,no leadership no clear direction no training too many changes,2.0,2025-03-26,Microsoft Solution Advisor,"Atlanta, GA",REGULAR,Only in the office every other day only in the office every other day no leadership no clear direction no training too many changes,US,state_code:GA
96185806,Large company lots of opportunities A lot of ways to advance up in your career Can work from home,large company lots of opportunities a lot of ways to advance up in your career can work from home,large company so has that large company feel where you can be just a number,4.0,2025-03-26,Sales Associate,"Minneapolis, MN",REGULAR,Large company lots of opportunities A lot of ways to advance up in your career Can work from home large company lots of opportunities a lot of ways to advance up in your career can work from home large company so has that large company feel where you can be just a number,US,state_code:MN
96183539,Career and network exposure is great Accenture has an expansive global headcount,career and network exposure is great - accenture has an expansive global headcount,to land projects you must network and can be a heavy workload at times,4.0,2025-03-26,Senior Strategy Analyst,"Houston, TX",REGULAR,Career and network exposure is great Accenture has an expansive global headcount career and network exposure is great - accenture has an expansive global headcount to land projects you must network and can be a heavy workload at times,US,state_code:TX
96181102,Great company culture Offers a variety of projects Plenty of learning opportunities,great company culture offers a variety of projects plenty of learning opportunities,very big company could be tough to get projects without a network,5.0,2025-03-26,Management,"Atlanta, GA",REGULAR,Great company culture Offers a variety of projects Plenty of learning opportunities great company culture offers a variety of projects plenty of learning opportunities very big company could be tough to get projects without a network,US,state_code:GA
96180138,Benefits free certifications nice offices,benefits free certifications nice offices,outdated local leadership performance review process biased and sucks,3.0,2025-03-26,Packaged App Development Analyst,"Atlanta, GA",REGULAR,Benefits free certifications nice offices benefits free certifications nice offices outdated local leadership performance review process biased and sucks,US,state_code:GA
96176696,Massive scope of divisions etc and places to grow into or transfer into Brand recognition and trust with Fortune 500 decent benefits and networking opportunities Can make lots of impact when relationshipped into the CALs and CLient Account Team,massive scope of divisions etc and places to grow into or transfer into brand recognition and trust with fortune 500 decent benefits and networking opportunities can make lots of impact when relationshipped into the cals and client account team,at a certain level you need to be an md or have an md power sponsor to make progress faster md status is king,5.0,2025-03-26,Global Lead,"Denver, CO",REGULAR,Massive scope of divisions etc and places to grow into or transfer into Brand recognition and trust with Fortune 500 decent benefits and networking opportunities Can make lots of impact when relationshipped into the CALs and CLient Account Team massive scope of divisions etc and places to grow into or transfer into brand recognition and trust with fortune 500 decent benefits and networking opportunities can make lots of impact when relationshipped into the cals and client account team at a certain level you need to be an md or have an md power sponsor to make progress faster md status is king,US,state_code:CO
96173837,Great people to work with,great people to work with,leadership is not transparent enough,4.0,2025-03-26,Associate Manager,"Dallas, TX",REGULAR,Great people to work with great people to work with leadership is not transparent enough,US,state_code:TX
96153506,Starter Pay from college is very nice Benefits Training and Certifications are top tier some even have free exams such as AWS Nice range of experiences around different industries,- starter pay from college is very nice - benefits - training and certifications are top tier some even have free exams such as aws - nice range of experiences around different industries,- purpose in company gets lost very quickly - just because you have the job at acn doesn t mean you have the project you want - social ecosystem is very toxic and management has no plan of changing it,3.0,2025-03-25,Advanced App Engineering Analyst,"Dallas, TX",REGULAR,Starter Pay from college is very nice Benefits Training and Certifications are top tier some even have free exams such as AWS Nice range of experiences around different industries - starter pay from college is very nice - benefits - training and certifications are top tier some even have free exams such as aws - nice range of experiences around different industries - purpose in company gets lost very quickly - just because you have the job at acn doesn t mean you have the project you want - social ecosystem is very toxic and management has no plan of changing it,US,state_code:TX
96145598,Professional Environment and well transport service,professional environment and well transport service,political people and no perfect job based on your skills,5.0,2025-03-25,Assistant Software Engineer (ASE),"Indiana, PA",REGULAR,Professional Environment and well transport service professional environment and well transport service political people and no perfect job based on your skills,US,state_code:PA
