review_id,title,pros,cons,rating,date,job_title,location,employmentStatus,text,us_flag,us_flag_reason
97632263,The sky is the limit on what you can learn in any technical subject easily expanding on role development Leadership is easy to speak to and open to discussions on career progression industry changes and knowledge shares The books of work are diverse and so there are lots of opportunities to try out lots of personal interests Their community presence is strong and they care a lot about their employee s health and happiness working hard to provide positive work live balance and opportunity for family support and care as well as consideration for DEI opportunities Finally it s a huge company but feels like a small business,the sky is the limit on what you can learn in any technical subject easily expanding on role development leadership is easy to speak to and open to discussions on career progression industry changes and knowledge shares the books of work are diverse and so there are lots of opportunities to try out lots of personal interests their community presence is strong and they care a lot about their employee's health and happiness working hard to provide positive work live balance and opportunity for family support and care as well as consideration for dei opportunities finally it's a huge company but feels like a small business,it can be hard to change or connect to new industries if aligned to a specific org structure like accenture operations vs accenture song you are responsible for making your own success while you will be assigned a people lead and hr representative you are responsible to be sure you complete your trainings advance your own skills and specializations and keep your profile up to date if you want to be considered for future opportunities when it comes to finding a new role you may be on your own searching in the accenture linkedin like eco system to find your next role that can feel daunting for those that may not be comfortable with that process of networking and hunting and who may not have tracked their experiences and skills in the systems provided,5.0,2025-05-27,Program and Project Management Associate,"Redmond, WA",REGULAR,The sky is the limit on what you can learn in any technical subject easily expanding on role development Leadership is easy to speak to and open to discussions on career progression industry changes and knowledge shares The books of work are diverse and so there are lots of opportunities to try out lots of personal interests Their community presence is strong and they care a lot about their employee s health and happiness working hard to provide positive work live balance and opportunity for family support and care as well as consideration for DEI opportunities Finally it s a huge company but feels like a small business the sky is the limit on what you can learn in any technical subject easily expanding on role development leadership is easy to speak to and open to discussions on career progression industry changes and knowledge shares the books of work are diverse and so there are lots of opportunities to try out lots of personal interests their community presence is strong and they care a lot about their employee's health and happiness working hard to provide positive work live balance and opportunity for family support and care as well as consideration for dei opportunities finally it's a huge company but feels like a small business it can be hard to change or connect to new industries if aligned to a specific org structure like accenture operations vs accenture song you are responsible for making your own success while you will be assigned a people lead and hr representative you are responsible to be sure you complete your trainings advance your own skills and specializations and keep your profile up to date if you want to be considered for future opportunities when it comes to finding a new role you may be on your own searching in the accenture linkedin like eco system to find your next role that can feel daunting for those that may not be comfortable with that process of networking and hunting and who may not have tracked their experiences and skills in the systems provided,US,state_code:WA
97605648,wonderful colleagues focus on people engagement positive culture,wonderful colleagues focus on people engagement positive culture,challenging because you do have to prove yourself every day,5.0,2025-05-26,Senior Manager,"Atlanta, GA",REGULAR,wonderful colleagues focus on people engagement positive culture wonderful colleagues focus on people engagement positive culture challenging because you do have to prove yourself every day,US,state_code:GA
97591925,Flexible time work from home,flexible time work from home,almost everything low pay no benefit,1.0,2025-05-25,Marketing,"San Francisco, CA",PART_TIME,Flexible time work from home flexible time work from home almost everything low pay no benefit,US,state_code:CA
97584344,Liberty to choose projects and tasks,liberty to choose projects and tasks,pay could be increased by a bit,5.0,2025-05-25,Application Development Senior Analyst,"Chicago, IL",REGULAR,Liberty to choose projects and tasks liberty to choose projects and tasks pay could be increased by a bit,US,state_code:IL
97583520,Good work life balance salary,good work life balance salary,nothing that i can think of,5.0,2025-05-25,Software Engineer,"Indianapolis, IN",REGULAR,Good work life balance salary good work life balance salary nothing that i can think of,US,state_code:IN
97581614,good study latest technology vacation,good study latest technology vacation,no that much of within job,3.0,2025-05-25,Sotware Engineer,"Chicago, IL",REGULAR,good study latest technology vacation good study latest technology vacation no that much of within job,US,state_code:IL
97558430,Great benefits Very organized and established Learn a lot cool to see how other companies work,- great benefits - very organized and established - learn a lot cool to see how other companies work,cannot think of any i have had a fantastic experience working here,5.0,2025-05-23,Senior Consultant,"Boston, MA",REGULAR,Great benefits Very organized and established Learn a lot cool to see how other companies work - great benefits - very organized and established - learn a lot cool to see how other companies work cannot think of any i have had a fantastic experience working here,US,state_code:MA
97550819,The people are smart professional caring and visionaries The total benefits package is strong 6 dollar for dollar 401k match multiple medical plans to choose from Stunning office spaces usually multiple floors in each cities most sought after areas snacks and beverages on every floor beautiful private bathrooms for every sexual orientation mother room s wellness spaces tons of training and learning opportunities,the people are smart professional caring and visionaries the total benefits package is strong 6 dollar for dollar 401k match multiple medical plans to choose from stunning office spaces usually multiple floors in each cities most sought after areas snacks and beverages on every floor beautiful private bathrooms for every sexual orientation mother room's wellness spaces tons of training and learning opportunities,food choices have become unhealthful but there's a bodega with smart choices for a discount price the massive layoffs weren't handled well but they aren't the only ones facing this hard time,4.0,2025-05-23,Unknown role,"New York, NY",REGULAR,The people are smart professional caring and visionaries The total benefits package is strong 6 dollar for dollar 401k match multiple medical plans to choose from Stunning office spaces usually multiple floors in each cities most sought after areas snacks and beverages on every floor beautiful private bathrooms for every sexual orientation mother room s wellness spaces tons of training and learning opportunities the people are smart professional caring and visionaries the total benefits package is strong 6 dollar for dollar 401k match multiple medical plans to choose from stunning office spaces usually multiple floors in each cities most sought after areas snacks and beverages on every floor beautiful private bathrooms for every sexual orientation mother room's wellness spaces tons of training and learning opportunities food choices have become unhealthful but there's a bodega with smart choices for a discount price the massive layoffs weren't handled well but they aren't the only ones facing this hard time,US,state_code:NY
97540198,Salary benefits work remotely and trainings available,salary benefits work remotely and trainings available,lack of leadership and career development,3.0,2025-05-22,Program and Project Management Manager,"Sacramento, CA",REGULAR,Salary benefits work remotely and trainings available salary benefits work remotely and trainings available lack of leadership and career development,US,state_code:CA
97523221,Communicating with other analysts in different locations being able to switch to federal services,communicating with other analysts in different locations being able to switch to federal services,long hours not many projects available for junior staff sme's not very helpful,1.0,2025-05-22,Scientific Informatics Analyst,"Orlando, FL",REGULAR,Communicating with other analysts in different locations being able to switch to federal services communicating with other analysts in different locations being able to switch to federal services long hours not many projects available for junior staff sme's not very helpful,US,state_code:FL
97516004,Experience was really good and got to learn a lot,experience was really good and got to learn a lot,no cons and everything went smoothly in this company,5.0,2025-05-21,Software Consultant,"Albany, NY",REGULAR,Experience was really good and got to learn a lot experience was really good and got to learn a lot no cons and everything went smoothly in this company,US,state_code:NY
97515679,Work life balance support benefit perks pto,work life balance support benefit perks pto,salary bebefit pto work life balance support,4.0,2025-05-21,Data Analyst,"Arlington, VA",REGULAR,Work life balance support benefit perks pto work life balance support benefit perks pto salary bebefit pto work life balance support,US,state_code:VA
97511765,Good first job and you learn alot,good first job and you learn alot,demanding at times and need to find own projects,5.0,2025-05-21,Consulting Analyst,"Chicago, IL",REGULAR,Good first job and you learn alot good first job and you learn alot demanding at times and need to find own projects,US,state_code:IL
97511376,There were a lot of women tech leads I always felt normal as a female employee something my female friends at other companies said was not the industry norm They gave me opportunities to learn and respected my work and suggestions,there were a lot of women tech leads i always felt normal as a female employee - something my female friends at other companies said was not the industry norm they gave me opportunities to learn and respected my work and suggestions,there have been layoffs more recently it's a hard time,5.0,2025-05-21,Senior Software Engineer,"Florham Park, NJ",REGULAR,There were a lot of women tech leads I always felt normal as a female employee something my female friends at other companies said was not the industry norm They gave me opportunities to learn and respected my work and suggestions there were a lot of women tech leads i always felt normal as a female employee - something my female friends at other companies said was not the industry norm they gave me opportunities to learn and respected my work and suggestions there have been layoffs more recently it's a hard time,US,state_code:NJ
97504323,Top tier level of clients to support Great health insurance,top tier level of clients to support great health insurance,number not a person projects took forever to complete only to get eliminated in the end,3.0,2025-05-21,Associate Marketing Manager,"Bentonville, AR",REGULAR,Top tier level of clients to support Great health insurance top tier level of clients to support great health insurance number not a person projects took forever to complete only to get eliminated in the end,US,state_code:AR
97502508,Great work life balance Initial starting pay is good,great work life balance initial starting pay is good,no promotions or pay raises in years not just for me but for the majority of all accenture employees,4.0,2025-05-21,Applications Developer Analyst,"Tampa, FL",REGULAR,Great work life balance Initial starting pay is good great work life balance initial starting pay is good no promotions or pay raises in years not just for me but for the majority of all accenture employees,US,state_code:FL
97500970,Great people and projects Good brand for tech consulting,great people and projects good brand for tech consulting,stick trading sideways resulting in limited promotions since 2022,4.0,2025-05-21,Associate Manager,"New York, NY",REGULAR,Great people and projects Good brand for tech consulting great people and projects good brand for tech consulting stick trading sideways resulting in limited promotions since 2022,US,state_code:NY
97484933,None this place is super toxic,none this place is super toxic,run as fast as you can and don't look back,2.0,2025-05-20,Advanced Applications Engineering Analyst,"Austin, TX",REGULAR,None this place is super toxic none this place is super toxic run as fast as you can and don't look back,US,state_code:TX
97482608,Good benefits Ample vacation Decent pay,good benefits ample vacation decent pay,you just a number lack of direction in leadership it matters who you know,2.0,2025-05-20,Director,"Detroit, MI",REGULAR,Good benefits Ample vacation Decent pay good benefits ample vacation decent pay you just a number lack of direction in leadership it matters who you know,US,state_code:MI
97480306,Flexibility with the luxury to wfh whenever and decent people,flexibility with the luxury to wfh whenever and decent people,everything else we haven t gotten salary increases in years bonuses are down they have hundreds of thousands of people in the backlog for promotions that will come 5 years too late leadership is horrible especially ceo,1.0,2025-05-20,Associate Manager,"Chicago, IL",REGULAR,Flexibility with the luxury to wfh whenever and decent people flexibility with the luxury to wfh whenever and decent people everything else we haven t gotten salary increases in years bonuses are down they have hundreds of thousands of people in the backlog for promotions that will come 5 years too late leadership is horrible especially ceo,US,state_code:IL
97477592,Love the people and the culture That being said,love the people and the culture that being said,no raises in 3 years sales people lauded those of us who are not in a sales are not valued,2.0,2025-05-20,Senior Account Manager/Senior Contract Manager,"San Francisco, CA",REGULAR,Love the people and the culture That being said love the people and the culture that being said no raises in 3 years sales people lauded those of us who are not in a sales are not valued,US,state_code:CA
97455046,Accentures benefits are strong and depending on your project the work life balance can be decent,accentures benefits are strong and depending on your project the work life balance can be decent,moving up has been a challenge in the last few years due to promotion limits,4.0,2025-05-19,Business Advisory Associate Manager,"Chicago, IL",REGULAR,Accentures benefits are strong and depending on your project the work life balance can be decent accentures benefits are strong and depending on your project the work life balance can be decent moving up has been a challenge in the last few years due to promotion limits,US,state_code:IL
97454601,Very high highs to put things in a nutshell 50K salary increase in 5 years,very high highs to put things in a nutshell 50k salary increase in 5 years,very low lows terrible hours lots of uncertainty and very unstructured,2.0,2025-05-19,Management Consultant,"Boston, MA",REGULAR,Very high highs to put things in a nutshell 50K salary increase in 5 years very high highs to put things in a nutshell 50k salary increase in 5 years very low lows terrible hours lots of uncertainty and very unstructured,US,state_code:MA
97451636,pro was the ability to get certs,pro was the ability to get certs,con is whats happening in the government,4.0,2025-05-19,Business Analyst,"Washington, DC",REGULAR,pro was the ability to get certs pro was the ability to get certs con is whats happening in the government,US,state_code:DC
97451232,Work life balance is better,work life balance is better,salary is less when compared to others,4.0,2025-05-19,Program and Project Management Manager,"Charlotte, NC",REGULAR,Work life balance is better work life balance is better salary is less when compared to others,US,state_code:NC
97444858,Great facility and location Onsite workplace is very modern,great facility and location onsite workplace is very modern,extremely cliquish management very shady hr hr is there for the companies benefit not the employees,2.0,2025-05-19,Team Lead,"Tennessee City, TN",REGULAR,Great facility and location Onsite workplace is very modern great facility and location onsite workplace is very modern extremely cliquish management very shady hr hr is there for the companies benefit not the employees,US,state_code:TN
97442067,Good learning experiences across different projects Good upskilling opportunities,good learning experiences across different projects good upskilling opportunities,horrible hierarchy and structure no pay raises in two years despite record inflation and record profits,1.0,2025-05-19,Technology Architecture Analyst,"New York, NY",REGULAR,Good learning experiences across different projects Good upskilling opportunities good learning experiences across different projects good upskilling opportunities horrible hierarchy and structure no pay raises in two years despite record inflation and record profits,US,state_code:NY
97427776,Nice people sometimes interesting projects,nice people sometimes interesting projects,no raise or promotion for 3 years not even to keep up with inflation leadership doesn't treat each individual as a person but more of a number,3.0,2025-05-18,Consulting Manager,"Washington, DC",REGULAR,Nice people sometimes interesting projects nice people sometimes interesting projects no raise or promotion for 3 years not even to keep up with inflation leadership doesn't treat each individual as a person but more of a number,US,state_code:DC
97424411,One of the biggest advantages of flexible work at Accenture is the freedom to choose where and when you work This autonomy often leads to a better work life balance especially when you re able to cut down on commuting time and structure your day around personal commitments Working remotely or in a hybrid model can also result in cost savings less money spent on transportation lunches or work attire Additionally flexibility allows for broader collaboration across time zones and teams expanding access to diverse perspectives and global talent Many employees also find that they re more productive and focused in environments they can tailor to their own preferences,one of the biggest advantages of flexible work at accenture is the freedom to choose where and when you work this autonomy often leads to a better work life balance especially when you're able to cut down on commuting time and structure your day around personal commitments working remotely or in a hybrid model can also result in cost savings less money spent on transportation lunches or work attire additionally flexibility allows for broader collaboration across time zones and teams expanding access to diverse perspectives and global talent many employees also find that they re more productive and focused in environments they can tailor to their own preferences,despite the clear benefits flexible work does come with its challenges most notably a lack of in-person community it can be harder to build strong relationships with coworkers when hallway chats team lunches and spontaneous brainstorming sessions are few and far between for new joiners especially onboarding and feeling truly integrated into a team can take longer without those everyday face-to-face moments visibility can also be an issue in a remote setting staying top-of-mind for mentorship sponsorship or leadership opportunities may require more intentional effort lastly without the natural boundaries of an office work and personal life can blur leading some employees to feel always on and at risk of burnout,4.0,2025-05-18,Senior Analyst,"Austin, TX",REGULAR,One of the biggest advantages of flexible work at Accenture is the freedom to choose where and when you work This autonomy often leads to a better work life balance especially when you re able to cut down on commuting time and structure your day around personal commitments Working remotely or in a hybrid model can also result in cost savings less money spent on transportation lunches or work attire Additionally flexibility allows for broader collaboration across time zones and teams expanding access to diverse perspectives and global talent Many employees also find that they re more productive and focused in environments they can tailor to their own preferences one of the biggest advantages of flexible work at accenture is the freedom to choose where and when you work this autonomy often leads to a better work life balance especially when you're able to cut down on commuting time and structure your day around personal commitments working remotely or in a hybrid model can also result in cost savings less money spent on transportation lunches or work attire additionally flexibility allows for broader collaboration across time zones and teams expanding access to diverse perspectives and global talent many employees also find that they re more productive and focused in environments they can tailor to their own preferences despite the clear benefits flexible work does come with its challenges most notably a lack of in-person community it can be harder to build strong relationships with coworkers when hallway chats team lunches and spontaneous brainstorming sessions are few and far between for new joiners especially onboarding and feeling truly integrated into a team can take longer without those everyday face-to-face moments visibility can also be an issue in a remote setting staying top-of-mind for mentorship sponsorship or leadership opportunities may require more intentional effort lastly without the natural boundaries of an office work and personal life can blur leading some employees to feel always on and at risk of burnout,US,state_code:TX
97415734,Work life balance due to schedule flexibility Mental wellness benefits,work life balance due to schedule flexibility mental wellness benefits,no career movement after multiple high rated talent discussions,3.0,2025-05-17,Analyst,"Charlotte, NC",REGULAR,Work life balance due to schedule flexibility Mental wellness benefits work life balance due to schedule flexibility mental wellness benefits no career movement after multiple high rated talent discussions,US,state_code:NC
97400708,Brand Name Brand Name Brand Name,brand name brand name brand name,talk talk talk talk talk,2.0,2025-05-16,Software Engineer,"Sunnyvale, CA",REGULAR,Brand Name Brand Name Brand Name brand name brand name brand name talk talk talk talk talk,US,state_code:CA
97400098,It has been great journey,it has been great journey,it could have been better,3.0,2025-05-16,Test Manager,"Los Angeles, CA",REGULAR,It has been great journey it has been great journey it could have been better,US,state_code:CA
97392942,Exposure to diverse industries and technologies Access to vast online training,exposure to diverse industries and technologies access to vast online training,you may be moved to a project that doesn t align with your interests or skills bench time being unassigned can be stressful or underutilized,5.0,2025-05-16,Software Developer,"Atlanta, GA",REGULAR,Exposure to diverse industries and technologies Access to vast online training exposure to diverse industries and technologies access to vast online training you may be moved to a project that doesn t align with your interests or skills bench time being unassigned can be stressful or underutilized,US,state_code:GA
97391729,Lots of flexibility networking and learning to be done at Accenture Everyone is kind and welcoming and don t mind sharing all the knowledge they have to ensure your success,lots of flexibility networking and learning to be done at accenture everyone is kind and welcoming and don t mind sharing all the knowledge they have to ensure your success,you re essentially a contractor so you have to continuously look for roles that may not even be there due to low demand so bench time is high and anxiety inducing,3.0,2025-05-16,Technology Analyst,"Atlanta, GA",REGULAR,Lots of flexibility networking and learning to be done at Accenture Everyone is kind and welcoming and don t mind sharing all the knowledge they have to ensure your success lots of flexibility networking and learning to be done at accenture everyone is kind and welcoming and don t mind sharing all the knowledge they have to ensure your success you re essentially a contractor so you have to continuously look for roles that may not even be there due to low demand so bench time is high and anxiety inducing,US,state_code:GA
